,source,title,content,description,url,published_at,tags
7,France 24,الانتخابات الأمريكية: كامالا هاريس تختار حاكم مينيسوتا تيم وولتز مرشحا لمنصب نائب الرئيس,"
اختارت كامالا هاريس حاكم مينيسوتا تيم وولتز مرشحا لمنصب نائب الرئيس، وستبدأ معه جولة تستمر عدة أيام في الولايات الحاسمة للانتخابات الرئاسية، وفق ما أعلنت وسائل إعلام محلية الثلاثاء.
وباختيارها حاكم ولاية أساسية من الغرب الأوسط الأمريكي تسعى نائبة الرئيس الحالية لتعزيز حظوظها بوجه الرئيس السابق الجمهوري دونالد ترامب.
وأعلن الموقع الإلكتروني لحملة المرشحة الديمقراطية أن كامالا هاريس وتيم وولتز ""مستعدان للفوز"".
وقالت هاريس إنها ""فخورة"" باختيار وولتز على بطاقتها لخوض الانتخابات.
وقبل ثلاثة أشهر فقط من الانتخابات الرئاسية، لم تعد كامالا هاريس ومرشحها لمنصب نائب الرئيسة يملكان الكثير من الوقت لتعريف الناخبين عليهما وإقناعهم بمنحهما أصواتهم في استحقاق الخامس من تشرين الثاني/نوفمبر.
وتيم وولتز (60 عاما) حاكم ولاية من الغرب الأوسط الأمريكي تعتبر من الولايات الأساسية في انتخابات تشرين الثاني/نوفمبر، وهو معروف لاتخاذه تدابير اعتبرت تقدمية منذ توليه هذا المنصب في 2019.
غير معروف كثيرا خارج ولاية مينيسوتا، وله مسار غير تقليدي للسياسيين الأمريكيين إذ كان سابقا أستاذ جغرافيا ومدربا لكرة القدم الأمريكية.
وسينضم اعتبارا من هذا المساء إلى هاريس في مهرجان انتخابي تعقده في فيلادلفيا بولاية بنسيلفانيا.
ومن المتوقع أن يزورا لاحقا عدة ولايات محورية أخرى، في جولة تستمر حتى السبت وستظهر تفاهمهما وانسجامهما.
وبنسيلفانيا من الولايات الأساسية التي ساهمت في فوز جو بايدن بالرئاسة في 2020 وسيتعين على الديمقراطيين الفوز بها مجددا في تشرين الثاني/نوفمبر.
وسيتيح تيم وولتز لهاريس جذب قاعدة ناخبة أوسع نطاقا من تلك التي تميل للتصويت لها أساسا كما سيساعدها على التعويض عن بعض نقاط ضعفها.
وعلق فريق حملة ترامب منددا باختيار وولتز.
وقالت كارولين ليفيت الناطقة باسم فريق حملة الرئيس السابق ""على غرار كامالا هاريس، تيم وولتز هو متطرف ليبرالي خطير، وحلم هاريس وولتز"" بتحويل الولايات المتحدة إلى صورة كاليفورنيا يشكل ""كابوس كل أمريكي"".
واضطرت المرشحة الديمقراطية للرئاسة إلى حسم خيارها في أسبوعين فقط، في حين تستغرق عملية الاختيار هذه عادة أشهرا، وذلك بعد الصدمة التي أحدثها بايدن في 21 تموز/يوليو بإعلان سحب ترشيحه لولاية ثانية وتأييده ترشيح نائبته.
في منتصف آب/أغسطس، ستحتفل هذه المرأة التي تطمح أن تصبح أول امرأة تتولى الرئاسة الأمريكية، بتنصيبها مرشحة للديمقراطيين خلال المؤتمر الوطني لحزبها في شيكاغو.
وعوضت كامالا هاريس منذ أسبوعين تخلفها عن ترامب في نوايا التصويت وشهدت ارتفاع مبالغ التبرعات، ما أعطى زخما لانطلاقة حملتها لكن سيتيعن عليها النجاح في الحفاظ على الدينامية الجيدة في الأشهر الثلاثة المقبلة.
نجحت هاريس خلال أسبوعين في تعويض تخلفها عن ترامب في نوايا التصويت وشهدت تدفق مبالغ طائلة من التبرعات، ما أعطى زخما لانطلاقة حملتها، ويتعين عليها الآن الحفاظ على هذه الدينامية في الأشهر الثلاثة المقبلة.
وحتى إعلان اختيار وولتز عاشت البلاد حالة ترقب لمعرفة مرشحها لنيابة الرئاسة حتى اللحظة الأخيرة، وكانت قائمة المرشحين المحتملين تتضمن بالأساس عدة رجال من البيض، وبينهم حاكم ولاية بنسيلفانيا جوش شابيرو والسناتور عن أريزونا رائد الفضاء السابق مارك كيلي.
وفي منتصف تموز/يوليو، بعد أيام قليلة على تعرضه لمحاولة اغتيال في بنسيلفانيا، اختار ترامب جيمس ديفيد فانس مرشحها لمنصب نائب الرئيس، وهو سناتور أربعيني عن ولاية أوهايو، وهي ولاية صناعية أيضا في الغرب الأوسط الأمريكي.
لكن فانس أثار سلسلة من السجالات في عدة قضايا، مثبتا أنه عبء على حملة الرئيس السابق أكثر مما هو ورقة رابحة بيده.
وسيتوجه فانس في الأيام المقبلة إلى بعض الولايات التي سيزورها أيضا الثنائي الديمقراطي، لحمل رسالة ترامب التي تتهم خصوصا هاريس بأنها مسؤولة عن أزمة الهجرة.
ويتهم ترامب منافسته المولودة من أب جامايكي أسود وأم هندية بأنها أصبحت مؤخرا تقدم نفسها كـ""امرأة سوداء"" لحسابات سياسية، وحملها الإثنين مسؤولية مشاكل أسواق المال الأمريكية التي تشهد حالة ذعر.
وتشير المرشحة الديمقراطية التي تركز حملتها بشكل خاص على حماية الحق في الإجهاض، بانتظام إلى تجاوزات ترامب وتلخص الانتخابات بسؤال واحد ""في أي نوع بلد نريد أن نعيش؟ بلد الحرية والتعاطف ودولة القانون أو بلد الفوضى والخوف والكراهية؟""
","
                                        كشفت وسائل إعلام أمريكية الثلاثاء أن كامالا هاريس التي أصبحت المرشحة الرسمية للديمقراطيين لمنافسة دونالد ترامب في الانتخابات الرئاسية الأمريكية، قد اختارت حاكم مينيسوتا تيم وولتز مرشحا لمنصب نائب الرئيس. ومن المتوقع أن يكون حاضرا معها في أول تجمع انتخابي للثنائي الديمقراطي مساء الثلاثاء بفيلادلفيا في بنسلفانيا.                ",https://www.france24.com/ar/%D8%A3%D9%85%D8%B1%D9%8A%D9%83%D8%A7/20240806-%D9%83%D8%A7%D9%85%D8%A7%D9%84%D8%A7-%D9%87%D8%A7%D8%B1%D9%8A%D8%B3-%D8%AA%D9%83%D8%B4%D9%81-%D8%A7%D9%84%D8%AB%D9%84%D8%A7%D8%AB%D8%A7%D8%A1-%D8%B9%D9%86-%D8%A7%D8%B3%D9%85-%D9%85%D8%B1%D8%B4%D8%AD%D9%87%D8%A7-%D9%84%D9%85%D9%86%D8%B5%D8%A8-%D9%86%D8%A7%D8%A6%D8%A8-%D8%A7%D9%84%D8%B1%D8%A6%D9%8A%D8%B3,06/08/2024 - 14:31,"

                                    أمريكا
                            "
8,France 24,الجيش الإسرائيلي يقتل 11 فلسطينيا في الضفة الغربية,,"
                                                قالت وزارة الصحة الفلسطينية إن الجيش الإسرائيلي أبلغ الجانب الفلسطيني بمقتل فلسطينيين اثنين وإصابة ثلاثة آخرين بعد اقتحامه منزلا في قرية كفر قود جنوب غرب جنين واحتجز جثامينهم، ما يرفع عدد القتلى الفلسطينيين في الضفة الغربية اليوم إلى 11 فلسطينيا. وكان الجيش الإسرائيلي قتل 5 فلسطينيين في مخيم جنين في عمليتي قصف من طائرات مسيرة على مركبتين، و4 آخرين في بلدة عقابا القريبة من طوباس.                    ",https://www.france24.com/ar/%D9%81%D9%8A%D8%AF%D9%8A%D9%88/20240806-%D9%85%D9%82%D8%AA%D9%84-12-%D9%81%D9%84%D8%B3%D8%B7%D9%8A%D9%86%D9%8A%D8%A7-%D9%81%D9%8A-%D8%AC%D9%86%D9%8A%D9%86,06/08/2024 - 15:16,"
                                    الأخبار المغاربية
                            "
9,France 24,تيم والز... من أستاذ جغرافيا وحاكم غير تقليدي إلى المرشح الديمقراطي لمنصب نائب الرئيس الأمريكي,"
أعلنت كامالا هاريس، المرشحة الديمقراطية، الثلاثاء أن تيم والز حاكم مينيسوتا، سيكون نائبا لها في  السباق الانتخابي إلى البيت الأبيض، ويملك هذا الأستاذ السابق الذي أصبح حاكما سيرة مهنية غير نمطية.
والز لا يحظى بشهرة خارج حدود ولايته مينيسوتا، لكن هذا الستيني برز في الأسابيع الأخيرة من خلال انتقاداته المتكررة لدونالد ترامب وأعضاء فريقه الذين وصفهم ""بالرجال الغريبي الأطوار"".
وسيتيح تيم والز لهاريس جذب قاعدة ناخبة أوسع نطاقا من تلك التي تميل للتصويت لها أساسا كما سيساعدها على التعويض عن بعض نقاط ضعفها.
وأثناء تجمع انتخابي صرح هذا الرجل الودود ""إننا لا نخشى من الرجال الغريبي الأطوار"" مضيفا ""ثقوا في تجربتي كمعلم، المتنمرون لا يملكون أي نفوذ"".
قضى هذا المتحدر من نبراسكا سنوات عديدة في عالم التدريس، ولا سيما لمادة الجغرافيا ومدربا لكرة القدم الأمريكية.
كما أنه قام بالتدريس لبضعة أشهر في الصين، مباشرة بعد أحداث القمع الدامي في ساحة تيانينمين في ربيع عام 1989.
بعد سنوات، صرح أمام لجنة تابعة للكونغرس الأمريكي الذي كان عضوا فيه لمدة 12 عاما ""حقيقة أن أكون في مدرسة ثانوية صينية في هذه اللحظة الحاسمة بدت لي حقا أمرا جوهريا"".
عندما سرت التكهنات الأولى حول تعيينه نائبا لكامالا هاريس، تساءل بعض مستخدمي الإنترنت عما إذا كان الثنائي في العمر نفسه، وأرفقوا رسائلهم بصورة تيم والز برأس أصلع.
ورد الحاكم على منصة ""إكس"" بحس فكاهي قائلا ""كنت مشرفا على مقصف لمدة 20 عاما. لا يمكنك القيام بهذه المهمة بدون أن تشد شعرك"".
وصار تيم والز حاكما لمينيسوتا، في كانون الثاني/يناير 2019، وهي ولاية تقع في منطقة البحيرات العظمى، على الحدود مع كندا.
وبعد مرور نحو عام، اضطر إلى إدارة أزمتين رئيسيتين: جائحة كوفيد-19 ووفاة الأمريكي الأسود جورج فلويد اختناقا بعدما ضغط شرطي أبيض بركبته على عنقه.
وارتفعت حدة التوتر في مينيابوليس، أكبر مدينة في الولاية، لتشكل انطلاق موجة كبيرة من المظاهرات المناهضة للعنصرية والتي شهدتها الولايات المتحدة لعدة أشهر.
ويتهم الجمهوريون الحاكم بالتساهل الشديد في مكافحة الجريمة، بينما يشيد الديمقراطيون في المقابل، بسجله في حماية الحق في الإجهاض.
بعد أن أصدرت المحكمة العليا في حزيران/يونيو 2022، قرارا بإلغاء الحماية الدستورية للإجهاض، التزم تيم والز بجعل ولايته ملاذا للنساء الراغبات بالإجهاض.
ثم انتقلت عيادة تقع في ولاية داكوتا الشمالية المجاورة، والتي كانت أكثر قمعية، إلى الجانب الآخر من الحدود.
في آذار/مارس 2024، شارك في أول زيارة إلى عيادة تقدم خدمات الإجهاض، قامت بها نائبة الرئيس كامالا هاريس التي يأمل الآن في الوصول معها إلى البيت الأبيض.
","
                                        تيم والز، أستاذ سابق وحاكم ولاية مينيسوتا، اختارته كامالا هاريس المرشحة الديمقراطية كشريك لها في الانتخابات الرئاسية مرشحا لمنصب نائب الرئيس في السباق إلى البيت الأبيض، وفق ما أعلنت الثلاثاء. فمن هو تيم والز ولماذا اختارته هاريس؟                ",https://www.france24.com/ar/%D8%A3%D9%85%D8%B1%D9%8A%D9%83%D8%A7/20240806-%D8%AA%D9%8A%D9%85-%D9%88%D9%88%D9%84%D8%AA%D8%B2-%D8%A7%D9%84%D8%A3%D8%B3%D8%AA%D8%A7%D8%B0-%D8%A7%D9%84%D8%B3%D8%A7%D8%A8%D9%82-%D9%88%D8%A7%D9%84%D8%AD%D8%A7%D9%83%D9%85-%D8%BA%D9%8A%D8%B1-%D8%A7%D9%84%D8%AA%D9%82%D9%84%D9%8A%D8%AF%D9%8A-%D9%8A%D8%B5%D8%A8%D8%AD-%D9%85%D8%B1%D8%B4%D8%AD-%D9%83%D8%A7%D9%85%D8%A7%D9%84%D8%A7-%D9%87%D8%A7%D8%B1%D9%8A%D8%B3-%D9%84%D9%85%D9%86%D8%B5%D8%A8-%D9%86%D8%A7%D8%A6%D8%A8-%D8%A7%D9%84%D8%B1%D8%A6%D9%8A%D8%B3-%D8%A7%D9%84%D8%A3%D9%85%D8%B1%D9%8A%D9%83%D9%8A,06/08/2024 - 19:09,"

                                    أمريكا
                            "
10,France 24,من هو تيم والتز نائب هاريس عن الديمقراطيين؟,,"
                                                قطعت المرشحة الديمقراطية للانتخابات الرئاسية الأمريكية، كامالا هاريس، الشك باليقين، وأعلنت عن اختيار تيم والتز حاكم ولاية مينيسوتا نائبا لها. فمن هو تيم والتز؟ ولماذا اختارته هاريس؟                     ",https://www.france24.com/ar/%D9%81%D9%8A%D8%AF%D9%8A%D9%88/20240806-%D9%85%D9%86-%D9%87%D9%88-%D8%AA%D9%8A%D9%85-%D9%88%D8%A7%D9%84%D8%AA%D8%B2-%D9%86%D8%A7%D8%A6%D8%A8-%D9%87%D8%A7%D8%B1%D9%8A%D8%B3-%D8%B9%D9%86-%D8%A7%D9%84%D8%AF%D9%8A%D9%85%D9%82%D8%B1%D8%A7%D8%B7%D9%8A%D9%8A%D9%86,06/08/2024 - 16:21,"

                                    أمريكا
                            "
11,France 24,حزب الله يعلن شن هجوم بالمسيرات على أهداف عسكرية في عكا بإسرائيل,,"
                                                قال حزب الله اللبناني إنه شن هجمات بطائرات مسيرة وصواريخ على شمال إسرائيل اليوم الثلاثاء، موضحا أن ردها المتوقع على قتل إسرائيل لأحد كبار قادتها الأسبوع الماضي لم يأت بعد. وذكر حزب الله أنه شن ""هجوما جويا بسرب من المسيرات الانقضاضية استهدفت مقر قيادة لواء جولاني ومقر وحدة إيجوز 621 في ثكنة شراغا شمال عكا المحتلة وأصابت أهدافها بدقة وحققت إصابات مؤكدة"".                     ",https://www.france24.com/ar/%D9%81%D9%8A%D8%AF%D9%8A%D9%88/20240806-%D8%AD%D8%B2%D8%A8-%D8%A7%D9%84%D9%84%D9%87-%D9%8A%D8%B9%D9%84%D9%86-%D8%B4%D9%86-%D9%87%D8%AC%D9%88%D9%85-%D8%A8%D8%A7%D9%84%D9%85%D8%B3%D9%8A%D8%B1%D8%A7%D8%AA-%D8%B9%D9%84%D9%89-%D8%A3%D9%87%D8%AF%D8%A7%D9%81-%D8%B9%D8%B3%D9%83%D8%B1%D9%8A%D8%A9-%D9%81%D9%8A-%D8%B9%D9%83%D8%A7,06/08/2024 - 14:42,"
                                    الأخبار المغاربية
                            "
12,France 24,ريبورتاج فرانس24: الدعوات لمغادرة لبنان تتزايد في مواجهة خطر اشتعال المنطقة,,"
                                                في مواجهة المخاوف من خطر اندلاع حرب إقليمية مرتبطة بالحرب في قطاع غزة، دعت عدة دول رعاياها إلى مغادرة الأراضي اللبنانية. المزيد في هذا التقرير من مراسلتنا في بيروت كارلا سماحة.                    ",https://www.france24.com/ar/%D9%81%D9%8A%D8%AF%D9%8A%D9%88/20240806-%D9%84%D8%A8%D9%86%D8%A7%D9%86%D9%8A%D9%88%D9%86-%D9%8A%D8%B3%D8%AA%D8%B9%D8%AC%D9%84%D9%88%D9%86-%D8%A7%D9%84%D8%B3%D9%81%D8%B1-%D9%88%D8%AA%D8%B1%D9%83-%D8%A8%D9%84%D8%A7%D8%AF%D9%87%D9%85-%D8%AE%D9%88%D9%81%D8%A7-%D9%85%D9%86-%D8%AD%D8%B1%D8%A8-%D8%B4%D8%A7%D9%85%D9%84%D8%A9,06/08/2024 - 11:07,"
                                    الأخبار المغاربية
                            "
13,France 24,تقرير: تعذيب ممنهج ومطول وتنكيل وتجويع ضد المعتقلين الفلسطينيين في السجون الإسرائيلية,,,https://www.france24.com/ar/%D9%81%D9%8A%D8%AF%D9%8A%D9%88/20240806-%D8%AA%D9%82%D8%B1%D9%8A%D8%B1-%D8%AA%D8%B9%D8%B0%D9%8A%D8%A8-%D9%85%D9%85%D9%86%D9%87%D8%AC-%D9%88%D9%88%D8%A7%D8%B3%D8%B9-%D8%A7%D9%84%D9%86%D8%B7%D8%A7%D9%82-%D9%88%D9%85%D8%B7%D9%88%D9%84-%D8%B6%D8%AF-%D8%A7%D9%84%D8%B3%D8%AC%D9%86%D8%A7%D8%A1-%D8%A7%D9%84%D9%81%D9%84%D8%B3%D8%B7%D9%8A%D9%86%D9%8A%D9%8A%D9%86,"
                06 أغسطس 2024
            ",
14,France 24,العراق: إصابة خمسة جنود أمريكيين في هجوم صاروخي على قاعدة عين الأسد,"
أصيب عدد من الأمريكيين في هجوم صاروخي استهدف قاعدة عين الأسد العسكرية في العراق يوم الإثنين، حسبما أعلن متحدث باسم البنتاغون. وقال مسؤولون أمريكيون إن ما لا يقل عن خمسة جنود أمريكيين أصيبوا في هذا الهجوم .
يأتي هذا وسط حالة تأهب في الشرق الأوسط لموجة جديدة محتملة من الهجمات من إيران وحلفائها بعد اغتيال رئيس المكتب السياسي لحركة المقاومة الإسلامية الفلسطينية (حماس) إسماعيل هنية والقائد العسكري الكبير في جماعة حزب الله اللبنانية فؤاد شكر الأسبوع الماضي.
وأفاد مصدران أمنيان عراقيان بأنه تم إطلاق صاروخين من طراز كاتيوشا على قاعدة عين الأسد في غرب العراق. وذكر أحد المصدرين أن الصاروخين سقطا داخل القاعدة. ولم يتضح ما إذا كان الهجوم مرتبطا بتهديدات إيران بالرد على اغتيال هنية.
وذكر المسؤولون الأمريكيون، الذين تحدثوا لرويترز شريطة عدم نشر هوياتهم، أن أحد الجنود أصيب بجروح خطيرة. وذكروا أن عدد الجرحى يستند إلى معلومات أولية يمكن أن تتغير.
وقال أحد المسؤولين إن ""العسكريين بالقاعدة يجرون تقييما للأضرار بعد الهجوم"".
وأفاد بيان صادر عن وزارة الدفاع الأمريكية (البنتاغون) بأن وزير الدفاع لويد أوستن ونظيره الإسرائيلي يوآف جالانت اتفقا في مكالمة هاتفية أمس الاثنين على أن الهجوم على القاعدة يمثل ""تصعيدا خطيرا"".
ونفذت الولايات المتحدة الأسبوع الماضي ضربة في العراق استهدفت أفرادا قال مسؤولون أمريكيون إنهم مسلحون كانوا يستعدون لإطلاق طائرات مسيرة وشكلوا تهديدا للقوات الأمريكية وقوات التحالف.
وتراقب الولايات المتحدة الوضع تحسبا لوفاء إيران بتعهدها بالرد على اغتيال هنية في طهران، وهو حلقة في سلسلة عمليات قتل لشخصيات كبيرة في الجماعة الفلسطينية المسلحة مع احتدام الحرب بين إسرائيل وحماس في غزة.
وقال البنتاغون إنه سينشر مقاتلات إضافية وسفنا حربية تابعة للبحرية في الشرق الأوسط، في الوقت الذي تسعى فيه واشنطن إلى تعزيز الدفاعات في أعقاب التهديدات بالرد من إيران وحليفتيها حماس وحزب الله.
ويعد العراق حليفا نادرا لكل من الولايات المتحدة وإيران، ويستضيف 2500 جندي أمريكي ولديه فصائل مسلحة مدعومة من إيران مرتبطة بقواته الأمنية. وشهد العراق هجمات انتقامية متزايدة منذ اندلاع الحرب بين إسرائيل وحماس في أكتوبر تشرين الأول.
وقالت مصادر عراقية إن بغداد تريد أن تبدأ قوات التحالف العسكري بقيادة الولايات المتحدة في الانسحاب في سبتمبر أيلول وإنهاء عمل التحالف رسميا بحلول سبتمبر أيلول 2025، مع احتمال بقاء بعض القوات الأمريكية بصفة استشارية تم التفاوض عليها مؤخرا.
وتواجه بغداد صعوبة في كبح جماح الجماعات المسلحة، المدعومة من إيران، والتي هاجمت القوات الأمريكية في العراق وفي سوريا المجاورة عشرات المرات منذ السابع من أكتوبر تشرين الأول.
وتحدث رئيس الوزراء العراقي محمد شياع السوداني يوم الأحد مع وزير الخارجية الأمريكي أنتوني بلينكن.
وقال مسؤول عراقي إن بلينكن طلب من السوداني المساعدة في تهدئة التوتر الإقليمي من خلال المساهمة في إقناع إيران بتخفيف ردها على الضربة الإسرائيلية في طهران التي أدت إلى مقتل هنية الأسبوع الماضي.
والجنرال مايكل ""إريك"" كوريلا، قائد القيادة المركزية للجيش الأمريكي، موجود حاليا في الشرق الأوسط. وقال أحد المسؤولين الأمريكيين إن كوريلا يتحدث مع الحلفاء لضمان التنسيق في حالة شن هجوم إيراني على إسرائيل.
فرانس24/ أ ف ب/ رويترز","
                                        تعرضت قاعدة عين الأسد العسكرية في العراق لهجوم صاروخي أدى إلى إصابة خمسة جنود من الأمريكيين من بينهم جندي يعاني من إصابات خطيرة. يأتي الهجوم وسط تصاعد التوترات الإقليمية وازدياد المخاوف من ردود إيرانية محتملة على إسرائيل بعد اغتيال رئيس المكتب السياسي لحركة حماس إسماعيل هنية في طهران، وكذلك القيادي البارز في حزب الله فؤاد شكر في بيروت قبل أيام. وفي محادثة تليفونية بين وزير الدفاع الامريكي لويد أوستن ونظيره الإسرائيلي يوآف جالانت اتفق الرجلان على أن الهجوم على القاعدة يمثل ""تصعيدا خطيرا"".                ",https://www.france24.com/ar/%D8%A7%D9%84%D8%B4%D8%B1%D9%82-%D8%A7%D9%84%D8%A3%D9%88%D8%B3%D8%B7/20240805-%D9%87%D8%AC%D9%88%D9%85-%D8%B5%D8%A7%D8%B1%D9%88%D8%AE%D9%8A-%D8%B9%D9%84%D9%89-%D9%82%D8%A7%D8%B9%D8%AF%D8%A9-%D8%B9%D9%8A%D9%86-%D8%A7%D9%84%D8%A3%D8%B3%D8%AF-%D9%81%D9%8A-%D8%A7%D9%84%D8%B9%D8%B1%D8%A7%D9%82-%D9%88%D8%A5%D8%B5%D8%A7%D8%A8%D8%A9-%D8%A3%D9%85%D8%B1%D9%8A%D9%83%D9%8A%D9%8A%D9%86,06/08/2024 - 01:13,"

                                    الشرق الأوسط
                            "
