,source,title,content,description,url,published_at,tags
0,France 24,وكالة ناسا ترسل مقطعا من موسيقى الهيب هوب إلى كوكب الزهرة,,"
                                                على كوكب يعتبره العلماء من بين أكثر المواقع عدائية في النظام الشمسي، وجد فريقان منفصلان من الباحثين أدلة حيوية لاحتمال وجود شكل ما من أشكال الحياة على كوكب الزهرة. في هذا السياق أرسلت وكالة الفضاء الأمريكية «ناسا»، أغنية من نوع «هيب هوب» لمغنية الراب الأمريكية ميسي إيليوت  إلى هذا  الكوكب.                    ",https://www.france24.com/ar/%D9%81%D9%8A%D8%AF%D9%8A%D9%88/20240720-%D9%88%D9%83%D8%A7%D9%84%D8%A9-%D9%86%D8%A7%D8%B3%D8%A7-%D8%AA%D8%B1%D8%B3%D9%84-%D9%85%D9%82%D8%B7%D8%B9%D8%A7-%D9%85%D9%86-%D9%85%D9%88%D8%B3%D9%8A%D9%82%D9%89-%D8%A7%D9%84%D9%87%D9%8A%D8%A8-%D9%87%D9%88%D8%A8-%D8%A5%D9%84%D9%89-%D9%83%D9%88%D9%83%D8%A8-%D8%A7%D9%84%D8%B2%D9%87%D8%B1%D8%A9,21/07/2024 - 00:25,
1,France 24,"مايكروسوفت: العطل العالمي للإنترنت أثر على 8,5 مليون جهاز يعمل بنظام ويندوز","
أثر الخلل التقني العالمي المتعلق بتحديث برمجي أجرته شركة كراود سترايك للأمن السيبراني على 8,5 مليون جهاز يعمل بنظام ويندوز الذي تنتجه شركة مايكروسوفت التي أعلنت الخبر السبت.
وجاء في تدوينة للشركة الأمريكية ""تشير تقديراتنا الحالية إلى أن تحديث كراود سترايك أثر على 8,5 مليون جهاز يعمل بنظام ويندوز أو أقل من واحد بالمائة من كل الأجهزة التي تعمل بهذا النظام"".
وذكرت مايكروسوفت أن كراود سترايك تساعد في تطوير حل قابل للتطبيق على نطاق أوسع من شأنه أن يمكن البنية التحتية في مايكروسوفت من تسريع عملية الإصلاح، مضيفة أنها تعمل مع كل من أمازون ويب سيرفيسز وغوغل كلاود بلاتفورم للتعاون في تطوير ""أساليب أكثر فعالية"".
وواجه مسافرون على متن رحلات جوية في أنحاء العالم تأخيرات وإلغاءات ومشكلات في إجراءات تسجيل الدخول مع تعرض مطارات وخطوط طيران لمشكلات تقنية كبرى في خدمات تكنولوجيا المعلومات مما أثر أيضا على قطاعات عدة من البنوك إلى وسائل الإعلام.
","
                                        قدرت مايكروسوفت السبت عدد الأجهزة التي تأثرت بتحديث شركة كراودسترايك بنحو 8,5 مليون جهاز يعمل بنظام ويندوز، ما يعني أقل من واحد بالمئة من كل الأجهزة التي تعمل بنظام التشغيل الذي تنتجه الشركة العملاقة. وتسبب تحديث برمجي من شركة الأمن السيبراني العالمية كراود سترايك، في إحداث مشكلات في الأنظمة أدت إلى تعطل رحلات جوية واضطرار هيئات إعلامية إلى قطع البث ومنع المستخدمين من الوصول إلى خدمات مثل الرعاية الصحية أو الخدمات المصرفية.                ",https://www.france24.com/ar/%D9%85%D8%AC%D8%AA%D9%85%D8%B9/20240721-%D9%85%D8%A7%D9%8A%D9%83%D8%B1%D9%88%D8%B3%D9%88%D9%81%D8%AA-%D8%A7%D9%84%D8%B9%D8%B7%D9%84-%D8%A7%D9%84%D8%B9%D8%A7%D9%84%D9%85%D9%8A-%D9%84%D9%84%D8%A5%D9%86%D8%AA%D8%B1%D9%86%D8%AA-%D8%A3%D8%AB%D8%B1-%D8%B9%D9%84%D9%89-8-5-%D9%85%D9%84%D9%8A%D9%88%D9%86-%D8%AC%D9%87%D8%A7%D8%B2-%D9%8A%D8%B9%D9%85%D9%84-%D8%A8%D9%86%D8%B8%D8%A7%D9%85-%D9%88%D9%8A%D9%86%D8%AF%D9%88%D8%B2,21/07/2024 - 14:58,"

                                    مجتمع
                            "
2,France 24,"قضاء بنغلادش يقلص نظام الحصص لكن الطلاب ""لن يوقفوا احتجاجاتهم""","
أعلنت مجموعة ""طلاب بنغلادش ضد التمييز"" المنظمة للمظاهرات التي تهز البلاد احتجاجا على نظام الحصص في الوظائف العامة، الأحد أنها لن توقف احتجاجاتها على الرغم من قرار المحكمة العليا القاضي بخفض الحصص المثيرة للجدل.
وقال المتحدث باسم المجموعة لوكالة الأنباء الفرنسية طالبا عدم كشف اسمه، ""لن نوقف احتجاجاتنا إلى أن تصدر الحكومة أمرا يعكس مطالبنا"".
يأتي هذا الإعلان على الرغم من أن المحكمة العليا قضت الأحد بتقليص نظام الحصص في الوظائف العامة بعدما أثارت معاودة العمل به الشهر الماضي الاضطرابات التي هزت البلاد وأوقعت 151 قتيلا.
وقال المدعي العام أبو محمد أمين الدين إن المحكمة العليا أعلنت أن قرار إعادة فرض نظام الحصص ""غير قانوني""، مشيرا إلى أن 5% فقط من الوظائف العامة ستبقى مخصصة لأبناء قدامى المحاربين في حرب الاستقلال و2% للفئات الأخرى المستفيدة من النظام.
وفي وقت سابق أعلنت بنغلادش تمديد حظر التجول الأحد للسيطرة على الاحتجاجات العنيفة .
وقام الجنود بدوريات في شوارع العاصمة دكا، مركز الاحتجاجات التي تحولت إلى اشتباكات بين المحتجين وقوات الأمن.
وتم تعليق خدمات الإنترنت والرسائل النصية في بنغلادش منذ الخميس، بينما قامت الشرطة بقمع المتظاهرين الذين تحدوا الحظر المفروض على التجمعات العامة.
وأفادت وسائل إعلام محلية أن حظر التجول الذي تقرر في وقت متأخر الجمعة تم تمديده حتى الساعة الثالثة مساء (09:00 بتوقيت غرينتش) الأحد، حتى بعد جلسة المحكمة العليا، وسيستمر ""لفترة غير محددة"" بعد رفعه لمدة ساعتين كي يتسنى للناس الحصول على احتياجاتهم.
كما تم إغلاق الجامعات والكليات منذ الأربعاء.
ويذكر أن الاضطرابات اندلعت على مستوى البلاد في أعقاب غضب الطلاب ضد حصص الوظائف الحكومية التي تضمنت تخصيص 30 بالمئة من الوظائف لعائلات أولئك الذين ناضلوا من أجل الاستقلال عن باكستان.
وكانت حكومة رئيسة الوزراء الشيخة حسينة قد ألغت نظام الحصص في عام 2018، لكن المحكمة أعادته الشهر الماضي.
كما أن الاحتجاجات، وهي الأكبر منذ إعادة انتخاب حسينة لرابع فترة حكم على التوالي هذا العام، تغذيها أيضا معدلات البطالة المرتفعة بين الشباب، الذين يشكلون ما يقرب من 20 بالمئة من السكان.
ورفعت وزارة الخارجية الأمريكية السبت تحذيرها من السفر إلى بنغلادش إلى المستوى الرابع، وحثت المواطنين الأمريكيين على عدم السفر إلى الدولة الواقعة في جنوب آسيا.","
                                        على الرغم من قرار المحكمة العليا القاضي بخفض الحصص المثيرة للجدل، أكدت مجموعة ""طلاب بنغلادش ضد التمييز"" المنظمة للمظاهرات التي تهز البلاد، أنها لن توقف احتجاجاتها. وسقط ما لا يقل عن 151 قتيلا في احتجاجات على مستوى البلاد في أعقاب غضب الطلاب ضد حصص الوظائف الحكومية التي تضمنت تخصيص 30 بالمئة من الوظائف لعائلات أولئك الذين ناضلوا من أجل الاستقلال عن باكستان.                ",https://www.france24.com/ar/%D8%A2%D8%B3%D9%8A%D8%A7/20240721-%D8%A8%D9%86%D8%BA%D9%84%D8%A7%D8%AF%D8%B4-%D8%AA%D9%85%D8%AF%D8%AF-%D8%AD%D8%B8%D8%B1-%D8%A7%D9%84%D8%AA%D8%AC%D9%88%D9%84-%D9%84%D9%84%D8%B3%D9%8A%D8%B7%D8%B1%D8%A9-%D8%B9%D9%84%D9%89-%D8%A7%D8%AD%D8%AA%D8%AC%D8%A7%D8%AC%D8%A7%D8%AA-%D8%B9%D9%86%D9%8A%D9%81%D8%A9-%D8%A3%D8%B3%D9%81%D8%B1%D8%AA-%D8%B9%D9%86-%D9%88%D9%82%D9%88%D8%B9-%D8%B9%D8%B4%D8%B1%D8%A7%D8%AA-%D8%A7%D9%84%D9%82%D8%AA%D9%84%D9%89,21/07/2024 - 08:30,"

                                    آسيا
                            "
3,France 24,روسيا تعلن منع قاذفتين أمريكيتين من انتهاك حدودها في القطب الشمالي,"
منعت طائرات مقاتلة روسية قاذفتين استراتيجيتين أمريكيتين من انتهاك حدود روسيا فوق بحر بارنتس، وفق ما أفادت موسكو الأحد.
في هذا السياق، أكدت وزارة الدفاع الروسية في بيان أنه بعد رصد اقتراب هدف جوي من الحدود الروسية، دفع الجيش بطائرات مقاتلة من طراز ميغ 29 وميغ 31 والتي حددت أنهما قاذفتان استراتيجيتان أمريكيتان من طراز بي-52إتش.
وأضافت الوزارة موضحة ""مع اقتراب المقاتلات الروسية، عدلت القاذفتان الاستراتيجيتان الأمريكيتان مسار طيرانهما... ثم ابتعدتا عن حدود دولة روسيا الاتحادية"".
وقالت إن الطائرات الحربية الروسية نفذت عمليات التحليق وفقا للقواعد الدولية المتعلقة باستخدام المجال الجوي فوق المياه المحايدة.
في المقابل، لم ترد وزارة الدفاع الأمريكية (البنتاغون) حتى الآن على طلب التعليق خارج ساعات العمل الرسمية.
وسبق أن أعلنت روسيا عن وقائع مماثلة، إذ قالت إن طائرات عسكرية تابعة لدول حلف شمال الأطلسي حلقت بالقرب من حدودها في توقيت يشهد توترا محتدما خلال الحرب في أوكرانيا.
من جانبها تقول واشنطن إنها تنفذ طلعات جوية فوق مياه دولية في عمليات تؤكد أنها تجريها في المجال الجوي المحايد وطبقا للقانون الدولي.
","
                                        أعلنت روسيا الأحد إرسال طائرات مقاتلة لمنع قاذفتين أمريكيتين استراتيجيتين من عبور حدودها فوق بحر بارنتس في القطب الشمالي. وسبق أن حذرت موسكو في حزيران/يونيو من أن طلعات المسيرات الأمريكية فوق البحر الأسود قد تؤدي إلى اشتباك عسكري ""مباشر"". وكثيرا ما ينفذ الجيش الأمريكي طلعات جوية فوق مياه دولية في عمليات يؤكد أنه يجريها في المجال الجوي المحايد وطبقا للقانون الدولي.                ",https://www.france24.com/ar/%D8%A3%D9%88%D8%B1%D9%88%D8%A8%D8%A7/20240721-%D8%B1%D9%88%D8%B3%D9%8A%D8%A7-%D8%AA%D8%B9%D9%84%D9%86-%D9%85%D9%86%D8%B9-%D9%82%D8%A7%D8%B0%D9%81%D8%AA%D9%8A%D9%86-%D8%A3%D9%85%D8%B1%D9%8A%D9%83%D9%8A%D8%AA%D9%8A%D9%86-%D9%85%D9%86-%D8%A7%D9%86%D8%AA%D9%87%D8%A7%D9%83-%D8%AD%D8%AF%D9%88%D8%AF%D9%87%D8%A7-%D9%81%D9%8A-%D8%A7%D9%84%D9%82%D8%B7%D8%A8-%D8%A7%D9%84%D8%B4%D9%85%D8%A7%D9%84%D9%8A,21/07/2024 - 16:18,"

                                    أوروبا
                            "
4,France 24,صحافيان بوكالة الأنباء الفرنسية أصيبا في جنوب لبنان يحملان الشعلة الأولمبية,"
في مدينة فانسين بإحدى ضواحي العاصمة الفرنسية، ظهرت مصورة وكالة الأنباء الفرنسية كريستينا عاصي التي بُترت ساقها اليمنى في ضربة إسرائيلية على جنوب لبنان في تشرين الأول/أكتوبر 2023 استهدفت صحافيين، حاملة الشعلة الأولمبية برفقة مصور الفيديو ديلان كولنز الذي أصيب أيضا في الضربة، في تحية ""لجميع الصحافيين وزملائنا وأصدقائنا الذين قتلوا هذا العام"".
وقالت المصورة الصحافية اللبنانية كريستينا عاصي جالسة على كرسي متحرك بعد اجتياز مسافة 200 متر كان من المقرر أن تحمل الشعلة الأولمبية خلالها في شوارع فانسان مع زميلها الأمريكي ديلان كولنز، ""رؤية جميع هؤلاء يصفقون بعد نجاتنا من هجوم مستهدف كصحافيين أمر مذهل ويفرح القلب"".
وأضافت ""آمل أن يكون ما قمنا به اليوم بمثابة تكريم لجميع الصحافيين وزملائنا وأصدقائنا الذين قتلوا هذا العام"".
وتابعت ""كنت أتمنى لو كان عصام (عبد الله، وهو صحافي في وكالة رويترز قُتل في الهجوم) وجميع الزملاء الذين فقدناهم، هنا اليوم ليشاهدوا هذا الأمر. وكنت أتمنى لو لم تكن مشاركة الصحافيين وتمثيلهم يتطلبان هجوما مماثلا"".
وحضر حوالي 50 صحافيا من وكالة الأنباء الفرنسية الأحد لتشجيعهما والتصفيق لهما أثناء مرورهما.
وكانت كريستينا عاصي ذات الـ29 عاما ضحية قذيفة في 13 تشرين الأول/أكتوبر 2023، أثناء تغطيتها مع ستة من زملائها الاشتباكات على الحدود اللبنانية الاسرائيلية بين الجيش وحزب الله.
وأدت القذيفة التي أطلقتها دبابة إسرائيلية بحسب تحقيق معمق أجرته وكالة الأنباء الفرنسية، إلى مقتل عبدالله وإصابة ستة صحافيين كانوا موجودين في الموقع، من بينهم عاصي التي أصيبت بجروح خطرة أدت إلى بتر ساقها اليمنى.
وأصيب ديلان كولنز الابلغ من العمر 36 عاما أيضا في ذلك اليوم. وكان قد أصيب قبل فترة وجيزة خلال تغطيته الحرب في أوكرانيا.
أما الخطوة المقبلة لعاصي فهي ""التركيز على عملية إعادة التأهيل التي سأخضع لها للوقوف مجددا. بهذه الطريقة سأحصل على العدالة"".
وقال مدير الأخبار في وكالة الأنباء الفرنسية فيل شيتويند ""كان من المؤثر للغاية مشاهدة كريستينا وديلان يحملان الشعلة. شجاعتهما في مواجهة الشدائد التي لا يمكن تصورها هي تعبير بالغ عن الروح الأولمبية. الجميع في وكالة الأنباء الفرنسية فخور"" بهما.
","
                                        جالسة على كرسي متحرك، حملت المصورة الصحافية اللبنانية كريستينا عاصي التي بترت ساقها في ضربة إسرائيلية، الشعلة الأولمبية الأحد في فانسين، إحدى ضواحي العاصمة الفرنسية، إلى جانب زميلها ديلان كولنز وبحضور حوالي 50 شخصا من زملائها قدموا لتشجيعهما. وكان الصحافيان اللذان يشتغلان بوكالة الأنباء الفرنسية ضحية قذيفة في 13 تشرين الأول/أكتوبر 2023، أثناء تغطية الاشتباكات على الحدود اللبنانية الإسرائيلية بين الجيش وحزب الله، تسببت في بتر عاصي ساقها اليمنى ومقتل صحافي وكالة رويترز عصام عبد الله.                ",https://www.france24.com/ar/%D8%B1%D9%8A%D8%A7%D8%B6%D8%A9/20240721-%D8%B5%D8%AD%D8%A7%D9%81%D9%8A%D8%A7%D9%86-%D8%A8%D9%88%D9%83%D8%A7%D9%84%D8%A9-%D8%A7%D9%84%D8%A3%D9%86%D8%A8%D8%A7%D8%A1-%D8%A7%D9%84%D9%81%D8%B1%D9%86%D8%B3%D9%8A%D8%A9-%D8%A3%D8%B5%D9%8A%D8%A8%D8%A7-%D9%81%D9%8A-%D8%AC%D9%86%D9%88%D8%A8-%D9%84%D8%A8%D9%86%D8%A7%D9%86-%D9%8A%D8%AD%D9%85%D9%84%D8%A7%D9%86-%D8%A7%D9%84%D8%B4%D8%B9%D9%84%D8%A9-%D8%A7%D9%84%D8%A3%D9%88%D9%84%D9%85%D8%A8%D9%8A%D8%A9,21/07/2024 - 17:50,"

                                    رياضة
                            "
5,France 24,كامالا هاريس أمام فرصة جديدة لصناعة التاريخ بعد انسحاب بايدن من الانتخابات,,,https://www.france24.com/ar/%D8%A3%D9%85%D8%B1%D9%8A%D9%83%D8%A7/20240721-%D9%83%D8%A7%D9%85%D8%A7%D9%84%D8%A7-%D9%87%D8%A7%D8%B1%D9%8A%D8%B3-%D8%A3%D9%85%D8%A7%D9%85-%D9%81%D8%B1%D8%B5%D8%A9-%D8%AC%D8%AF%D9%8A%D8%AF%D8%A9-%D9%84%D8%B5%D9%86%D8%A7%D8%B9%D8%A9-%D8%A7%D9%84%D8%AA%D8%A7%D8%B1%D9%8A%D8%AE-%D8%A8%D8%B9%D8%AF-%D8%A7%D9%86%D8%B3%D8%AD%D8%A7%D8%A8-%D8%A8%D8%A7%D9%8A%D8%AF%D9%86-%D9%85%D9%86-%D8%A7%D9%84%D8%A7%D9%86%D8%AA%D8%AE%D8%A7%D8%A8%D8%A7%D8%AA,"
                21 يوليو 2024
            ",
