,source,author,title,content,description,url,image_url?,published_at,tags
0,France 24,No Author,"فرنسا: عنف جنسي في مدرسة بيتارام الكاثوليكية... هل كان فرانسوا بايرو ""يجهل ما يحدث""؟","
من الجناح الأيسر للجمعية الوطنية، توجه النائب عن حزب ""فرنسا الأبية"" لإقليم فال دواز، بول فانييه الثلاثاء 11 فبراير/شباط، مخاطبا رئيس الوزراء فرانسوا بايرو، قائلا: ""منذ منتصف التسعينيات، كنت على علم بما يحدث. وعلى الرغم من أن مهامك المتعاقبة آنذاك، كانت تسمح لك بحماية هؤلاء الأطفال، اخترت الصمت لمدة عشرين عاما"".
وقبلها بأيام، كانت صحيفة ميديا بارت الإلكترونية، قد كشفت مدعومة بوثائق وشهادات، عن ""أكاذيب بايرو من أجل حماية مؤسسة كاثوليكية"" في قضية اغتصاب قاصرين.
وتعد مؤسسة نوتردام دو بيتارام، مدرسة داخلية، تقع في منطقة بيارن بجنوب غرب فرنسا، أرسل إليها رئيس الوزراء الحالي العديد من أبنائه في التسعينيات للدراسة، وكانت زوجته إليزابيت تلقي فيها دروسا خاصة بالتربية المسيحية.
وباتت هذه المؤسسة هدفا لـ112 تقريرا و72 شكوى بشأن حالات اغتصاب وعنف ضد قاصرين اُرتكبت في الفترة ما بين السبعينيات والعام 2010. ووفقا للصحيفة المستقلة، كان فرانسوا بايرو على علم بالاتهامات. وهو ما ينفيه بشدة.
وأصر بايرو الثلاثاء ردا على اتهامات النائب عن حزب ""فرنسا الأبية"" قائلا: ""أؤكد أنه لم يتم أبدا إبلاغي بأي شيء يتعلق بالعنف، وبالأخص بأي عنف جنسي. إطلاقا""، مشيرا على وجه الخصوص أنه كان قد غادر وزارة التربية الوطنية عندما تم تقديم أول شكوى ضد المؤسسة ""في العام 1998"".
وأضاف أنه كان من المستحيل أن يرسل أبناءه للدراسة في مؤسسة ""حيث كانت هناك شبهة أو تأكيد لحدوث أشياء من هذا القبيل"". وأنهى فرانسوا بايرو جوابه بالإعلان عن رفع شكوى بداعي التشهير.
لكن في الليلة ذاتها، أضافت وسيلة الإعلام الاستقصائية تحقيقا جديدا تحت عنوان: ""اغتصابات بيتارام: بايرو يكذب... ميديابارت تنشر وثائق جديدة"".
وكشفت ميديابارت أن ""رئيس الوزراء لم يتلق تنبيها واحدا فحسب، بل ثلاثة تنبيهات على الأقل"". ونشرت الصحيفة شهادة أحد الضحايا، جان ماري ديلبوس، البالغ من العمر الآن 78 عاما. وإضافة إلى قصته، أرفقت الصحيفة إقرارا باستلام رسالة بعثها جان ماري عن طريق البريد المسجل إلى فرانسوا بايرو في مارس/آذار 2024، يروي فيها حالات اغتصاب تعرض لها على يد راهب في نوتردام دو بيتارام، بين عامي 1957 و1961.
وكان فرانسوا بايرو عمدة مدينة بو آنذاك، وله مسار سياسي طويل في منطقة بيارن، حيث شغل، من بين مسؤوليات أخرى، منصب نائب ورئيس المجلس العام أيضا. ولم يتلق جان ماري ديلبوس أي رد منذ ذلك الحين.
وفي أكتوبر/تشرين الأول 2023، تم إنشاء جمعية خاصة بالطلاب السابقين في المؤسسة، والذين بلغوا سن الرشد حاليا، تكفلت بنقل العديد من الشهادات التي تتهم رهبانا ومشرفين وبعض المقيمين بالعنف الجسدي واعتداءات جنسية ضد أطفال. وتعود أقدم الحقائق إلى الخمسينيات، وأحدثها إلى العقد الأول من القرن الحادي والعشرين.
وقبلها بعدة أعوام، في مايو/أيار 1996، قام فرانسوا بايرو بزيارة رسمية إلى مدرسة بيتارام بعد شكوى قدمها والد طالب يبلغ من العمر 14 عاما -ويدرس في نفس صف ابن فرانسوا بايرو- والذي تعرض للضرب المبرح لدرجة أنه فقد جزءا من سمعه. وأكد السياسي المخضرم حينها دعمه للمؤسسة، بحسب تعليقات جمعتها في تلك الفترة صحيفة ""سود وست"" الإقليمية، والتي كشف عن أرشيفها أيضا موقع صحيفة ميديابارت.
وصرح بايرو الذي كان يجمع آنذاك بين مهام وزير التربية ورئيس المجلس العام لإقليم بيرينيه أتلانتيك قائلا: ""أحس العديد من سكان بيارن بهذه الهجمات [ضد بيتارام] وانتابهم شعور مؤلم وإحساس بالظلم"". وكانت وسائل الإعلام قد تطرقت حينها إلى هذه القضية وذاع صيتها على الصعيد الوطني أيضا.
وبدورها، تحدثت معلمة سابقة في المؤسسة، عن عنف جسدي عانى منه بعض التلاميذ في تلك الفترة الزمنية. وقالت إنها أبلغت بايرو وزوجته بذلك.
وفي مقابلة أجرتها معها صحيفة لو بوان في يوليو/تموز الماضي، أدلت المعلمة السابقة بشهادتها قائلة: ""لقد قلل من خطورة الأمر وقال إنني كنت بلا شك أبالغ قليلا"".
بعدها بعامين، أي في العام 1998، تمت إحالة الأب كاريكارت، مدير نوتردام دو بيتارام، إلى التحقيق بتهمة الاغتصاب. وهي حالة قضائية كان فرانسوا بايرو على دراية بها مرة أخرى، إذ التقى في ذلك الوقت، وفق ميديابارت، بقاضي التحقيق الذي كان يتولى القضية لمناقشة الملف. وهو لقاء نفاه الزعيم السياسي في البداية، قبل أن يعترف به.
إلى ذلك، ومن بين عناصر الدفاع الأخرى التي تبناها فرانسوا بايرو، التأكيد على أنه كان قد ترك وزارة التربية عند تقديم الشكوى الأولى ضد المؤسسة الكاثوليكية. لكن، ذكرت صحيفة ميديابارت أنه خلال الإدانة الأولى للمشرف العام على خلفية أعمال عنف، في يونيو/حزيران 1996، ""كان بايرو لايزال بالفعل في الحكومة"". إذ إنه شغل المنصب من مارس/آذار 1993 إلى يونيو/حزيران 1997.
وفي اليوم التالي، الأربعاء، عندما كشفت صحيفة ميديابارت حقائق جديدة، عاد بول فانييه النائب عن حزب ""فرنسا الأبية"" ليتهم رئيس الوزراء مجددا، قائلا: ""كذب وزير أمام النواب، وخاصة رئيس الوزراء، خطير للغاية، وأن تتعلق الأكاذيب بقضية جنائية ضد أطفال يتجاوز ما هو غير مقبول. هل ستتحمل كل التبعات وتقدم استقالتك؟""
وحذا حذوه علنا العديد من زملائه في ""فرنسا الأبية""، على غرار مانويل بومبار الذي صرح صباح الخميس على إذاعة إر تي إل RTL قائلا: ""أعتقد أن السياسي الذي يتستر على حقائق بهذه الخطورة والذي يغرق في أكذوبة كهذه، لا يمكنه أن يبقى رئيسا للوزراء بكل بساطة"". كما عبر بومبار أيضا عن شعوره بالإهانة على موقع إكس بسبب ""عدم وجود رد فعل من المعسكر الماكروني (نسبة للرئيس ماكرون) واليمين واليمين المتطرف"" بشأن هذه القضية.
وفي اليوم السابق، بعث نواب من الحزب الاشتراكي عن إقليم بيرينيه-أتلانتيك وهم كوليت كابدوفياي وبية دوفو وإنياكي إيشانيز برسالة مفتوحة إلى رئيس الوزراء يدعونه فيها إلى ""قول الحقيقية، مهما كانت تلك الحقيقة"".
من جهته، وفي بيان نشره على موقعه الرسمي، طالب الحزب الاشتراكي ""بتسليط الضوء على هذه الجرائم وعلى ما كان يعرفه فرانسوا بايرو عن هذا الملف"".
والخميس، قال بول فانييه على منصة إكس إنه دعا إلى تشكيل لجنة تحقيق برلمانية ""لتسليط الضوء على الإخفاقات المتعلقة بمراقبة المؤسسات الخاصة المتعاقدة مع الدولة"".
وإضافة إلى الوسط السياسي، طالت ردود الفعل شبكات التواصل الاجتماعي أيضا، على غرار ما قالته إحدى المتفاعلات على منصة إكس التي قالت ""إن بايرو كان على علم بأن مؤسسة نوتردام دو بيتارام مثلت عذابا حقيقيا لتلاميذها"". وردا على ذلك، روت متفاعلة أخرى، وهي أستاذة الاقتصاد والعلوم الاجتماعية، كيف ""حطمت"" هذه المؤسسة جدها، الذي أُرسل إلى هناك وهو في الثامنة من عمره.
وتابعت قائلة: ""إن عواقب طفولة تعرضت للإساءة وخيمة، بل إن تأثيراتها تطال حتى الأجيال اللاحقة"". ""إن تصرفات بايرو المتهورة هي بمثابة صفعة على الوجه"".
وأكد جان ماري ديلبوس قائلا: ""كلهم كانوا يعلمون، لكنهم ظلوا صامتين"". كان ذلك يوم الأربعاء على قناة بي إف إم التلفزيونية الخاصة، خلال مسيرة مناهضة للجرائم ضد الأطفال أمام المؤسسة التعليمية الكاثوليكية نوتردام دو بيتارام التي تم تغيير اسمها إلى ""الغصن الجميل"" Le Beau Rameau في العام 2009.
ويشار إلى أن أولى الشكاوى، تقدم بها آلان إسكوير، وهو تلميذ سابق في هذه المؤسسة. وقد تحدث لصحيفة ميديابارت بداية فبراير/شباط الجاري عن ""عدة لمسات ذات طابع جنسي على أطفال تتراوح أعمارهم بين 8 و13 عاما""، والذين أصبحوا راشدين اليوم، يقولون أيضا إنهم ""تعرضوا للضرب المبرح والاستمناء القسري أو الاغتصاب"" من قبل المشرفين أو الرهبان في تلك المؤسسة.
هذا، وأعلن إسكوير الخميس على قناة فرانس أنفو أنه سيقدم في الأسابيع المقبلة مجموعة أخرى ""معتبرة"" من الشكاوى الجديدة ضد المؤسسة التعليمية الكاثوليكية بيتارام. ويقول إنه سينتظر ""الانفجار"".
","
                                        بينما نفى فرانسوا بايرو أي علم بأعمال عنف أو اعتداءات جنسية داخل مؤسسة نوتردام دو بيتارام التعليمية الكاثوليكية بمنطقة بِيارن في جنوب غرب فرنسا، حيث درس العديد من أبنائه، نشرت صحيفة ميديابارت الإلكترونية وثائق وشهادات جديدة الأربعاء تثبت العكس. وفيما يطالب الضحايا بالعدالة، ينادي جزء من اليسار السياسي الفرنسي باستقالة رئيس الوزراء.                ",https://www.france24.com/ar/%D9%81%D8%B1%D9%86%D8%B3%D8%A7/20250214-%D9%81%D8%B1%D9%86%D8%B3%D8%A7-%D8%B9%D9%86%D9%81-%D8%AC%D9%86%D8%B3%D9%8A-%D9%85%D8%AF%D8%B1%D8%B3%D8%A9-%D8%A8%D9%8A%D8%AA%D8%A7%D8%B1%D8%A7%D9%85-%D9%83%D8%A7%D8%AB%D9%88%D9%84%D9%8A%D9%83%D9%8A%D8%A9-%D9%81%D8%B1%D8%A7%D9%86%D8%B3%D9%88%D8%A7-%D8%A8%D8%A7%D9%8A%D8%B1%D9%88-%D8%A7%D9%86%D8%AA%D9%87%D8%A7%D9%83%D8%A7%D8%AA-%D8%AA%D8%B3%D8%AA%D8%B1,https://s.france24.com/media/display/ad4ac546-ea20-11ef-a1f7-005056bfb2b6/w:1280/p:16x9/000_36XM7GP.jpg,No Published Date,فرنسا
1,France 24,No Author,فرنسا: اتهام رئيس باريس سان جرمان ناصر الخليفي بالتواطؤ في إساءة استخدام السلطة,"
في تحقيق على صلة بصندوق الثروة السيادي القطري، وجه القضاء الفرنسي الاتهام لرئيس نادي باريس سان جرمان ناصر الخليفي بالتواطؤ في إساءة استخدام السلطة.
وقال مصدر قضائي إن الخليفي اتُهم في الخامس من شباط/فبراير بالتواطؤ في شراء أصوات والإضرار بحرية التصويت، وذلك على خلفية تبديل الصندوق الاستثماري القطري تصويته في مجلس إدارة مجموعة لاغاردير عام 2018، وطلب المصدران عدم ذكر اسميهما.
ومنذ استحواذ شركة قطر للاستثمارات الرياضية عليه عام 2011، واجه الخليفي الذي قاد النادي الباريسي بهدف جعله الفريق الأفضل في أوروبا، عدة قضايا في السنوات الأخيرة لكنه نفى دائما ارتكاب أي مخالفات.
ففي منتصف شباط/فبراير 2023، أسقطت محكمة النقض الفرنسية نهائيا، اتهاما سابقا ضد ناصر الخليفي بالفساد في ما يتصل بعرض قطر لاستضافة بطولة العالم لألعاب القوى في عامي 2017 و2019، وقضت بأن النظام القضائي الفرنسي غير مؤهل لمحاكمته.
ويحقق قضاة في باريس أيضا مع الخليفي بشأن اتهامات بخطف واحتجاز رجل الأعمال الفرنسي الجزائري طيب بن عبد الرحمن في قطر. وينفي الخليفي الاتهامات وقد تقدم بنفسه بشكوى.
من جانبه، قال مصدر مقرب من الخليفي العضو في مجلس إدارة الصندوق السيادي القطري إن ""هذه القضية لا علاقة لها مطلقا وبوضوح بناصر الخليفي، ولكن كالعادة سيتم ربطه بها من خلال عملية مشوهة تماما (...) حتى تنهار هذه القضية بصمت في غضون سنوات قليلة"".
يشتبه في أن أرنو لاغاردير، رئيس مجموعة لاغاردير، استخدم بشكل احتيالي نحو 125 مليون يورو من أموال المجموعة على مدى عدة سنوات لتمويل نفقاته الشخصية.
ويتعلق الاتهام الموجه للخليفي بصراع في مجلس إدارة المجموعة عام 2018 بين قطب اليمين الملياردير فينسنت بولوريه الذي كان متحالفا مع صندوق الاستثمار أمبر كابيتال، وأغنى رجل في فرنسا برنار أرنو رئيس شركة السلع الفاخرة ""إل في إم إتش"" الذي دعم أرنو لاغاردير.
في 24 نيسان/أبريل 2018، قررت شركة قطر للاستثمار وتطوير المشاريع القابضة، وهي شركة تابعة لصندوق الثروة السيادي القطري والمساهم الرئيسي في مجموعة لاغاردير، دعم مقترحات شركة أمبر كابيتال.
ويتهم أرنو لاغاردير ومساعدوه بالاتصال بمعارفهم، ومن بينهم ناصر الخليفي بصفته مديرا لصندوق الثروة السيادي القطري (جهاز قطر للاستثمارات).
بعد خمسة أيام من التصويت الأول، غيرت هيئة الاستثمار القطرية موقفها وصوتت لصالح المقترحات التي طرحها أرنو لاغاردير.
","
                                        يواجه رئيس نادي باريس سان جرمان ناصر الخليفي اتهامات في فرنسا بالتواطؤ في إساءة استخدام السلطة في تحقيق على صلة بصندوق الثروة السيادي القطري. وواجه الخليفي الذي قاد النادي الباريسي منذ استحواذ شركة قطر للاستثمارات الرياضية عليه في 2011 بهدف جعله الفريق الأفضل في أوروبا، عدة قضايا في السنوات الأخيرة لكنه نفى دائما ارتكاب أي مخالفات.                ",https://www.france24.com/ar/%D8%B1%D9%8A%D8%A7%D8%B6%D8%A9/20250213-%D9%81%D8%B1%D9%86%D8%B3%D8%A7-%D8%A7%D8%AA%D9%87%D8%A7%D9%85-%D9%86%D8%A7%D8%B5%D8%B1-%D8%A7%D9%84%D8%AE%D9%84%D9%8A%D9%81%D9%8A-%D8%A8%D8%A7%D8%B1%D9%8A%D8%B3-%D8%B3%D8%A7%D9%86-%D8%AC%D8%B1%D9%85%D8%A7%D9%86-%D9%82%D8%B7%D8%B1,https://s.france24.com/media/display/3708061a-53cf-11ea-bb87-005056a98db9/w:720/p:16x9/psg-1.jpg,No Published Date,رياضة
2,France 24,No Author,ماكرون ومودي في مدينة مارسيليا لتوطيد العلاقات الاقتصادية بين فرنسا والهند,,"
                                                في فقرة الاقتصاد اليوم، نتابع مع وسيم الدالي الرهانات الاقتصادية لزيارة الرئيس الفرنسي إيمانويل ماكرون ورئيس الوزراء الهندي ناريندرا مودي إلى ميناء مارسيليا، وذلك لبحث مشروع الممر الاقتصادي الهند - الشرق الأوسط - أوروبا، زيارة تشمل أيضا إعلانات تخص التعاون الفرنسي الهندي في مجال الطاقة النووية المدنية وتفتح باب المناقشات بشأن التعاون الدفاعي بين البلدين.                    ",https://www.france24.com/ar/%D8%A8%D8%B1%D8%A7%D9%85%D8%AC/%D8%A7%D9%84%D8%A7%D9%82%D8%AA%D8%B5%D8%A7%D8%AF-%D8%A7%D9%84%D9%8A%D9%88%D9%85/20250212-%D9%85%D8%A7%D9%83%D8%B1%D9%88%D9%86-%D9%88%D9%85%D9%88%D8%AF%D9%8A-%D9%81%D9%8A-%D9%85%D8%AF%D9%8A%D9%86%D8%A9-%D9%85%D8%A7%D8%B1%D8%B3%D9%8A%D9%84%D9%8A%D8%A7-%D9%84%D8%AA%D9%88%D8%B7%D9%8A%D8%AF-%D8%A7%D9%84%D8%B9%D9%84%D8%A7%D9%82%D8%A7%D8%AA-%D8%A7%D9%84%D8%A7%D9%82%D8%AA%D8%B5%D8%A7%D8%AF%D9%8A%D8%A9-%D8%A8%D9%8A%D9%86-%D9%81%D8%B1%D9%86%D8%B3%D8%A7-%D9%88%D8%A7%D9%84%D9%87%D9%86%D8%AF,https://s.france24.com/media/display/127c2b5e-e917-11ef-bbcb-005056a90284/w:720/p:16x9/AR_20250212_083719_084136_CS.jpg,No Published Date,اقتصاد
3,France 24,No Author,"فرنسا تتيح ""استثناءات إنسانية"" للاجئين السوريين للعودة المؤقتة إلى بلادهم","
سمحت وزارة الداخلية الفرنسية للاجئين السوريين في فرنسا، بشكل استثنائي، بالتقدم للحصول على تصاريح تمكنهم من العودة المؤقتة إلى بلدهم الأم من دون فقدان حقوقهم القانونية.
بحسب بيان للوزارة، قد تشمل الأسباب المبررة للزيارة ""دوافع إنسانية"" تتيح التواصل مع أفراد العائلة، أو التحقق من ممتلكات تركت في سوريا، ولا يدخل في ذلك الدوافع السياحية أو التجارية أو المهنية.
جاء هذا التطور استجابة لرسالة موجهة في منتصف كانون الثاني/يناير من ""تجمع حرية التحرك، حق العودة""، إلى الرئيس الفرنسي إيمانويل ماكرون، طالبت بإتاحة إمكانية العودة المؤقتة لسوريا للمشاركة في إعادة البناء بعد سقوط نظام بشار الأسد، مع الحفاظ على وضع اللجوء.
وتمنع الأطر القانونية عادة المستفيدين من الحماية الدولية في فرنسا من السفر إلى بلدانهم الأم، لكن الوزارة أكدت أن الوضع ""الجديد"" في سوريا يبرر توسيع تعريف الدوافع الإنسانية، ليشمل ما يسمى ""العودة الاستكشافية"".
تصريح مدته ثلاثة أشهر
وفق التعميم الصادر عن الداخلية الفرنسية، يصدر تصريح خاص لهذه الرحلات، وتصل مدته إلى ثلاثة أشهر كحد أقصى. ويمكن تقديم طلب الحصول على هذا التصريح لدى الإدارة المحلية في مكان إقامة المستفيد من الحماية، ويلزم هذا الطلب تقديم وثائق تثبت الحاجة الملحة لزيارة سوريا.
ويقدر عدد من يتمتعون بوضع اللاجئ السياسي السوري في فرنسا بحوالي 45 ألف شخص، غالبيتهم فروا مع تفاقم النزاع في سوريا اعتبارا من عام 2011.
وكان وزير الخارجية الفرنسية قد ألمح مطلع الشهر الماضي إلى إمكانية وقوع ""استثناءات"" في ""حالات معينة"" تتعلق بعودة اللاجئين إلى بلدانهم.
كما أعلن أيضا تعليق البت في حوالي 700 طلب لجوء جديدة تقدم بها سوريون، في انتظار توضيح مسار العملية الانتقالية في سوريا.","
                                        أتاحت فرنسا للاجئين السوريين لديها تقديم طلبات للعودة المؤقتة إلى وطنهم في ظروف إنسانية محددة، بهدف الاطمئنان على العائلات أو الممتلكات، دون فقدان حقوق اللجوء. يأتي ذلك إثر مناشدات جمعيات ضغط تطالب بالمشاركة في إعادة البناء بعد سقوط نظام الرئيس السابق بشار الأسد. وتشمل الاستثناءات زيارات تصل مدتها إلى ثلاثة أشهر، فيما يبقى المنع ساريا على الدوافع السياحية والتجارية والمهنية.                ",https://www.france24.com/ar/%D9%81%D8%B1%D9%86%D8%B3%D8%A7/20250211-%D9%81%D8%B1%D9%86%D8%B3%D8%A7-%D8%AA%D8%AA%D9%8A%D8%AD-%D8%A7%D8%B3%D8%AA%D8%AB%D9%86%D8%A7%D8%A1%D8%A7%D8%AA-%D8%A5%D9%86%D8%B3%D8%A7%D9%86%D9%8A%D8%A9-%D9%84%D9%84%D8%A7%D8%AC%D8%A6%D9%8A%D9%86-%D8%A7%D9%84%D8%B3%D9%88%D8%B1%D9%8A%D9%8A%D9%86-%D9%84%D9%84%D8%B9%D9%88%D8%AF%D8%A9-%D8%A7%D9%84%D9%85%D8%A4%D9%82%D8%AA%D8%A9-%D8%A5%D9%84%D9%89-%D8%A8%D9%84%D8%A7%D8%AF%D9%87%D9%85,https://s.france24.com/media/display/c79a3f86-e8d0-11ef-9c41-005056bf30b7/w:720/p:16x9/AFP__20241214__36QE444__v1__Preview__FranceSyriaConflictDemo.jpg,No Published Date,فرنسا
