,source,title,content,description,url,published_at,tags
15,France 24,السودان: ضربات جوية تستهدف مخيم زمزم للنازحين في دارفور وفقا لمنظمتين غير حكوميتين,"
استهدفت ضربات جوية ليل الأحد مخيم زمزم للنازحين في دارفوربعد أيام من إصدار هيئة مدعومة من الأمم المتحدة تقريرا يفيد بأن الحرب في السودانتسببت في مجاعة بالمخيم، وفق ما أفادت به منظمتان غير حكوميتين الإثنين.
وقالت ""أطباء بلا حدود"" في بيان إن ""مخيم زمزم قصف مساء الأحد"".
من جهتها، أشارت المنسقية العامة للنازحين واللاجئين في دارفور إلى أن ""الطيران الحربي قصف مخيم زمزم للنازحين"" الذي يؤوي ما بين 300 ألف و500 ألف نازح.
والجيش السوداني هو الطرف الوحيد الذي يمتلك طيرانا حربيا.
وفر الكثيرون من بين هؤلاء النازحين من المعارك الضارية في مدينة الفاشر المجاورة، عاصمة ولاية شمال دارفور.
والفاشر هي العاصمة الوحيدة لولايات دارفور الخمس التي لم تسيطر عليها قوات الدعم السريع، وقد ظلت بمنأى نسبيا عن القتال لفترة طويلة.
وأفادت المنسقية بأن ضربات الأحد دمرت 20 منزلا و""جرحت أربعة أطفال"" وأدت إلى ""حالة من الخوف والهلع وسط النازحين في المخيم"".
وتأتي الضربات بعد بضعة أيام من إصدار هيئة تدعمها الأمم المتحدة تقريرًا يفيد بأن المخيم يشهد مجاعة.
وخلصت مراجعة التصنيف المرحلي المتكامل للأمن الغذائي التي تستخدمها وكالات الأمم المتحدة، إلى أن ""المجاعة لا تزال مستمرة في تموز/يوليو 2024 في مخيم زمزم"".
وأشارت إلى أن ""العوامل الرئيسية للمجاعة في مخيم زمزم هي النزاع وعدم القدرة على إيصال المساعدات الانسانية"".
واندلعت المعارك في السودان في نيسان/أبريل 2023 بين الجيش بقيادة عبد الفتاح البرهان وقوات الدعم السريع بقيادة نائبه السابق محمد حمدان دقلو.
والمعسكران متهمان بارتكاب جرائم حرب وبالاستهداف المتعمد للمدنيين وبإعاقة وصول المساعدات الإنسانية.
وأسفرت الحرب عن عشرات آلاف القتلى. ونزح أكثر من عشرة ملايين شخص داخل السودان أو لجأوا إلى البلدان المجاورة منذ اندلاع المعارك، بحسب إحصاءات الأمم المتحدة.
ومع انزلاق البلاد إلى ما وصفته الأمم المتحدة بـ""واحدة من أسوأ الأزمات الإنسانية في الذاكرة الحديثة""، تم تعليق غالبية عمليات الإغاثة بسبب العنف.","
                                        كشفت منظمتان حكوميتان عن استهداف مخيم زمزم للنازحين في دارفور بضربات جوية، مما فاقم الوضع الإنساني المتدهور بعد تقرير أممي يحذر من مجاعة جراء الحرب في السودان. وقالت ""أطباء بلا حدود"" في بيان إن ""مخيم زمزم قصف مساء الأحد""، فيما أشارت المنسقية العامة للنازحين واللاجئين في دارفور إلى أن ""الطيران الحربي قصف مخيم زمزم للنازحين"" الذي يؤوي ما بين 300 ألف و500 ألف نازح. والجيش السوداني هو الطرف الوحيد الذي يمتلك طيرانا حربيا.                ",https://www.france24.com/ar/%D8%A3%D9%81%D8%B1%D9%8A%D9%82%D9%8A%D8%A7/20240806-%D8%A7%D9%84%D8%B3%D9%88%D8%AF%D8%A7%D9%86-%D8%B6%D8%B1%D8%A8%D8%A7%D8%AA-%D8%AC%D9%88%D9%8A%D8%A9-%D8%AA%D8%B3%D8%AA%D9%87%D8%AF%D9%81-%D9%85%D8%AE%D9%8A%D9%85-%D8%B2%D9%85%D8%B2%D9%85-%D9%84%D9%84%D9%86%D8%A7%D8%B2%D8%AD%D9%8A%D9%86-%D9%81%D9%8A-%D8%AF%D8%A7%D8%B1%D9%81%D9%88%D8%B1-%D9%88%D9%81%D9%82%D8%A7-%D9%84%D9%85%D9%86%D8%B8%D9%85%D8%AA%D9%8A%D9%86-%D8%BA%D9%8A%D8%B1-%D8%AD%D9%83%D9%88%D9%85%D9%8A%D8%AA%D9%8A%D9%86,06/08/2024 - 04:05,"

                                    أفريقيا
                            "
16,France 24,ترقب لرد إيراني على إسرائيل بعد اغتيال هنية ودعوات دولية لتجنب التصعيد,,,https://www.france24.com/ar/%D9%81%D9%8A%D8%AF%D9%8A%D9%88/20240806-%D8%AA%D8%B1%D9%82%D8%A8-%D9%84%D8%B1%D8%AF-%D8%A5%D9%8A%D8%B1%D8%A7%D9%86%D9%8A-%D8%B9%D9%84%D9%89-%D8%A7%D8%BA%D8%AA%D9%8A%D8%A7%D9%84-%D8%A5%D8%B3%D9%85%D8%A7%D8%B9%D9%8A%D9%84-%D9%87%D9%86%D9%8A%D8%A9-%D9%81%D9%8A-%D8%B7%D9%87%D8%B1%D8%A7%D9%86-%D9%88%D8%AF%D8%B9%D9%88%D8%A7%D8%AA-%D8%AF%D9%88%D9%84%D9%8A%D8%A9-%D9%84%D8%AA%D8%AC%D9%86%D8%A8-%D8%A7%D9%84%D8%AA%D8%B5%D8%B9%D9%8A%D8%AF,"
                06 أغسطس 2024
            ",
17,France 24,السودان: بلينكن يحث البرهان على المشاركة بمحادثات وقف إطلاق النار في سويسرا,,"
                                                أعلن المدعي العام للمحكمة الجنائية الدولية الاثنين أنه يأمل أن يتمكن من طلب إصدار مذكرات توقيف في الأشهر المقبلة بحق بعض المسؤولين عن ""الكابوس"" الذي يعيشه سكان إقليم دارفور السوداني الذي مزقته الحرب. من جهة أخرى قالت وزارة الخارجيةالأمريكية إن وزير الخارجية أنتوني بلينكن أكد في اتصال هاتفي اليوم الاثنين مع قائد الجيش السوداني عبد الفتاح البرهان علىضرورة مشاركة الجيش السوداني في محادثات وقف إطلاق النار هذا الشهر في سويسرا.                    ",https://www.france24.com/ar/%D9%81%D9%8A%D8%AF%D9%8A%D9%88/20240806-%D8%A8%D9%84%D9%8A%D9%86%D9%83%D9%86-%D9%8A%D8%AD%D8%AB-%D8%A7%D9%84%D8%AC%D9%8A%D8%B4-%D8%A7%D9%84%D8%B3%D9%88%D8%AF%D8%A7%D9%86%D9%8A-%D8%B9%D9%84%D9%89-%D8%A7%D9%84%D9%85%D8%B4%D8%A7%D8%B1%D9%83%D8%A9-%D8%A8%D9%85%D8%AD%D8%A7%D8%AF%D8%AB%D8%A7%D8%AA-%D9%88%D9%82%D9%81-%D8%A5%D8%B7%D9%84%D8%A7%D9%82-%D8%A7%D9%84%D9%86%D8%A7%D8%B1,06/08/2024 - 10:54,"
                                    الأخبار المغاربية
                            "
18,France 24,الحكومة البريطانية تعلن حشد أكثر من 6 آلاف شرطي لحفظ الأمن وتجهيز 500 مكان في السجون لمثيري الشغب,"
جهزت الحكومة البريطانية الثلاثاء أكثر من 500 مكان في السجون لمثيري الشغب، ستة آلاف عنصر متخصص من قوات الشرطة في حالة استعداد وفق ما أعلنت، وذلك للتعامل مع أعمال العنف التي يقودها اليمين المتطرف والتي اندلعت بعد مقتل ثلاث فتيات في هجوم بسكين منذ أسبوع.
وفي سياق أعمال العنف، أوقف الإثنين ستة أشخاص وأُصيب العديد من الشرطيين حين هاجمهم مثيرون للشغب رشقوا حجارة وألعابا نارية في بليموث في جنوب إنجلترا.
وهاجم مثيرون للشغب شرطيين في بلفاست في إيرلندا الشمالية وذلك خلال محاولة لإضرام النار في متجر يملكه أجنبي.
وأعلنت الشرطة إن رجلا ثلاثينيا تعرض لاعتداء خطير خلال الاضطرابات وإنها تتعامل مع الحادث على أنه جريمة كراهية ذات دوافع عنصرية.
في غضون ذلك، قامت مجموعة رجال تجمعوا في برمنغهام بوسط إنجلترا بمواجهة مظاهرة مفترضة لليمين المتطرف وأجبروا مراسلة سكاي نيوز على التوقف عن البث وهتفوا ""فلسطين حرة"". تبعها في ما بعد رجل يرتدي قناعا ويحمل سكينا.
وقال مراسل آخر إن أعضاء المجموعة طاردوه ""بما يشبه السلاح"" فيما قالت الشرطة إن حوادث إجرامية لحقت بحانة وبسيارة.
ويذكر أن الاضطرابات بدأت الأسبوع الماضي بعدما قُتلت ثلاث فتيات طعنا في حصة رقص في ساوثبورت في شمال غرب إنجلترا وأُصيب خمسة أطفال آخرين بجروح خطيرة. واندلعت أعمال شغب في عدة مدن وبلدات، ما أدى إلى توقيف المئات.
وأفادت وزيرة العدل هايدي ألكسندر الثلاثاء إن 6 آلاف عنصر من الشرطة متخصصين في الحفاظ على النظام وُضعوا في حالة استعداد، وإنه تم تجهيز 567 مكانا في السجن كان مقررا أن تصبح متاحة ""في وقت لاحق من الشهر"" الحالي.
وتابعت في حديث لشبكة بي بي سي ""سنضمن أن يكون لكل شخص يصدر بحقه حكم بالسجن نتيجة أعمال الشغب والفوضى، مكان ينتظره في السجن"".
وتجدر الإشارة إلى أنه أوقف حوالى 400 شخص في الأيام الأخيرة، ووجهت تهم حاليا لحوالي مئة شخص وفقا للنيابة، بينهم 28 شخصا يشتبه بأنهم شاركوا في أعمال العنف في ميدلزبره (شمال إنجلترا).
وشددت النيابة على أنه تم توجيه تهمة التحريض على الكراهية العنصرية لشاب يبلغ 28 عاما، بسبب رسائل نشرها على موقع فيس بوك.
وقالت الشرطة إنها أوقفت شخصين بتهمة ""مضايقات عنصرية خطيرة"" بسبب رسائل تدعو إلى مظاهرات بالقرب من فندق أكدا في معلومات خاطئة أنه يؤوي طالبي لجوء.
وتضمنت رسالة نشرتها صحيفة ""ذي تايمز""، إدانات زعماء دينيين مسيحيين ومسلمين ويهود لـ""الكراهية والعنف"" اللذين يستهدفان المساجد وطالبي اللجوء، ويمثلان ""وصمة عار على ضميرنا الأخلاقي الوطني"".
وألقى مثيرو الشغب الحجارة وهاجموا الشرطة وأحرقوا ونهبوا متاجر وحطموا نوافذ سيارات ومنازل واستهدفوا فندقين على الأقل يؤويان طالبي لجوء في عدة مدن نهاية الأسبوع المنصرم، بالإضافة إلى مساجد.
وعقد رئيس الوزراء كير ستارمر الإثنين اجتماعا طارئا للوزراء وقادة الشرطة للبحث في الوضع.
وتعهد ستارمر أمام وسائل إعلامية بعد اجتماع الإثنين، فرض ""عقوبات جنائية سريعة"" على المتورطين بأعمال الشغب.
وبدأت أعمال الشغب بعد انتشار معلومات مضللة تم نفيها جزئيا بشأن ديانة وأصل أكسل روداكوبانا (17 عاما) المتهم بالقتل ومحاولة القتل. ويُعرف رسميا فقط أن روداكوبانا ولد في ويلز، في حين أفادت تقارير إعلامية بأن والديه من رواندا.
وعرضت الحكومة إجراءات أمنية طارئة جديدة على أماكن العبادة الإسلامية.
في بورنلي في شمال غرب إنجلترا، يجري التحقيق في جرائم الكراهية بعد أن تم تخريب شواهد قبور في قسم إسلامي من مقبرة بطلاء رمادي.
وأبدى ستارمر حزما كبيرا في الأيام الأخيرة في مواجهة ما وصفها بأنها ""بلطجة اليمين المتطرف"".
وحذر بعد ظهر الأحد محتجي اليمين المتطرف من أنهم ""سيندمون"".
وأكدت وزيرة الداخلية إيفيت كوبر في حديث لـ""بي بي سي"" أهمية ""المحاسبة"". وقالت ""مثيرو الشغب سيدفعون الثمن"". وأضافت ""تأكدنا من أن المحاكم جاهزة، وأن مدعين إضافيين متاحون"". وتابعت ""نتوقع أن تتحقق العدالة بسرعة"".
وانتقدت ألكسندر الثلاثاء مالك منصة إكس إيلون ماسك إذ قال إن ""الحرب الأهلية"" في المملكة المتحدة ""حتمية"".
وقالت الوزيرة ""أعتقد أن هذا تصرف غير مسؤول على الإطلاق. أعتقد أنه يجب أن يدعو الجميع إلى الهدوء"".
وعزت الشرطة الفوضى إلى منظمات مرتبطة بـ""رابطة الدفاع البريطانية"" المناهضة للإسلام التي تأسست قبل 15 عاما وجرى حلها.
ويعتقد بعض المعلقين والقادة السياسيين أن تصاعد الخطاب المناهض للهجرة في صفوف الطبقة السياسية، منح المتظاهرين شرعية.
","
                                        أعلنت وزيرة العدل البريطانية هايدي ألكسندر الثلاثاء أن 6 آلاف عنصر من الشرطة متخصصين في الحفاظ على النظام وُضعوا في حالة استعداد، كما تم تجهيز 500 مكان في السجن لمثيري الشغب في خضم أعمال العنف التي تشهدها البلاد منذ الأسبوع الماضي.                 ",https://www.france24.com/ar/%D8%A3%D9%88%D8%B1%D9%88%D8%A8%D8%A7/20240806-%D8%A7%D9%84%D8%AD%D9%83%D9%88%D9%85%D8%A9-%D8%A7%D9%84%D8%A8%D8%B1%D9%8A%D8%B7%D8%A7%D9%86%D9%8A%D8%A9-%D8%AA%D8%B9%D9%84%D9%86-%D8%AD%D8%B4%D8%AF-%D8%A3%D9%83%D8%AB%D8%B1-%D9%85%D9%86-6-%D8%A2%D9%84%D8%A7%D9%81-%D8%B4%D8%B1%D8%B7%D9%8A-%D9%84%D8%AD%D9%81%D8%B8-%D8%A7%D9%84%D8%A3%D9%85%D9%86-%D9%88%D8%AA%D8%AC%D9%87%D9%8A%D8%B2-500-%D9%85%D9%83%D8%A7%D9%86-%D9%81%D9%8A-%D8%A7%D9%84%D8%B3%D8%AC%D9%88%D9%86-%D9%84%D9%85%D8%AB%D9%8A%D8%B1%D9%8A-%D8%A7%D9%84%D8%B4%D8%BA%D8%A8,06/08/2024 - 19:40,"

                                    أوروبا
                            "
19,France 24,قيس سعيّد يقدم ملف ترشحه لانتخابات الرئاسة ومحكمة تونسية تقضي بسجن مرشحين محتملين,,"
                                                قدم الرئيس التونسي قيس سعيّد الإثنين ملف ترشحه للانتخابات الرئاسية المقررة في السادس من تشرين الأول/أكتوبر المقبل. ويعتبر خبراء أن الطريق إلى الانتخابات الرئاسية مليء بالعقبات أمام المنافسين المحتملين للرئيس المنتخب ديمقراطيا في عام 2019 والذي تفرد بالسلطة قبل ثلاث سنوات ويسعى لولاية ثانية. في ذات الوقت قال سياسيون ومحامون لرويترز إن محكمة تونسية قضت الإثنين بسجن أربعة مرشحين محتملين للانتخابات الرئاسية لمدة ثمانية أشهر، مع منعهم من الترشح مدى الحياة بتهمة ""شراء تزكيات"".                    ",https://www.france24.com/ar/%D9%81%D9%8A%D8%AF%D9%8A%D9%88/20240806-%D9%82%D9%8A%D8%B3-%D8%B3%D8%B9%D9%8A%D8%AF-%D9%8A%D9%82%D8%AF%D9%85-%D9%85%D9%84%D9%81-%D8%AA%D8%B1%D8%B4%D9%8A%D8%AD%D9%87-%D9%84%D9%84%D8%A7%D9%86%D8%AA%D8%AE%D8%A7%D8%A8%D8%A7%D8%AA-%D8%A7%D9%84%D8%B1%D8%A6%D8%A7%D8%B3%D9%8A%D8%A9,06/08/2024 - 14:36,"
                                    الأخبار المغاربية
                            "
20,France 24,الانتخابات الأمريكية: هاريس تختار تيم والز مرشحا لمنصب نائب الرئيس,,"
                                                كشفت وسائل إعلام أمريكية الثلاثاء أن كامالا هاريس التي أصبحت المرشحة الرسمية للديمقراطيين لمنافسة دونالد ترامب في الانتخابات الرئاسية الأمريكية، قد اختارت حاكم مينيسوتا تيم وولتز مرشحا لمنصب نائب الرئيس. ومن المتوقع أن يكون حاضرا معها في أول تجمع انتخابي للثنائي الديمقراطي مساء الثلاثاء بفيلادلفيا في بنسلفانيا.                    ",https://www.france24.com/ar/%D9%81%D9%8A%D8%AF%D9%8A%D9%88/20240806-%D9%87%D8%A7%D8%B1%D9%8A%D8%B3-%D8%AA%D8%AE%D8%AA%D8%A7%D8%B1-%D8%AD%D8%A7%D9%83%D9%85-%D9%85%D9%8A%D9%86%D9%8A%D8%B3%D9%88%D8%AA%D8%A7-%D8%AA%D9%8A%D9%85-%D9%88%D9%88%D9%84%D8%AA%D8%B2-%D9%85%D8%B1%D8%B4%D8%AD%D8%A7-%D9%84%D9%86%D8%A7%D8%A6%D8%A8-%D8%A7%D9%84%D8%B1%D8%A6%D9%8A%D8%B3,06/08/2024 - 15:20,"
                                    الأخبار المغاربية
                            "
21,France 24,حذر ومخاوف في إسرائيل من هجوم إيراني محتمل,,"
                                                يسود الترقب منطقة الشرق الأوسط والعالم، في انتظار ""رد"" إيراني ضد إسرائيل، بعد اغتيال رئيس المكتب السياسي لحركة حماس إسماعيل هنية في طهران، وكذلك الوعد الذي قطعه حزب الله اللبناني بالرد على اغتيال القيادي البارز فؤاد شكر.                    ",https://www.france24.com/ar/%D9%81%D9%8A%D8%AF%D9%8A%D9%88/20240806-%D8%AD%D8%B0%D8%B1-%D9%81%D9%8A-%D8%A5%D8%B3%D8%B1%D8%A7%D8%A6%D9%8A%D9%84-%D9%85%D9%86-%D9%87%D8%AC%D9%88%D9%85-%D8%A5%D9%8A%D8%B1%D8%A7%D9%86%D9%8A-%D9%85%D8%AD%D8%AA%D9%85%D9%84,06/08/2024 - 02:48,"
                                    الأخبار المغاربية
                            "
22,France 24,الفتى الطائر.. السويدي دوبلانتيس يحطم رقمه القياسي العالمي بالقفز بالزانة,,"
                                                احتفظ السويدي أرماند دوبلانتيس بذهبية مسابقة القفز بالزانة في ألعاب القوى الإثنين على ملعب فرنسا الدولي في أولمبياد باريس، وذلك بعدما كان الوحيد الذي نجح في تجاوز الستة أمتار قبل أن يحطم بعدها رقمه القياسي العالمي بتسجيله 6.25 م.                    ",https://www.france24.com/ar/%D9%81%D9%8A%D8%AF%D9%8A%D9%88/20240806-%D8%A7%D9%84%D9%81%D8%AA%D9%89-%D8%A7%D9%84%D8%B7%D8%A7%D8%A6%D8%B1-%D8%A7%D9%84%D8%B3%D9%88%D9%8A%D8%AF%D9%8A-%D8%A7%D9%84%D8%B0%D9%8A-%D8%AD%D8%B7%D9%85-%D8%AA%D8%B3%D8%B9%D8%A9-%D8%A3%D8%B1%D9%82%D8%A7%D9%85-%D9%85%D8%AA%D8%AA%D8%A7%D9%84%D9%8A%D8%A9-%D8%A8%D8%A7%D9%84%D9%82%D9%81%D8%B2-%D8%A8%D8%A7%D9%84%D8%B2%D8%A7%D9%86%D8%A9,06/08/2024 - 11:09,"
                                    الأخبار المغاربية
                            "
23,France 24,بنغلادش: الإفراج عن زعيمة المعارضة خالدة ضياء والجيش يعلن رفع حظر التجول,"
أمر رئيس بنغلادش محمد شهاب الدين يوم الإثنين، بالإفراج عن رئيسة الوزراء السابقة وزعيمة المعارضة خالدة ضياء وجميع الأشخاص الذين اعتقلوا خلالالتظاهرات الأخيرة، وذلك بعد ساعات من فرار رئيسة الوزراء الشيخة حسينة من البلاد.
وجاء في بيان صادر عن مكتب الرئيس، أن الاجتماع الذي ترأسه شهاب الدين ""قرر بالإجماع الإفراج الفوري عن رئيسة الحزب الوطني البنغلادشي خالدة ضياء"" وعن ""جميع الأشخاص الذين اعتقلوا خلال تظاهرات الطلاب"".
وأضاف البيان أن الاجتماع قرر أيضا تشكيل حكومة انتقالية فورا.
وشارك في الاجتماع قائد الجيش الجنرال وقر الزمان، وقادة القوات البحرية والجوية، وأعضاء من عدة أحزاب معارضة، بينها الحزب الوطني البنغلادشي وحزب الجماعة الإسلامية.
وفي سياق متصل، أعلن الجيش رفع حظر التجول الذي فرضه لاحتواء الاحتجاجات، اعتبارا من فجر الثلاثاء، بعد توليه السلطة عقب الإطاحة برئيسة الوزراء الشيخة حسينة.
وقال الجيش في بيان إنه ""سيتم فتح المكاتب والمصانع والمدارس والكليات اعتبارا من الساعة السادسة صباحا الثلاثاء (00:00 بتوقيت غرينتش)"".
يذكر أن التظاهرات في بنغلادش، التي بدأت في تموز/ يوليو بقيادة الطلاب احتجاجا على قواعد التوظيف في القطاع العام، قمعت بعنف، وقد أدت هذه الاحتجاجات الإثنين إلى الإطاحة برئيسة الوزراء الشيخة حسينة، لينتهي حكمها الذي استمر 15 عاما.","
                                         قرر رئيس بنغلادش محمد شهاب الدين الإفراج عن رئيسة الوزراء السابقة خالدة ضياء والمعتقلين خلال التظاهرات بعد مغادرة الشيخة حسينة البلاد. كما أمر شهاب بـ""تشكيل حكومة انتقالية فورا"". بدوره أعلن الجيش رفع حظر التجول الذي فرضه لاحتواء الاحتجاجات، اعتبارا من فجر الثلاثاء.                ",https://www.france24.com/ar/%D8%A2%D8%B3%D9%8A%D8%A7/20240805-%D8%A8%D9%86%D8%BA%D9%84%D8%A7%D8%AF%D8%B4-%D8%A7%D9%84%D8%A5%D9%81%D8%B1%D8%A7%D8%AC-%D8%B9%D9%86-%D8%B2%D8%B9%D9%8A%D9%85%D8%A9-%D8%A7%D9%84%D9%85%D8%B9%D8%A7%D8%B1%D8%B6%D8%A9-%D8%AE%D8%A7%D9%84%D8%AF%D8%A9-%D8%B6%D9%8A%D8%A7%D8%A1-%D9%88%D8%A7%D9%84%D8%AC%D9%8A%D8%B4-%D9%8A%D8%B9%D9%84%D9%86-%D8%B1%D9%81%D8%B9-%D8%AD%D8%B8%D8%B1-%D8%A7%D9%84%D8%AA%D8%AC%D9%88%D9%84,06/08/2024 - 01:58,"

                                    آسيا
                            "
