,source,title,content,description,url,published_at,tags
6,France 24,اشتداد التصعيد بين إسرائيل والحوثيين على خلفية الحرب في غزة وسط تنديد وتهديد من جهات عدة,"
قال الجيش الإسرائيلي الأحد إنه اعترض صاروخا أطلق من اليمن و""كان يقترب"" من الدولة العبرية وذلك غداة غارات شنها على ميناء الحديدة الذي يسيطر عليه الحوثيون في اليمن أوقعت ستة قتلى وعشرات الجرحى كما تسببت بحريق هائل اندلع في منشآت النفط.
وفي وقت لاحق أعلن الحوثيون أنه أطلق عدة صواريخ تستهدف إسرائيل لا سيما مدينة إيلات المطلة على البحر الأحمر.
واعترضت الدفاعات الجوية الإسرائيلية مرارا صواريخ أطلقها الحوثيون قبالة سواحل إيلات خلال الأشهر الأخيرة.
وكانت مقاتلات إسرائيلية قد شنت غارات السبت على أهداف للحوثيين في ميناء مدينة الحديدة اليمنية غداة تبني الحوثيين اليمنيين المدعومين من إيران مسؤوليتهم عن هجوا بمسيرة مفخخة أوقع قتيلا في تل أبيب.
وكانت هذه أول ضربة إسرائيلية علنية ضد اليمن الذي يشن منه الحوثيون هجمات بالصواريخ والمسيرات على سفن تجارية في البحر الأحمر وبحر العرب يقولون إنها مرتبطة بإسرائيل أو متجهة إلى موانئها.
ويؤكد الحوثيون أن هذه الهجمات تأتي دعما للفلسطينيين في قطاع غزة حيث قتل 38983 ألف شخص، وفقا لما أعلنت الأحد وزارة الصحة في القطاع، منذ اندلاع الحرب الدائرة بين إسرائيل وحماس التي اندلعت في السابع من تشرين الأول/أكتوبر الماضي.
وكان محمد البخيتي عضو المكتب السياسي للحوثيين  قد أكد عبر منصة إكس أن إسرائيل ""ستدفع ثمن"" ضرباتها في اليمن"". وتوعد المتحدث العسكري باسم الحوثيين يحيى سريع ""سنرد على هذا العدوان (...) لن نتردد في ضرب أهداف حيوية للعدو الإسرائيلي"".
وكرر الحوثيون الأحد تهديداتهم ضد إسرائيل، إذ تعهد المتحدث العسكري باسم الحوثيين يحيى سريع الأحد بـ""رد هائل على العدوان"" الإسرائيلي.
كما قال محمد عبد السلام المتحدث باسم الحوثيين لقناة الجزيرة إنه لن تكون هناك ""خطوط حمراء"" في رد الجماعة على إسرائيل. وأضاف ""كل المنشآت الحساسة بمختلف مستوياتها ستكون هدفا لنا"".
وحذر حزب الله اللبناني الذي فتح بدوره جبهة ضد إسرائيل بعد اندلاع الحرب بين إسرائيل وحماس، من أن الضربات الإسرائيلية في اليمن ""هي إيذان بمرحلة جديدة وخطيرة من المواجهة، بالغة الأهمية على مستوى المنطقة برمتها"".
ويشار إلى أن الجيش الإسرائيلي أكد الأحد أنه استهدف منتصف ليل السبت الأحد مستودع ذخائر لحزب الله اللبناني، بعدما نقل الإعلام الرسمي اللبناني تعرض مستودع ذخائر في جنوب لبنان لغارة إسرائيلية خلفت ستة جرحى من المدنيين. في وقت لاحق أعلن حزب الله الأحد قصف شمال إسرائيل ""بصواريخ كاتيوشا"" ردا على قصف المستودع.
نددت الحكومة اليمنية المعترف بها دوليا والمدعومة من السعودية في حربها التي تخوضها ضد الحوثيين منذ 2014، بالضربات الإسرائيلية، محملة الدولة العبرية مسؤولية ""تعميق الأزمة الإنسانية"".
لكنها حذرت الحوثيين من ""استمرار رهن مصير اليمن وأبناء شعبه والزج بهم في معارك الجماعة العبثية، خدمة لمصالح النظام الإيراني ومشروعه التوسعي في المنطقة"".
صرح رئيس الوزراء الإسرائيلي بنيامين نتانياهو في مداخلة متلفزة ""لدي رسالة لأعداء إسرائيل: لا تخطئوا. سندافع عن أنفسنا بكل الوسائل، على كل الجبهات. أي طرف يهاجمنا سيدفع ثمنا باهظا جدا لعدوانه"".
وقال وزير الدفاع الإسرائيلي يوآف غالانت في بيان إن ""دماء المواطنين الإسرائيليين لها ثمن""، معتبرا أن ""هذا الأمر تم إثباته بوضوح في لبنان وغزة واليمن وأماكن أخرى. إذا تجرَّؤوا على مهاجمتنا فالنتيجة ستكون هي نفسها"".
وأضاف غالانت أن ""النيران التي تندلع الآن في الحديدة تُمكِن رؤيتها في كل أنحاء الشرق الأوسط ودلالتها واضحة"".
من جهتها أكدت السعودية أنها لم تشارك في استهداف الحديدة في اليمن، وقال العميد تركي المالكي المتحدث باسم وزارة الدفاع السعودية إن المملكة ليس لها علاقة به وأن المملكة لن تسمح باختراق أجوائها من أي جهة كانت.
وقال متحدث باسم مجلس الأمن القومي الأمريكي السبت ""نقر تماما بحق إسرائيل في الدفاع عن نفسها""، مؤكدا أن الولايات المتحدة حليفة الدولة العبرية ""لم تشارك في الضربات"" على الحديدة.
كما أعلنت القيادة العسكرية المركزية الأمريكية في الشرق الأوسط (سنتكوم) في بيان على منصة إكس أن قواتها دمرت فوق البحر الأحمر طائرة بدون طيار تابعة للحوثيين المدعومين من إيران"" بعد أن تبين أن المسيرة ""تمثل تهديدا وشيكا للولايات المتحدة وقوات التحالف والسفن التجارية في المنطقة"".
نقلت وكالة الانباء الإيرانية الرسمية (إرنا) عن المتحدث باسم وزارة الخارجية الإيرانية ناصر كنعاني أن إيران ""تدين بشدة"" هذه الهجمات.
ويرى كنعاني أن الضربة ""تكشف عن الطبيعة العدوانية للكيان الصهيوني"" محذرا من ""خطر تصاعد حدة التوتر وانتشار نار الحرب في المنطقة"".
","
                                        أكد جيش الدولة العبرية اعتراضه صاروخا أطلق من اليمن، أكد الحوثيون أنه كان يستهدف إيلات الإسرائيلية. يأتي ذلك غداة غارات إسرائيلية على ميناء الحُديدة اليمنية أوقعت ستة قتلى وعشرات الجرحى. وصدرت ردود فعل مختلفة من جهات داخلية وخارجية، مع الإشارة إلى أن هذه الوقائع متصلة بالأزمة الشديدة التي تعيشها المنطقة في ظل الحرب بين إسرائيل وحماس.                ",https://www.france24.com/ar/%D8%A7%D9%84%D8%B4%D8%B1%D9%82-%D8%A7%D9%84%D8%A3%D9%88%D8%B3%D8%B7/20240721-%D8%A7%D9%84%D8%BA%D8%A7%D8%B1%D8%A7%D8%AA-%D8%A7%D9%84%D8%A5%D8%B3%D8%B1%D8%A7%D8%A6%D9%8A%D9%84%D9%8A%D8%A9-%D8%A5%D8%B3%D8%B1%D8%A7%D8%A6%D9%8A%D9%84-%D8%B9%D9%84%D9%89-%D8%A7%D9%84%D8%AD%D9%8F%D8%AF%D9%8A%D8%AF%D8%A9-%D9%81%D9%8A-%D8%A7%D9%84%D9%8A%D9%85%D9%86-%D8%AA%D8%B3%D9%81%D8%B1-%D8%B9%D9%86-%D9%88%D9%82%D9%88%D8%B9-%D9%82%D8%AA%D9%84%D9%89-%D9%88%D8%AC%D8%B1%D8%AD%D9%89,21/07/2024 - 07:22,"

                                    الشرق الأوسط
                            "
7,France 24,طواف فرنسا للدراجات: السلوفيني بوغاتشار يتوج باللقب للمرة الثالثة في مسيرته,"
للمرة الثالثة في مسيرته، توج السلوفيني تادي بوغاتشار بطواف فرنسا للدراجات الهوائية، بعدما أنهى النسخة 111 في الصدارة عقب المرحلة الحادية والعشرين الأخيرة التي فاز فيها، وكانت ضد الساعة لمسافة 33,7 كلم بين موناكو، حيث يقيم، ونيس.
ودخل بوغاتشار المرحلة الختامية متقدما بفارق 5:14 دقائق على بطل النسختين الماضيتين الدنماركي يوناس فينغيغارد و8:04 على البلجيكي ريمكو إيفينيبول، وذلك بعد فوزه بمرحلة السبت التي كانت الخامسة له في هذه النسخة.
وبعد المرحلة الختامية التي أقيمت على طول الكورنيش من موناكو إلى نيس ونقلت مباشرة في أنحاء العالم، فاز بوغاتشار بالسباق السادس له في الطواف هذا العام، وباللقب للمرة الثالثة بعد عامي 2020 و2021، ليصبح أول درّاج منذ الراحل الإيطالي ماركو بانتاني عام 1998 يحقق ثنائية تاريخية بفوزه بطوافي إيطاليا (جيرو) وفرنسا (تور دو فرانس) في العام ذاته.
واحتفظ قائد فريق الإمارات بالقميص الأصفر المخصص لمتصدر الترتيب منذ فوزه بالمرحلة الرابعة، في حين فاز الإرتيري بينيام غيرماي بالقميص الأخضر الذي يُمنح لصاحب أكثر عدد من النقاط.
وبهذا الانتصار الذي تحقق بعد اكتفائه بالوصافة في النسختين الماضيتين خلف فينغيغارد، تحضر بوغاتشار بأفضل طريقة لخوض الألعاب الأولمبية المقامة أيضاً في فرنسا، وتحديداً العاصمة باريس بين 26 تموز/يوليو و11 آب/أغسطس، على أمل تحقيق نتيجة أفضل من طوكيو 2020 حين نال البرونزية في سباق الطرقات.
وانضم بوغاتشار إلى ثلاثة درّاجين أحرزوا لقب الطواف الفرنسي ثلاث مرات هم الأمريكي غريغ لوموند (1986 و1989 و1990) والفرنسي لويزون بوبيه (1953 و1954 و1955) والبلجيكي فيليب ثيس (1913 و1914 و1920)، فيما يتشارك أربعة دراجون الرقم القياسي بأربعة ألقاب لكل منهم وهم الفرنسيان جاك أنكيتيل (بين 1957 و1964) وبرنار إينو (بين 1978 و1985) والبلجيكي إدي ميركس (بين 1969 و1974) والإسباني ميغيل إندورين (بين 1991 و1995) والبريطاني كريس فروم (بين 2013 و2017).
فرانس24/ أ ف ب","
                                        فاز السلوفيني تادي بوغاتشار بلقبه الثالث في طواف فرنسا للدراجات الهوائية بإحرازه المركز الأول الأحد في المرحلة الأخيرة. وبهذا الإنجاز، بات بوغاتشار، أول دراج منذ الراحل الإيطالي ماركو بانتاني عام 1998 يحقق ثنائية تاريخية بفوزه بطوافي إيطاليا (جيرو) وفرنسا (تور دو فرانس) في العام ذاته. واحتفظ قائد فريق الإمارات بالقميص الأصفر المخصص لمتصدر الترتيب منذ فوزه بالمرحلة الرابعة، في حين فاز الإرتيري بينيام غيرماي بالقميص الأخضر الذي يُمنح لصاحب أكثر عدد من النقاط.                ",https://www.france24.com/ar/%D8%B1%D9%8A%D8%A7%D8%B6%D8%A9/20240721-%D8%B7%D9%88%D8%A7%D9%81-%D9%81%D8%B1%D9%86%D8%B3%D8%A7-%D9%84%D9%84%D8%AF%D8%B1%D8%A7%D8%AC%D8%A7%D8%AA-%D8%A7%D9%84%D8%B3%D9%84%D9%88%D9%81%D9%8A%D9%86%D9%8A-%D8%A8%D9%88%D8%BA%D8%A7%D8%AA%D8%B4%D8%A7%D8%B1-%D9%8A%D8%AA%D9%88%D8%AC-%D8%A8%D8%A7%D9%84%D9%84%D9%82%D8%A8-%D9%84%D9%84%D9%85%D8%B1%D8%A9-%D8%A7%D9%84%D8%AB%D8%A7%D9%84%D8%AB%D8%A9-%D9%81%D9%8A-%D9%85%D8%B3%D9%8A%D8%B1%D8%AA%D9%87,21/07/2024 - 19:42,"

                                    رياضة
                            "
8,France 24,"ترامب في أول تجمع انتخابي بعد محاولة اغتياله: ""تلقيت رصاصة من أجل الديمقراطية""","
عبر دونالد ترامب الذي عقد السبت أول تجمع انتخابي له منذ نجاته من محاولة الاغتيال، عن رفضه لاتهامات بأنه يمثل تهديدا للنظام الديمقراطي الأمريكي معلنا أمام الحشد بنبرة انتصار ""تلقيت رصاصة من أجل الديمقراطية"".
وأكد مرشح الحزب الجمهوري للرئاسة ""لست متطرفا على الإطلاق"" وذلك في المهرجان الانتخابي في ميشيغان التي تعد من الولايات المتأرجحة، رافضا ما يُقال عن ارتباطه بـ""مشروع 2025"" الذي يُعد خريطة طريق للحكم صاغتها مؤسسة بحثية محافظة تضم عددا من حلفائه المقربين.
وسخر من الحزب الديمقراطي الذي تهزه ضغوط غير مسبوقة تمارس على الرئيس جو بايدن لكي ينسحب من السباق إلى البيت الأبيض وسط مخاوف بشأن سنه وقدرته على الحكم حتى 2029 إذا أعيد انتخابه.
وأمام أنصاره المتحمسين، قال ترامب أمام حشد ضم 12,000 ""ليس لديهم أي فكرة عن مرشحهم... هذا الرجل يذهب ويحصل على الأصوات، والآن يريدون سحبها منه. هذه هي الديمقراطية"".
وكرر الرئيس السابق في خطابه الناري إنما غير المترابط كالعادة، وجهات نظره المتشددة بشأن الهجرة ومزاعمه حول جرائم يرتكبها المهاجرون، وأكد مجددا أن الديمقراطيين ""زوروا"" نتيجة انتخابات 2020.
وعبر عن إعجابه بقادة سلطويين في العالم ولا سيما الرئيس الصيني ""الرائع"" شي جينبينغ الذي أشاد بضبطه ""1,4 مليار نسمة بقبضة حديدية"".
وتحدث مجددا عن تفاصيل وقائع تعرضه لمحاولة الاغتيال بالرصاص خلال تجمع انتخابي في بنسيلفانيا عندما رفع قبضته والدم يسيل على وجهه ومحاطا بعناصر جهاز الخدمة السرية، وهتف مخاطبا أنصاره  ""فايت فايت فايت"" (كافحوا).
ورد عليه الحشد في غراند رابيدز السبت هاتفا العبارة نفسها، وإن كان البعض قد ملوا طول الخطاب الذي استمر 90 دقيقة وباشروا التوجه إلى بوابات الخروج.
ويمثل هذا التجمع لحظة لافتة بكافة المعايير مع عودة ترامب إلى الحملة الانتخابية بعد أسبوع تماما من محاولة الاغتيال.
وكان يضع ضمادة أصغر حجما بلون الجلد فوق أذنه اليمنى التي جرحت في محاولة الاغتيال التي نفذها مسلح في العشرين من العمر وأدت إلى مقتل أحد الحاضرين.
لكن ترامب الذي نجا من الموت تجاهل دعواته إلى وحدة الصف وعاد إلى الخطاب المثير للانقسام الذي طبع مسيرته السياسية.
وكال الشتائم والقدح ووصف بايدن برجل عجوز ""غبي"" و""ضعيف"" ونَعَت نائبة الرئيس كامالا هاريس بـ""المجنونة"".
ورفضت حملة بايدن-هاريس الخطاب معتبرة أنه ""يروج لنفس الأكاذيب (و) ويقوم بنفس حملة الانتقام"".
وتم تشديد الإجراءات الأمنية داخل ملعب فان أنديل أرينا، على وقع تساؤلات بشأن أخطاء جهاز الخدمة السرية في تجمع بنسيلفانيا، على الرغم من عدم ظهور مؤشرات واضحة تذكر على تعزيز تدابير إنفاذ القانون في غراند رابيدز.
بالتزامن مع ذلك واصل أنصار بايدن الدفاع عن الرئيس على الرغم من تصاعد الدعوات التي تطالبه بوقف حملته.
ولا يزال الرئيس البالغ 81 عاما وفريقه مصرين علنا على بقائه في السباق، وإن ألمحت بعض التقارير عن بدء الحديث في أوساطه بشأن كيف يمكنه الانسحاب.
وبرزت تكهنات واسعة بشأن المرشح الذي يمكن أن يحل مكانه، ويبدو أن كامالا هاريس في أفضل موقع للقيام بذلك كونها نائبة الرئيس.
وقدمت السناتورة التقدمية إليزابيث وارن، دفعا لهاريس السبت من دون أن تدير ظهرها للرئيس.
وأفادت لتلفزيون ""إم إس إن بي سي"" إن ""جو بايدن مرشحنا... لديه قرار كبير ينبغي أن يتخذه"".
وتابعت ""ما يعطيني الكثير من الأمل الآن هو أنه إذا قرر الرئيس بايدن الانسحاب، لدينا نائبة الرئيس كامالا هاريس المستعدة لتوحيد صف الحزب ومواجهة دونالد ترامب والفوز في (انتخابات) تشرين الثاني/نوفمبر"".
لكن عددا من الديمقراطيين يخشون أن يؤدي مثل هذا التبديل المتأخر إلى فوضى وهزيمة انتخابية.
من جانبه يبدو فريق ترامب منتعشا إثر سلسة من الأحداث المؤاتية، من نجاة ترامب من محاولة الاغتيال إلى أحكام قضائية لصالح المرشح الجمهوري، مرورا بأداء بايدن الكارثي في المناظرة الشهر الماضي.
وكانت فعالية السبت أول مشاركة لترامب في حملته الانتخابية مع المرشح على بطاقته لمنصب نائب الرئيس جيمس ديفيد فانس، السناتور البالغ 39 عاما وهو من أصول متواضعة ويمكنه المساعدة في الفوز في معارك حاسمة في ولايات ""حزام الصدأ"" مثل ميشيغان وبنسيلفانيا.
وأثار فانس حماسة الجمهور بانتقاده هاريس.
وقال في إشارة إلى المدعية العامة السابقة في ولاية كاليفورنيا ""خدمتُ في سلاح البحرية الأمريكي وأسست نشاطا تجاريا. ما الذي فعلته انتِ عدا عن قبض شيك؟""
وكان أنصار ترامب قد بدؤوا التجمع بالعشرات في غراند رابيدز قبل يوم من المهرجان الانتخابي.
ومن بينهم إدوارد يانغ (64 عاما) الذي ارتدى قميصا قطنيا عليه صورة ترامب التي دخلت التاريخ رافعا قبضته بعد ثوان من محاولة اغتياله.
وقال ""حولوه إلى شهيد حي"" مضيفا ""أصبح الآن أقوى من أي وقت مضى"".
","
                                        خلال أول تجمع انتخابي عقده منذ نجاته من محاولة الاغتيال، رفض دونالد ترامب السبت اتهامات بأنه يمثل تهديدا للنظام الديمقراطي الأمريكي معلنا أمام الحشد بنبرة انتصار ""تلقيت رصاصة من أجل الديمقراطية"".                 ",https://www.france24.com/ar/%D8%A3%D9%85%D8%B1%D9%8A%D9%83%D8%A7/20240721-%D8%A7%D9%84%D8%B1%D8%B5%D8%A7%D8%B5%D8%A9-%D8%A7%D9%84%D8%AA%D9%8A-%D8%A3%D8%B5%D8%A7%D8%A8%D8%AA-%D8%A3%D8%B0%D9%86-%D8%AA%D8%B1%D8%A7%D9%85%D8%A8-%D8%AA%D8%B1%D9%83%D8%AA-%D8%AC%D8%B1%D8%AD%D8%A7-%D8%A8%D8%B9%D8%B1%D8%B6-%D8%B3%D9%86%D8%AA%D9%8A%D9%85%D8%AA%D8%B1%D9%8A%D9%86,21/07/2024 - 07:58,"

                                    أمريكا
                            "
9,France 24,في سابقة تاريخية، بايدن ينسحب من السباق نحو البيت الأبيض,,"
                                                أعلن الرئيس الأميركي جو بايدن انسحابه من السباق الرئاسي لعام 2024 بعد أسابيع على الشكوك التي أحاطت بوضعه الجسدي والذهني، ودعم ترشيح نائبته كامالا هاريس ""لهزيمة ترامب"".وبذلك ينضم الديموقراطي البالغ 81 عاما إلى النادي المحدود للغاية من الرؤساء الأميركيين المنتهية ولايتهم الذين سحبوا ترشحهم لولاية ثانية. لكنه أول من فعل ذلك في وقت متأخر من الحملة، كما أنه الوحيد الذي اضطر إلى الانسحاب بسبب تساؤلات حول سلامة مداركه العقلية.                    ",https://www.france24.com/ar/%D9%81%D9%8A%D8%AF%D9%8A%D9%88/20240721-%D9%81%D9%8A-%D8%B3%D8%A7%D8%A8%D9%82%D8%A9-%D8%AA%D8%A7%D8%B1%D9%8A%D8%AE%D9%8A%D8%A9-%D8%A8%D8%A7%D9%8A%D8%AF%D9%86-%D9%8A%D9%86%D8%B3%D8%AD%D8%A8-%D9%85%D9%86-%D8%A7%D9%84%D8%B3%D8%A8%D8%A7%D9%82-%D9%86%D8%AD%D9%88-%D8%A7%D9%84%D8%A8%D9%8A%D8%AA-%D8%A7%D9%84%D8%A3%D8%A8%D9%8A%D8%B6,21/07/2024 - 21:30,
