,source,title,content,description,url,published_at,tags
10,France 24,اتفاق بين مانيلا وبكين لإعادة إمداد سفينة راسية في بحر الصين الجنوبي بالطعام والمؤن,"
بعد سلسلة مواجهات بين البلدين في المياه المتنازع عليها، اتفقت الفلبين مع الصين على ""ترتيبات"" بشأن إعادة تموين قواتها المتمركزة على جزر مرجانية في بحر الصين الجنوبي، بحسب ما أعلنت مانيلا الأحد،
وكان مركز عسكري فلبيني ناء على جزيرة ساكند توماس شول المرجانية محور اشتباكات بين السفن الصينية والفيليبينية في الأشهر الأخيرة، مع تكثيف بكين مطالبتها بكامل السيادة على بحر الصين الجنوبي.
وفقد بحار فلبيني إبهامه في مواجهة أخيرة وقعت في 17 حزيران/يونيو عندما أحبط خفر السواحل الصينيون باستخدام السكاكين والعصي والفؤوس محاولة للبحرية الفيليبينية لإعادة إمداد قواتها.
ويأتي إعلان الأحد بعد محادثات بين الفلبين والصين هذا الشهر اتفقتا خلالها على زيادة عدد قنوات الاتصال لحل الخلافات البحرية بينهما.
وقالت الخارجية الفلبينية إن ""الفلبين وجمهورية الصين الشعبية توصلتا إلى تفاهم بشأن ترتيبات موقتة لإعادة الإمداد بالضروريات اليومية ومهام التناوب إلى بي آر بي سييرا مادري+ في أيونغين شول""، مستخدمة الاسم الفلبيني لساكنه توماس شول.
ولم تقدم الخارجية أي تفاصيل عن هذا الترتيب، لكنها قالت إن الجانبين يدركان الحاجة إلى ""تهدئة الوضع في بحر الصين الجنوبي وإدارة الخلافات من خلال الحوار والتشاور"".
ولم ترد سفارة الصين في مانيلا على الفور على طلب للتعليق.
وتتمركز مجموعة من القوات الفلبينية على السفينة الحربية المتوقفة والصدئة ""بي آر بي سييرا مادري"" التي تمت ترسيتها عمدا في جزيرة ساكند توماس شول عام 1999 لتأكيد مطالبات مانيلا بالمنطقة.
ويحتاج الجنود الفلبينيون إلى إمدادات الغذاء والماء وغيرها من الضروريات، فضلا عن وسائل نقل لتناوب العناصر.
وفي وقت سابق الأحد، قالت مانيلا إن مهام إعادة الإمداد ستظل عملية فلبينية، بعد أن تعهدت واشنطن ""بفعل ما هو ضروري"" لدعمها.
وقال مساعد رئيس مجلس الأمن القومي الفيليبيني جوناثان مالايا ""في ما يتعلق بمهمة التناوب وإعادة الإمداد، فإننا نبقيها عملية فلبينية بحتة تستخدم السفن والأفراد والقيادة الفلبينية"".
وأضاف ""قد يتغير ذلك اعتمادا على توجيهات القيادة العليا، ولكن هذا هو الاتجاه أو السياسة في الوقت الراهن"".
وجاءت تصريحات مالايا بعد أن قال مستشار الأمن القومي في البيت الأبيض جايك ساليفان إن الولايات المتحدة ""ستفعل ما هو ضروري"" لضمان قدرة الفلبين على مواصلة إعادة إمداد قواتها في الجزيرة المرجانية المتنازع عليها.
وأضاف ساليفان خلال مؤتمر منتدى آسبن الأمني في كولورادو ""سنواصل دعم الفلبين والوقوف خلفها"".
وقال مالايا إن مجلس الأمن القومي يقدّر العرض الأميركي والفلبين ستواصل المشاورات كحليفة في المعاهدة.
وترتبط مانيلا باتفاقية دفاع مشترك مع الولايات المتحدة تلزم الطرفين الدفاع المتبادل في حال وقوع ""هجوم مسلح"" ضد سفنهما وطائراتهما وجنودهما وخفر سواحلهما في أي مكان في منطقة المحيط الهادئ. وتقول واشنطن أن المعاهدة تشمل جنوب الصين.
","
                                        بعد محادثات أثمرت الشهر الجاري زيادة عدد قنوات الاتصال لحل خلافاتهما البحرية، توصلت الفلبين والصين الأحد إلى تفاهم بشأن ترتيبات مؤقتة لإعادة إمداد سفينة تابعة للبحرية راسية في بحر الصين الجنوبي بالطعام والمؤن. وتتمركز مجموعة من القوات الفلبينية على السفينة الحربية المتوقفة والصدئة ""بي آر بي سييرا مادري"" التي تمت ترسيتها عمدا في جزيرة ساكند توماس شول عام 1999 لتأكيد مطالبات مانيلا بالمنطقة. ويحتاج الجنود الفلبينيون إلى إمدادات الغذاء والماء وغيرها من الضروريات، فضلا عن وسائل نقل لتناوب العناصر.                ",https://www.france24.com/ar/%D8%A2%D8%B3%D9%8A%D8%A7/20240721-%D8%A7%D8%AA%D9%81%D8%A7%D9%82-%D8%A8%D9%8A%D9%86-%D9%85%D8%A7%D9%86%D9%8A%D9%84%D8%A7-%D9%88%D8%A8%D9%83%D9%8A%D9%86-%D9%84%D8%A5%D8%B9%D8%A7%D8%AF%D8%A9-%D8%A5%D9%85%D8%AF%D8%A7%D8%AF-%D8%B3%D9%81%D9%8A%D9%86%D8%A9-%D8%B1%D8%A7%D8%B3%D9%8A%D8%A9-%D9%81%D9%8A-%D8%A8%D8%AD%D8%B1-%D8%A7%D9%84%D8%B5%D9%8A%D9%86-%D8%A7%D9%84%D8%AC%D9%86%D9%88%D8%A8%D9%8A-%D8%A8%D8%A7%D9%84%D8%B7%D8%B9%D8%A7%D9%85-%D9%88%D8%A7%D9%84%D9%85%D8%A4%D9%86,21/07/2024 - 20:33,"

                                    آسيا
                            "
11,France 24,بايدن ينسحب من الانتخابات الرئاسية ونائبته قد تكون المرشحة الجديدة للحزب الديمقراطي,"
أعلن الرئيس الأمريكي جو بايدن الأحد أنه سينسحب من الانتخابات الأمريكية المقررة في الخامس من نوفمبر تشرين الثاني.
أهم الأحداث:
بايدن يقول إنه يدعم نائبته كامالا هاريس لخوض انتخابات الرئاسة المقررة بعد أربعة أشهر.
أوباما يشيد ببايدن ويبدي ثقته في أن الزعماء الديمقراطيين سينشئون آلية لاختيار مرشح بارز.
ترامب: هزيمة كاملا هاريس ستكون أسهل من هزيمة بايدن.
هاريس تتعهد بالفوز بترشيح الحزب الديموقراطي و""هزيمة دونالد ترامب"".
أعضاء ديمقراطيون في الكونغرس يعلنون دعمهم لهاريس وشخصيات بارزة تلتزم الصمت مثل أوباما وبيلوسي.
حاكم كاليفورنيا يعلن دعمه لهاريس بعد توقعات بأنه سيكون منافسا لها على ترشيح الحزب الديمقراطي.
فرانس24/ أ ف ب / رويترز","
                                        في إعلان مفاجئ، يأتي قبل أقل من أربعة أشهر على الاستحقاق الرئاسي، قرر الرئيس الأمريكي جو بايدن الأحد الانسحاب من الانتخابات الأمريكية المقررة في الخامس من تشرين الثاني/ نوفمبر ، وذلك بعد أن فقد أقرانه الديمقراطيون الثقة في قدرته البدنية والعقلية على التغلب على المرشح الجمهوري دونالد ترامب. وأكد بايدن دعمه لنائبته كامالا هاريس لتكون مرشحة الحزب الديمقراطي، لكن طريقها للترشيح قد لا يخلو من بعض العقبات.                 ",https://www.france24.com/ar/%D8%A3%D9%85%D8%B1%D9%8A%D9%83%D8%A7/20240721-%F0%9F%94%B4-%D9%85%D8%A8%D8%A7%D8%B4%D8%B1-%D8%A8%D8%A7%D9%8A%D8%AF%D9%86-%D9%8A%D8%B9%D9%84%D9%86-%D8%A7%D9%84%D8%A7%D9%86%D8%B3%D8%AD%D8%A7%D8%A8-%D9%85%D9%86-%D8%B3%D8%A8%D8%A7%D9%82-%D8%A7%D9%84%D8%B1%D8%A6%D8%A7%D8%B3%D8%A9-%D8%A7%D9%84%D8%A3%D9%85%D8%B1%D9%8A%D9%83%D9%8A%D8%A9,21/07/2024 - 20:12,"

                                    أمريكا
                            "
12,France 24,"السلطات الفرنسية تسابق الزمن لحماية أولمبياد باريس من تهديد تنظيم ""الدولة الإسلامية""","
تبذل السلطات الفرنسية  جهودا من أجل تأمين أراضيها من تهديد تنيظم ""الدولة الإسلامية"" خلال فعاليات أولمبياد باريس المزمع انطلاقها في 26 تموز/يوليو.
ويستهدف إسلاميون فرنسا منذ فترة طويلة بسبب ماضيها الاستعماري والمشاعر المعادية للمسلمين ومشاركتها التاريخية في الحروب بالشرق الأوسط وأفريقيا.
تلقى الصحافي الطاجيكي تيمور فاركي اتصالا مثيرا للقلق من شرطة باريس في أواخر آذار/مارس بعد أيام فقط مما قيل عن تنفيذ مسلحين من بلاده ينتمون لتنظيم ""الدولة الإسلامية"" مذبحة في موسكو.
واستجوبه ضابطان بشأن الجالية الصغيرة من مهاجري طاجيكستان في فرنسا.
ويتذكر فاركي أن الضابطين كانا يسألونه ""من تعرف؟ كم عددهم؟ أين هم؟"" وكان أحدهم يتحدث الروسية، التي يشيع استخدامها في دول آسيا الوسطى.
وأوضح فاركي، وهو لاجئ سياسي في فرنسا عمل في وسائل إعلام مثل هيئة الإذاعة البريطانية (بي.بي.سي)، للشرطة في الاتصال إنه يعرف مجموعة صغيرة من الطاجيك معظمهم من المهاجرين والمعارضين.
غير أنه قال ""لكنني لا أعرف أي جهاديين"". وقبل انطلاق أولمبياد باريس في 26 تموز/يوليو، تسابق أجهزة الأمن الفرنسية الزمن لسبر غور ملف ليس لديها فيه الكثير من المعلومات من خلال إقامة علاقات أوثق مع الطاجيك وآخرين من دول وسط آسيا في البلاد، وفقا لما قاله أكثر من 12 مصدرا مطلعا.
ومن بين تلك المصادر مسؤولون حاليون وسابقون في المخابرات والشرطة ودبلوماسيون ومهاجرون من آسيا الوسطى تواصلت السلطات معهم.
تأتي عمليات التواصل تلك التي لم يعلن عنها من قبل، في أعقاب هجومين كبيرين وقعا هذا العام قالت السلطات إنهما من تنفيذ عناصر طاجيكية من تنظيم ""الدولة الإسلامية""-ولاية خراسان، أحد أجنحة التنظيم المتشدد المسمى باسم منطقة خراسان التاريخية التي كانت تضم مناطق من إيران وأفغانستان وآسيا الوسطى.
وقتل نحو مئة في هجوم انتحاري مزدوج خلال مراسم لتأبين قائد الحرس الثوري الإيراني قاسم سليماني يوم الثالث من كانون الثاني/يناير، كما قتل أكثر من 130 في هجوم وقع في موسكو يوم 22 آذار/مارس قام خلالها مسلحون بإطلاق النار على رواد حفل موسيقي في قاعة كروكوس سيتي.
وقالت السلطات الفرنسية إنها أحبطت بالفعل هجوما لمتشددين إسلاميين كان مخططا خلال الأولمبياد واعتقلت في أواخر أيار/مايو شابا شيشانيا (18 عاما) يشتبه في أنه خطط لمهمة انتحارية لصالح تنظيم ""الدولة الإسلامية"" في ملعب سانت إتيان لكرة القدم حيث كانت ستلعب فرق فرنسا والولايات المتحدة وأوكرانيا.
وقال قائد شرطة باريس الشهر الماضي ""لا يزال إرهاب المتشددين الإسلاميين مصدر قلقنا الرئيسي"" خلال دورة الألعاب الأولمبية، على الرغم من قول السلطات إنه ليس هناك أي تهديدات مباشرة على الألعاب.
وطاجيكستان، التي عانت من حرب أهلية في التسعينيات، أفقر دول الاتحاد السوفيتي السابق. ويعتمد نصف ناتجها الاقتصادي تقريبا على تحويلات المهاجرين وخاصة الموجودين في روسيا.
يرى العديد من الخبراء الأمنيين أن الشبان الفقراء المعزولين بين المغتربين الطاجيك يشكلون مزيجا جذابا لتنظيم ""الدولة الإسلامية""-ولاية خراسان لتجنيدهم.
وقال مصدر في المخابرات إن المخابرات الفرنسية ليس لديها إلا قليل من العناصر والعملاء في آسيا الوسطى وتجد أنه من الصعب اختراق جاليتها الصغيرة المتماسكة. ووفقا لرابطة الطاجيك في فرنسا، تعيش حوالي 30 عائلة طاجيكية في البلاد.
وأضاف مصدر المخابرات، الذي طلب عدم ذكر اسمه لتتسنى له مناقشة مسائل أمنية، إن تنظيم ""الدولة الإسلامية""-ولاية خراسان يمثل تهديدا جديدا نسبيا ظهر مع قدرة قائمين على التجنيد من الخارج على استمالة قادمين من دول في آسيا الوسطى يقيمون في فرنسا للتطرف من أجل دفعهم لتنفيذ هجمات على الأراضي الفرنسية.
وذكر المصدر أن الدليل على ذلك هو اعتقال طاجيكي في 2022 بتهمة التخطيط لهجوم في ستراسبورغ. وأضاف أن الرجل كان يتصرف بناء على تعليمات من عناصر اتصال تابعة لتنظيم ""الدولة الإسلامية""-ولاية خراسان موجودين في الخارج.
وقال مصدر أمني ثان إن فرنسا حددت هوية 12 من مسؤولي الاتصال لدى لتنظيم ""الدولة الإسلامية""-ولاية خراسان موجودين في دول حول أفغانستان ولديهم حضور قوي على الإنترنت ويحاولون إقناع شباب في دول أوروبية مهتمين بالانضمام إلى التنظيم من الخارج بتنفيذ هجمات في الدول التي هم فيها.
وأضاف المصدر أن مسؤولي الاتصال في التنظيم يقومون بعد ذلك بربط من جندوهم بأشخاص يمكنهم أن يزودوهم ببطاقات هوية مزورة وأسلحة على أرض الدولة المعنية في عملية لا تستغرق إلا بضعة أسابيع.
ورفض ضابطا الشرطة اللذان تحدثا إلى فاركي الرد على طلبات من رويترز للحصول على تعليق. وأحالت شرطة باريس الأسئلة إلى وزارة الداخلية الفرنسية التي رفضت أيضا التعقيب.
كما لم ترد وزارة الخارجية في طاجيكستان على طلب للتعليق.
تحدثت رويترز أيضا مع اثنين آخرين من طاجيكستان وامرأة من أوزبكستان مقيمين في فرنسا اتصلت بهم الشرطة واستجوبتهم بخصوص الجاليات التي ينتمون إليها.
وقالت ناديجدا أتاييفا، وهي ناشطة في مجال حقوق الإنسان من أوزبكستان وتعمل في مدينة لومان بشمال غرب فرنسا، إنها أعطت ضباط الشرطة رقم هاتف فاركي بعد زيارتها لمركز الشرطة في باريس.
وأضافت ""طلبت مني أرقام هواتف طاجيك أثق بهم. وقال لي أفراد الشرطة إنهم يريدون التحدث مع أفراد من طاجيكستان لمعرفة آرائهم بشأن ما حدث في موسكو"".
وقال سيباستيان بيروز، وهو أكاديمي فرنسي قدم إفادات لأجهزة أمن فرنسية وأمريكية بشأن التطرف في دول في آسيا الوسطى، إن السلطات الفرنسية ربما تباطأت في الاستجابة لوجود تهديدات أمنية محتملة من طاجيك.
وأضاف ""انصب تركيز فرنسا على متشددين قادمين من الشرق الأوسط والجزائر وشمال أفريقيا بشكل أكبر من آسيا الوسطى... وأعتقد أن فرنسا تفاجأت بما حدث في موسكو وقد تكون (استجابتها) قد تأخرت قليلا"".
وقال إدوارد ليمون، وهو خبير من طاجيكستان يقدم تقارير دورية لأجهزة أمن غربية، إن المخابرات الروسية لا تزال الأفضل من حيث متابعة شبكات الجماعات المتشددة في آسيا الوسطى رغم إخفاقها في منع الهجوم على قاعة كروكوس سيتي.
لكن وزير الدفاع والقوات المسلحة الفرنسي سيباستيان ليكورنو أشار في نيسان/أبريل إلى تراجع كبير في تبادل المعلومات الاستخباراتية بين روسيا وفرنسا بشأن تنظيم ""الدولة الإسلامية"" وجماعات متشددة أخرى منذ الغزو الروسي لأوكرانيا في 2022.
وقال مسؤولان بوزارة الخارجية الأمريكية ينسقان بشأن أمن الفريق الأولمبي الأمريكي لرويترز إنهما يثقون في الاستعدادات الأمنية التي تجريها فرنسا. وأضافا، دون الخوض في تفاصيل، أن جهود فرنسا الرامية إلى بناء علاقات أقوى مع الجالية الطاجيكية تعكس ممارسة شائعة لمكافحة الإرهاب، وهي تحديد أفراد من جالية معينة ربما يشكلون تهديدا.
وقال أحدهما إن ""الجميع يرغب في الحصول"" على مزيد من المعلومات حول التهديدات القادمة من دول في آسيا الوسطى.
وبحسب ليمون واثنين آخرين من الخبراء في شؤون آسيا الوسطى أجرت رويترز معهما مقابلة، يأتي التهديد الأساسي الذي يشكله طاجيك في أوروبا من حوالي عشرة متطرفين قاتلوا في سوريا ثم عادوا إلى أوروبا تدريجيا عبر أوكرانيا بعد أفول قوة تنظيم ""الدولة الإسلامية"" في الشرق الأوسط.
وفي العام الماضي، ألقت السلطات الألمانية القبض على سبعة مواطنين من دول في آسيا الوسطى مقيمين في البلاد للاشتباه في تأسيسهم منظمة إرهابية. وقال ممثلون للادعاء إن المتهمين القادمين من تركمانستان وطاجيكستان وقرغيزستان دخلوا إلى ألمانيا عبر أوكرانيا بعد وقت قصير من الغزو الروسي لأوكرانيا في أوائل 2022.
وهم في السجن حاليا ينتظرون المحاكمة.
وقدر ليمون أن هناك عشرات الآلاف من الطاجيك يعيشون في أوروبا، ويتركزون بالأساس في بولندا وألمانيا.
ومعظم هؤلاء لاجئون سياسيون وصلوا قبل حوالي عشر سنوات بعد أن صنف رئيس طاجيكستان إمام علي رحمن حركتي المعارضة (المجموعة 24) و(حزب النهضة الإسلامية)‭ ‬على أنهما منظمتان متشددتان وإرهابيتان.
ويتولى رحمن، حليف روسيا، رئاسة طاجيكستان منذ 30 عاما.
وقال فاركي، وهو من أعتى المعارضين لرحمن، إنه طلب اللجوء إلى فرنسا في 2016 لأنه يحب الثقافة والأدب فيها. وأضاف أنه لم يتحدث قط مع أجهزة الأمن الفرنسية حتى تواصلت معه الشرطة في آذار/مارس.
وأفاد محمد إقبال صدر الدين، وهو معارض طاجيكي آخر مقيم في فرنسا، بأنه تحدث أيضا مع الشرطة.
وقال ""لقد سألوني عما أعرفه"". وأضاف أنه كان يود المساعدة لكنه قال لهم ""لا أعرف أشخاصا من طاجيكستان لهم آراء متطرفة"". وقال ثلاثة خبراء في مجال المخابرات الوقائية ومكافحة التجسس لرويترز إن جهود فرنسا في اختراق صفوف الجالية الطاجيكية قد تأتي بنتائج عكسية.
وذكر عميل سابق في المخابرات الأمريكية، طلب عدم ذكر اسمه نظرا لإدلائه بمعلومات حول فترة عمله مع أجهزة أمن فرنسية بشأن مسائل تتعلق بدول في آسيا الوسطى، أن عمليات مكافحة التجسس والمخابرات الوقائية في فرنسا تحظى عموما بتقدير كبير، لكن الضغط على الطاجيك للحصول على معلومات قد يأتي بنتائج عكسية من خلال شعورهم بأنهم يوصمون بصورة نمطية سلبية في المجتمع بما يجعلهم أقل استعدادا للإبلاغ عن أفراد قد يشكلون خطرا.
ويتفق جون-فرانسوا راتيل، وهو خبير في شؤون الجماعات الإسلامية المتشددة في جامعة أوتاوا، مع هذا الرأي.
وقال ""كان ينبغي بدء بناء علاقات مع الجالية الطاجيكية قبل أعوام. إذا كان الدافع الوحيد لذلك هو مكافحة الإرهاب فحسب، فإنها وصفة لفشل حتمي... وإذا قررت فرنسا الضغط أكثر من اللازم على تلك الجالية، فقد يتسبب ذلك في خلق التهديد الإرهابي الذي تسعى فرنسا إلى القضاء عليه قبل الألعاب الأولمبية 2024"".
","
                                        مع اقتراب موعد بدء الألعاب الأولمبية في باريس المقررة في 26 تموز/يوليو، تسابق فرنسا الزمن لتأمين البلاد من تهديد تنظيم ""الدولة الإسلامية"". وأحبطت السلطات الفرنسية هجوما لمتشددين إسلاميين كان مخططا خلال الأولمبياد واعتقلت في أواخر أيار/مايو شابا شيشانيا (18 عاما) يشتبه في أنه خطط لمهمة انتحارية لصالح تنظيم ""الدولة الإسلامية"" في ملعب سانت إتيان لكرة القدم حيث كانت ستلعب فرق فرنسا والولايات المتحدة وأوكرانيا.                ",https://www.france24.com/ar/%D8%B1%D9%8A%D8%A7%D8%B6%D8%A9/20240721-%D8%A7%D9%84%D8%B3%D9%84%D8%B7%D8%A7%D8%AA-%D8%A7%D9%84%D9%81%D8%B1%D9%86%D8%B3%D9%8A%D8%A9-%D8%AA%D8%B3%D8%A7%D8%A8%D9%82-%D8%A7%D9%84%D8%B2%D9%85%D9%86-%D9%84%D8%AD%D9%85%D8%A7%D9%8A%D8%A9-%D8%A3%D9%88%D9%84%D9%85%D8%A8%D9%8A%D8%A7%D8%AF-%D8%A8%D8%A7%D8%B1%D9%8A%D8%B3-%D9%85%D9%86-%D8%AA%D9%87%D8%AF%D9%8A%D8%AF-%D8%AA%D9%86%D8%B8%D9%8A%D9%85-%D8%A7%D9%84%D8%AF%D9%88%D9%84%D8%A9-%D8%A7%D9%84%D8%A5%D8%B3%D9%84%D8%A7%D9%85%D9%8A%D8%A9,21/07/2024 - 12:41,"

                                    رياضة
                            "
