,source,title,content,description,url,published_at,tags
0,France 24,"مهرجان دوفيل: ""استبعاد"" الموسيقار الفرنسي اللبناني إبراهيم معلوف من لجنة التحكيم","
كشفت مديرة مهرجان دوفيل الجديدة أود إسبير في مقابلة مع صحيفة ""لا تريبون ديمانش"" الفرنسية أنها ""اتخذت القرار الصعب"" بـ""إقصاء إبراهيم معلوف عن لجنة التحكيم"".
وقالت ""لقد أصبح وجود إبراهيم معلوف موضع إشكال متزايد لناحية الإدارة الجيدة والهادئة للمهرجان الذي يحتفل بالذكرى الخمسين لانطلاقه، وهي أيضا نسختي الأولى التي أرغب في إقامتها بوضوح وشفافية""، وذلك قبل أقل من أسبوعين من انطلاق هذه النسخة المقررة في الفترة ما بين 6 و15 أيلول/سبتمبر المقبل.
ومن جهتها، أسفت فاني كولان، محامية معلوف، في رسالة إلى وكالة الأنباء الفرنسية مساء السبت، لكون ""مهرجان دوفيل قد ضحى بشخص بريء على مذبح المبدأ الأسمى -العرض يجب أن يستمر- the show must go on من أجل مصالح تجارية"".
وقالت ""طلب المهرجان من إبراهيم معلوف ’الانسحاب بهدوء‘، وهو ما رفضه بوضوح""، مضيفة ""هذا في الواقع تجاهل لتبرئته وللاعتراف علنا ببراءته، وهو سيحارب بالعلانية نفسها وأمام المحاكم هذا الإقصاء الظالم والمهين لأصحابه"".
أما أود إسبير فأوضحت أنه ""عند الإعلان عن أعضاء لجنة التحكيم في الثامن من آب/أغسطس، سُجلت ردود فعل كثيرة على شبكات التواصل الاجتماعي وفي وسائل الإعلام، وساد انزعاج في الفريق، الذي تضرر بالفعل من القضية السابقة"".
هذا، وكانت إسبير قد تسلمت رئاسة المهرجان خلفا لبرونو بارد الذي استقال من منصبه بعد اتهامات بالاعتداء الجنسي نشرها موقع ""ميديابارت"" الإخباري الفرنسي.
وأضافت رئيسة مهرجان دوفيل أنه ""في بداية المهرجان، سننشر ميثاقا ضد العنف الجنسي والعنف القائم على النوع الاجتماعي، لتجنب جميع أشكال إساءة استخدام السلطة، حتى بما يتخطى نطاق حركة ’مي تو‘ (المناهضة للعنف الجنسي)، وسنكون يقظين للغاية بشأن هذه المواضيع في المستقبل"".
ويشار إلى أن إبراهيم معلوف كان قد اتُّهم قبل سنوات بالاعتداء الجنسي على قاصرة، وهي قضية تمت تبرئته فيها في العام 2020.
","
                                        قالت المديرة الجديدة لمهرجان دوفيل للسينما الأمريكية في فرنسا، إن عازف البوق الفرنسي اللبناني إبراهيم معلوف لم يعد عضوا في لجنة التحكيم، بسبب ""انزعاج في الفريق"" مرتبط باتهامات سابقة بالاعتداء الجنسي بُرِّئ منها الفنان منذ سنوات. وكان إبراهيم معلوف قد اتُّهم بالاعتداء الجنسي على قاصرة، وهي قضية تمت تبرئته فيها عام 2020.                ",https://www.france24.com/ar/%D8%AB%D9%82%D8%A7%D9%81%D8%A9/20240825-%D9%85%D9%87%D8%B1%D8%AC%D8%A7%D9%86-%D8%AF%D9%88%D9%81%D9%8A%D9%84-%D8%A5%D9%82%D8%B5%D8%A7%D8%A1-%D8%A7%D9%84%D9%85%D9%88%D8%B3%D9%8A%D9%82%D8%A7%D8%B1-%D8%A7%D9%84%D9%81%D8%B1%D9%86%D8%B3%D9%8A-%D8%A7%D9%84%D9%84%D8%A8%D9%86%D8%A7%D9%86%D9%8A-%D8%A5%D8%A8%D8%B1%D8%A7%D9%87%D9%8A%D9%85-%D9%85%D8%B9%D9%84%D9%88%D9%81-%D8%B9%D9%86-%D9%84%D8%AC%D9%86%D8%A9-%D8%A7%D9%84%D8%AA%D8%AD%D9%83%D9%8A%D9%85,25/08/2024 - 16:45,"

                                    ثقافة
                            "
1,France 24,هل سيتمكن سكان شمال إسرائيل من العودة إلى بيوتهم قريبا؟,,"
                                                أطلقت جماعة حزب الله اللبنانية المتحالفة مع إيران مئات الصواريخ والطائرات المسيرة على إسرائيل في وقت مبكر من يومالأحد، فيما قال الجيش الإسرائيلي إنه استهدف لبنان بنحو 100 طائرة مقاتلة في ضربة استباقية لتفادي هجوم أكبر. وقال نتنياهو في بيان سابق ""عازمون على بذل كل ما في وسعنا للدفاع عن بلدنا، وإعادة سكان الشمال بسلام إلى منازلهم ومواصلة الالتزام بقاعدة بسيطة: من يؤذينا نؤذيه"".                     ",https://www.france24.com/ar/%D9%81%D9%8A%D8%AF%D9%8A%D9%88/20240825-%D9%87%D9%84-%D8%AA%D9%85%D9%83%D9%86-%D8%A5%D8%B9%D8%A7%D8%AF%D8%A9-%D8%B3%D9%83%D8%A7%D9%86-%D8%B4%D9%85%D8%A7%D9%84-%D8%A5%D8%B3%D8%B1%D8%A7%D8%A6%D9%8A%D9%84-%D8%A5%D9%84%D9%89-%D9%85%D9%86%D8%A7%D8%B2%D9%84%D9%87%D9%85-%D9%82%D8%B1%D9%8A%D8%A8%D8%A7,25/08/2024 - 15:52,"
                                    الأخبار المغاربية
                            "
2,France 24,"فرنسا: اعتقال المشتبه في تنفيذه الهجوم على كنيس يهودي وماكرون يندد بعمل ""إرهابي"" وبمعاداة السامية","
قال وزير الداخلية الفرنسي جيرالد دارمانان أن الرجل الذي يُشتبه في أنه منفذ الهجوم على كنيس يهودي السبت في جنوب فرنسا، قد اعتُقل مساء اليوم نفسه.
ونشر دارمانان على منصة إكس أن اعتقال المشتبه به تم بأيدي شرطيين من وحدة النخبة ""تدخلوا بمهنية عالية على الرغم من إطلاقه النار"". من جهته، قال مصدر مطلع على الملف إن عملية الاعتقال تمت في مدينة نيم، على بعد حوالى 40 كلم شمال منطقة لا غراند موت.
ويذكر أن هجوما استهدف معبدا يهوديا في جنوب فرنسا السبت إذ أشعل مشتبه به يحمل العلم الفلسطيني حرائق عدة وتسبب بانفجار، فيما ندد الرئيس الفرنسي إيمانويل ماكرون بعمل ""إرهابي"" وبمعاداة السامية.
واندلعت النيران في سيارتين على الأقل، انفجرت في إحداهما أسطوانة غاز صباح السبت أمام المعبد في مدينة لا غراند-موت الساحلية التي تضم 8500 نسمة، ما أدى إلى إصابة شرطي بجروح.
وفتحت نيابة مكافحة الإرهاب في فرنسا تحقيقا في محاولات اغتيال ""إرهابية"" السبت.
وقد اعتُقِل أيضا شخصان آخران بحسب النيابة الوطنية لمكافحة الإرهاب.
وتضمن بيان لمكتب المدعي العام الوطني لمكافحة الإرهاب ""داخل الكنيس، كان هناك خمسة أشخاص، بينهم الحاخام، لم يصابوا بأذى""، مشيرا إلى أن ""التحقيقات مستمرة"".
وأظهرت كاميرا مراقبة مشتبها به يغادر المكان سيرا بعد وقوع الانفجار، وقد لف خصره بعلم فلسطيني وكان يحمل قوارير فارغة في يده، وربما سلاحا، وفق ما أفاد مصدر مقرب من التحقيق. واعتمر المشتبه به كوفية حمراء بحسب صور انتشرت على مواقع التواصل الاجتماعي وتحققت وكالة الأنباء الفرنسية من صحتها.
وصرح الرئيس الفرنسي في وقت سابق ""نلجأ إلى كل الوسائل للعثور على مرتكب هذا العمل الإرهابي"". وتابع عبر منصة ""إكس"" أن ""مكافحة معاداة السامية معركة مستمرة"".
وأدانت الحكومة الفرنسية مرات عدة تزايد الأعمال المعادية للسامية في البلاد منذ أن شنت حركة حماس هجوما في جنوب إسرائيل في 7 تشرين الأول/أكتوبر 2023 اندلعت على أثره الحرب في قطاع غزة.
وكتب رئيس الوزراء الفرنسي المستقيل غابريال أتال على موقع ""إكس"" أنه ""عمل معاد للسامية، مرة أخرى يُستهدَف مواطنونا اليهود"".
ووقع الانفجار أمام كنيس بيت ياكوف (بيت يعقوب) السبت وهو يوم الراحة الأسبوعي لدى اليهود. ولم تكن تقام الصلاة في هذه الأثناء.
وتضرر بابان من أبواب المعبد جراء انفجار أسطوانة الغاز الموجودة في إحدى السيارات التي أُحرقت. وأدى عصف الانفجار إلى إصابة أحد عناصر الشرطة البلدية بجروح طفيفة بعدما وصل إلى مكان الحادث عقب اندلاع الحريق، حسبما أكد مكتب المدعي العام الوطني لمكافحة الإرهاب.
وأفاد مصدر في الشرطة بأن أسطوانات غاز عدة أخرى كانت موجودة في مكان الحادثة قبل وقوع الهجوم لتنظيم حفلة شواء، انفجرت إحداها على الأقل.
وأدان وزير الداخلية جيرالد دارمانان ما وصفه بأنه عمل ""إجرامي"" على شبكة التواصل الاجتماعي إكس.
وأكد الوزير المستقيل أنه طلب من قوات الأمن في البلاد تعزيز حماية أماكن العبادة والمؤسسات التعليمية اليهودية ""فورا"".
وندد رئيس المجلس التمثيلي للمؤسسات اليهودية في فرنسا يوناتان عرفي ""بشدة بمحاولة لقتل اليهود"".
وقال إن ""استخدام أسطوانة غاز في سيارة في وقت يُعتقد أن مؤمنين يصلون في كنيس يهودي ليس مجرد حريق متعمد، وليس مجرد مهاجمة مبنى أو مكان عبادة، بل هو رغبة في القتل"".
وأثار الهجوم ردود فعل سياسية، في وقت ما زالت فرنسا من دون أفق واضح لتشكيل حكومة منذ هزيمة المعسكر الرئاسي في الانتخابات التشريعية في 7 تموز/يوليو الماضي.
ونددت زعيمة حزب التجمع الوطني اليميني المتطرف مارين لوبان بـ""تصاعد معاداة السامية"" فيما استنكر جان لوك ميلنشون زعيم حزب ""فرنسا الأبية"" (يسار راديكالي) الذي يتهمه خصومه بتأجيج الكراهية ضد اليهود ""جريمة غير مقبولة"".
وأعلنت وزارة الداخلية الفرنسية في 9 آب/أغسطس أن الأعمال المعادية للسامية تضاعفت نحو ثلاث مرات في البلاد في النصف الأول من 2024 مع تسجيل ""887 واقعة"" مقابل 304 خلال الفترة نفسها من 2023.
وكانت معاداة السامية أحد المواضيع الرئيسية خلال الحملة الانتخابية الأوروبية وحملة الانتخابات التشريعية في فرنسا التي شهدت جدلا بشأن مواقف اليسار الراديكالي واليمين المتطرف.
","
                                        ألقت الشرطة الفرنسية القبض على رجل يشتبه في أنه منفذ الهجوم على كنيس يهودي السبت في جنوب فرنسا. وفتحت نيابة مكافحة الإرهاب في فرنسا تحقيقا في محاولات اغتيال ""إرهابية"". وعقب ذلك ندد الرئيس الفرنسي إيمانويل ماكرون بعمل ""إرهابي"" مؤكدا أن ""مكافحة معاداة السامية معركة مستمرة"".                ",https://www.france24.com/ar/%D9%81%D8%B1%D9%86%D8%B3%D8%A7/20240825-%D9%81%D8%B1%D9%86%D8%B3%D8%A7-%D8%A7%D8%B9%D8%AA%D9%82%D8%A7%D9%84-%D8%A7%D9%84%D9%85%D8%B4%D8%AA%D8%A8%D9%87-%D9%81%D9%8A-%D8%AA%D9%86%D9%81%D9%8A%D8%B0%D9%87-%D8%A7%D9%84%D9%87%D8%AC%D9%88%D9%85-%D8%B9%D9%84%D9%89-%D9%83%D9%86%D9%8A%D8%B3-%D9%8A%D9%87%D9%88%D8%AF%D9%8A-%D9%88%D9%85%D8%A7%D9%83%D8%B1%D9%88%D9%86-%D9%8A%D9%86%D8%AF%D8%AF-%D8%A8%D8%B9%D9%85%D9%84-%D8%A5%D8%B1%D9%87%D8%A7%D8%A8%D9%8A-%D9%88%D8%A8%D9%85%D8%B9%D8%A7%D8%AF%D8%A7%D8%A9-%D8%A7%D9%84%D8%B3%D8%A7%D9%85%D9%8A%D8%A9,25/08/2024 - 11:01,"

                                    فرنسا
                            "
3,France 24,فرنسا: توقيف مؤسس تطبيق تيلغرام في مطار لوبورجيه على خلفية تحقيق متعلق بتطبيق المراسلة المشفرة,"
أفادت مصادر مطلعة، أنه تم توقِيف مؤسس تطبيق تيلغرام بافيل دوروف مساء السبت في مطار لوبورجيه قرب باريس بموجب مذكرة تفتيش أصدرها بحقه محققون فرنسيون على خلفية انتهاكات مختلفة منسوبة لتطبيق المراسلة المشفرة.
وقُبض على الملياردير الفرنسي الروسي البالغ 39 عاما في مطار لوبورجيه بين الساعة السابعة والنصف والثامنة مساء (بين 17:30 و18:00 بتوقيت غرينتش) برفقة حارسه الشخصي ومساعدته، وفق ما أوضح أحد هذه المصادر لوكالة الأنباء الفرنسية.
وذكر مصدر آخر مطلع على الملف أن دوروف كان آتيا من باكو (أذربيجان) وأنه كان سيقضي المساء على الأقل في باريس حيث كان مقررا أن يتناول العشاء. ويُتوقع أن يمثل أمام المحكمة الأحد.
يتهم القضاء دوروف بعدم اتخاذ إجراءات ضد الاستعمال المسيء لتطبيقه من جانب بعض المستخدمين.
وقال أحد المحققين ""يكفي إفلاتا لتيلغرام من العقاب""، مبديا دهشته من أن الملياردير قرر المجيء إلى باريس على الرغم من علمه بأنه مطلوب في فرنسا. وقال أحد المصادر المطلعة على الملف إنه فعل ذلك ""ربما بدافع الشعور بالإفلات من العقاب"".
هذا، وأكد مصدران مطلعان على الملف أن قاضي التحقيق الباريسي المكلف بالقضية قد يمدد بقاءه قيد التوقيف لدى الشرطة مساء الأحد. وفي النهاية، قد يُطلق سراح بافيل دوروف أو قد يمثل أمام هذا القاضي.
ومن جانبه، رفض مكتب المدعي العام تقديم أي معلومات ""في ما يتعلّق بالإجراء المتبع أثناء التحقيق"".
ويذكر أن المكتب المسؤول عن مكافحة العنف ضدّ القاصرين (Ofmin) كان قد أفاد بأنّه أصدر مذكرة تفتيش ضد بافيل دوروف انطلاقا من دوره كمنسّق في تحقيق أولي في جرائم تراوح بين الاحتيال وتهريب المخدرات والمضايقة عبر الإنترنت والجريمة المنظمة، مرورا بتبرير الإرهاب والاحتيال، وفقا لمصادر مطّلعة على القضية.
ومنذ ذلك الحين، وفي تاريخ غير محدد، تم فتح تحقيق قضائي من قبل القسم السيبراني في السلطة القضائية الوطنية لمكافحة الجريمة المنظمة، وفق مصدر آخر مطلع على الملف.
وأكد مصدران مطلعان على القضية أن التحقيقات أوكلت إلى الوحدة الوطنية السيبرانية التابعة للدرك وإلى المكتب الوطني لمكافحة الاحتيال التابع للجمارك.
وينتقد القضاء بافيل دوروف لعدم تحرّكه ضد استخدام المشتركين لتطبيقه لأهداف مضرّة، خصوصا في ظل الافتقار إلى الإشراف على المحتوى والتعاون مع المحقّقين.
وأفاد مصدر مطّلع على الملف بأنه ""يكفي (تطبيق) تيلغرام إفلاتا من العقاب""، مؤكدا إنه فوجىء بأنّ الملياردير قرر الحضور إلى باريس رغم معرفته أنه مطلوب في فرنسا. غير أنّ مصدرا آخر رأى أن حضوره إلى فرنسا مستند إلى ""إحساس بالإفلات من العقاب"".
وقد أثار اعتقال بافيل دوروف ردود فعل دولية عديدة، على غرار مالك منصة إكس إيلون ماسك الذي كتب وسم #الحرية_لبافيل، قبل نشره رسالة جديدة باللغة الفرنسية قائلا ""حرية حرية! حرية؟"".
وبدوره كتب المرشح الأمريكي المستقل للانتخابات الرئاسية روبرت اف كينيدي جونيور الذي أعلن دعمه لدونالد ترامب، في منشور على إكس ""الحاجة إلى حماية حرية التعبير لم تكن أكثر إلحاحا من أي وقت مضى"".
وفي روسيا، حيث يعد تيلغرام إحدى أكثر شبكات التواصل الاجتماعي استخداما مع حسابات يصل عدد مشتركيها إلى مئات الآلاف ، قالت المتحدثة باسم وزارة الخارجية ماريا زاخاروفا إن ""السفارة الروسية في باريس ستبدأ العمل على الفور، كما هو معتاد"" عندما يتم احتجاز مواطنين روس في الخارج. واتهمت السفارة الروسية في فرنسا السلطات المحلية بـ""رفض التعاون"" مع موسكو.
وقالت السفارة في بيان أوردته وكالة ريا نوفوستي ""طلبنا على الفور من السلطات الفرنسية شرح أسباب هذا الاحتجاز وحماية حقوقه والسماح بزيارة قنصلية. حتى الآن، يرفض الجانب الفرنسي التعاون في هذه المسألة"".
إلى ذلك، وفي مقابلة نادرة أجراها المذيع الأمريكي اليميني تاكر كارلسون في نيسان/ أبريل الماضي، قال دوروف إن فكرة  إطلاق تطبيق مراسلة مشفر خطرت له بعد تعرضه لضغوط من الحكومة الروسية أثناء عمله في VK، وهي شبكة اجتماعية أنشأها قبل بيعها ومغادرة روسيا في العام 2014. وروى أنه حاول بعد ذلك الاستقرار في برلين ولندن وسنغافورة وسان فرانسيسكو قبل اختيار دبي، التي أشاد ببيئة الأعمال فيها و""حيادها"".
وأضاف أن الناس ""يحبون الاستقلالية. كما يحبون الخصوصية والحرية، (هناك) الكثير من الأسباب التي قد تدفع شخصا ما إلى التحول إلى تيلغرام"". وأشار حينها إلى أن المنصة تضم 900 مليون مستخدم.
ومع وجوده في دبي، فقد حمى التطبيق نفسه من قواعد المحتوى للدول، في الوقت الذي تضغط فيه الولايات المتحدة والاتحاد الأوروبي على المنصات لحذف المحتوى غير القانوني.
ومع مجموعات المناقشة التي يمكن أن تضم إلى غاية 200 ألف شخص، يتهم تطبيق الرسائل بزيادة احتمال نشر المعلومات الكاذبة وانتشار المحتوى الذي يحض على الكراهية أو الاستغلال الجنسي للأطفال أو التآمر أو الإرهاب.
هذا، وكان بافيل دوروف وشقيقه نيكولا أطلقا تطبيق تيلغرام في العام 2013. ويمكن من خلال هذا التطبيق أن يسهّل تشفير الاتصالات من طرف إلى آخر. وقد وضع نفسه في مواجهة المنصّات الأمريكية التي تعرّضت لانتقادات بسبب استغلالها التجاري للبيانات الشخصية للمستخدمين. كما يلتزم التطبيق وبشكل خاص عدم الكشف عن معلومات حول مستخدميه أبدا.
فرانس24/ أ ف ب","
                                        على خلفية مذكرة تفتيش أصدرها بحقه محققون فرنسيون، تم توقيف مؤسس تطبيق تيلغرام بافيل دوروف مساء السبت في مطار لوبورجيه قرب باريس، وفق ما نقلت مصادر مطلعة. ويتهم القضاء دوروف، الذي يُتوقع أن يمثل أمام المحكمة الأحد، بانتهاكات مختلفة متعلقة بتطبيق المراسلة المشفرة.                ",https://www.france24.com/ar/%D9%81%D8%B1%D9%86%D8%B3%D8%A7/20240825-%D9%81%D8%B1%D9%86%D8%B3%D8%A7-%D8%AA%D9%88%D9%82%D9%8A%D9%81-%D9%85%D8%A4%D8%B3%D8%B3-%D8%AA%D8%B7%D8%A8%D9%8A%D9%82-%D8%AA%D9%8A%D9%84%D8%BA%D8%B1%D8%A7%D9%85-%D9%81%D9%8A-%D9%85%D8%B7%D8%A7%D8%B1-%D9%84%D9%88%D8%A8%D9%88%D8%B1%D8%AC%D9%8A%D9%87-%D8%B9%D9%84%D9%89-%D8%AE%D9%84%D9%81%D9%8A%D8%A9-%D8%AA%D8%AD%D9%82%D9%8A%D9%82-%D8%A7%D8%AA%D9%87%D8%A7%D9%85%D8%A7%D8%AA-%D9%85%D8%AA%D8%B9%D9%84%D9%82%D8%A9-%D8%A8%D8%AA%D8%B7%D8%A8%D9%8A%D9%82-%D8%A7%D9%84%D9%85%D8%B1%D8%A7%D8%B3%D9%84%D8%A9-%D8%A7%D9%84%D9%85%D8%B4%D9%81%D8%B1%D8%A9,25/08/2024 - 07:41,"

                                    فرنسا
                            "
4,France 24,حزب الله يطلق مئات الصواريخ والمسيرات على إسرائيل وتل أبيب تنفذ ضربات استباقية على لبنان,,"
                                                أطلقت جماعة حزب الله اللبنانية المتحالفة مع إيران مئات الصواريخ والطائرات المسيرة على إسرائيل في وقت مبكر من اليومالأحد. فيما قال الجيش الإسرائيلي في بيان إنه أحبط هجوما أكبر بكثير عبر تنفيذ ضربات استباقية بنحو 100 طائرة ضربت أكثر من 40 موقع إطلاق لحزب الله في جنوب لبنان، وذلك بعد تقييم يفيد بأن حزب الله يستعد لإطلاق وابل الصواريخ.                    ",https://www.france24.com/ar/%D9%81%D9%8A%D8%AF%D9%8A%D9%88/20240825-%D9%82%D8%B5%D9%81-%D9%85%D8%AA%D8%A8%D8%A7%D8%AF%D9%84-%D8%A8%D9%8A%D9%86-%D8%A5%D8%B3%D8%B1%D8%A7%D8%A6%D9%8A%D9%84-%D9%88%D8%AD%D8%B2%D8%A8-%D8%A7%D9%84%D9%84%D9%87,25/08/2024 - 15:45,"
                                    الأخبار المغاربية
                            "
