,source,title,content,description,url,published_at,tags
11,France 24,"مقتل فؤاد شكر: حزب الله يعلن ""إنجاز"" المرحلة الأولى من هجومه وإسرائيل تشن ""ضربات استباقية"" على لبنان","
في إطار ""رد أولي"" على مقتل القيادي العسكري فؤاد شكر، أعلن حزب الله الأحد شن هجوم جوي وصاروخي نحو أهداف عسكرية إسرائيلية، وذلك بعد إعلان الجيش الإسرائيلي تنفيذ ضربات استباقية في لبنان لمنع ""هجوم كبير"" للحزب.
وأكدت الولايات المتحدة على الفور أنها ""ستواصل دعم حق إسرائيل في الدفاع عن نفسها""، بينما تعهد رئيس الوزراء الإسرائيلي بنيامين نتانياهو بـ""القيام بكل شيء"" لاستعادة الأمن في شمال إسرائيل.
وجاء الإعلان الإسرائيلي قبل إعلان حزب الله، لكن لم يتضح بعد ما إذا كان القصف الإسرائيلي بدأ قبل رد حزب الله أو العكس. ولم يعلن عن خسائر في الأرواح في الجانب الإسرائيلي.
فيما أعلنت وزارة الصحة في لبنان مقتل شخص في الجنوب في غارة إسرائيلية استهدفت سيارة صباح الأحد.
وقال حزب الله في بيان بعيد السادسة صباحا ""عند فجر هذا اليوم (...)، وفي إطار الرد الأولي على العدوان الصهيوني الغاشم على الضاحية الجنوبية لبيروت"" الذي أدى إلى مقتل فؤاد شكر ومستشار إيراني وخمسة مدنيين، ""بدأ مجاهدو المقاومة الإسلامية هجوما جويا بعدد كبير من المسيرات نحو العمق الصهيوني وفي اتجاه هدف عسكري نوعي"".
وأعلن الحزب في بيان لاحق، أنه ""تم الانتهاء من المرحلة الأولى"" من الرد، ""بنجاح كامل""، مشيرا إلى ""استهداف الثكنات والمواقع الإسرائيلية تسهيلا لعبور المسيرات الهجومية باتجاه هدفها المنشود في عمق الكيان"".
وأشار إلى أن المسيرات ""عبرت كما هو مقرر""، وأنه تم إطلاق أكثر من 320 صاروخ كاتيوشا.
وفي بيان ثالث، أكد الحزب أن عمليته العسكرية ""لهذا اليوم"" ضد مواقع وثكنات عسكرية إسرائيلية ""قد تمت وأُنجزت""، نافيا ""ادعاءات"" إسرائيل بشأن تعطيلها هجومه بضربات استباقية.
وكان الجيش الإسرائيلي قد أعلن أنه ""يشن هجمات في لبنان لإزالة تهديدات لحزب الله بعد رصد استعداده لإطلاق قذائف وصواريخ نحو الأراضي الإسرائيلية"".
وتوجه الجيش الإسرائيلي في رسالته إلى سكان جنوب لبنان، ودعا ""جميع الموجودين بالقرب من مناطق ينشط فيها حزب الله إلى المغادرة فورا لحماية أنفسهم وعائلاتهم"".
وأفادت قناة ""المنار"" التابعة للحزب عن ""سلسلة غارات لطيران العدو الصهيوني استهدفت حرش كونين رشاف، الطيري، بيت ياحون، الخردلي، زوطر، إقليم التفاح والريحان في جنوب لبنان"".
وأعلن الجيش الإسرائيلي أنه دمر ""آلاف منصات"" الصواريخ العائدة للحزب في جنوب لبنان في ضربات شاركت فيها ""نحو 100 طائرة حربية"".
وترأس رئيس الوزراء الإسرائيلي بنيامين نتانياهو اجتماعا للمجلس الأمني الوزاري المصغر.
وقال رئيس الوزراء في بيان نشره مكتبه ""نحن مصممون على القيام بكل شيء لحماية بلادنا وإعادة سكان الشمال بأمان إلى منازلهم، ومواصلة اتباع قاعدة بسيطة : من يؤذينا، نؤذيه"".
وأعلن وزير الدفاع الإسرائيلي يوآف غالانت حال الطوارئ لمدة 48 ساعة.
وأعلن مطار بن غوريون في إسرائيل أن الرحلات الجوية المغادرة صباح الأحد ستتأخر، وأن الرحلات الواصلة سيُعاد توجيهها إلى مطارات أخرى، قبل أن يعلن في وقت لاحق استئناف العمل في المطار ""اعتبارا من الساعة السابعة (04:00 ت غ)، بما يشمل الإقلاع والهبوط""، مشيرا الى أن ""الطائرات التي تم تحويلها إلى مطارات أخرى، ستعاود الإقلاع باتجاه بن غوريون"".
وأكدت الولايات المتحدة التي كانت قد عززت انتشارها العسكري في المنطقة خلال الأسابيع الماضية، جاهزيتها لدعم ""حق إسرائيل في الدفاع عن نفسها"".
وقال المتحدث باسم مجلس الأمن القومي الأمريكي شون سافيت في بيان إنه بتوجيه من الرئيس جو بايدن ""يتواصل المسؤولون الأميركيون الكبار بشكل مستمر مع نظرائهم الإسرائيليين""، مضيفا ""سنواصل دعم حق إسرائيل في الدفاع عن نفسها وسنواصل العمل للحفاظ على الاستقرار الإقليمي"".
وأكدت وزارة الدفاع الأمريكية أنها ""مستعدة لدعم"" الدولة العبرية.
وقال متحدث باسم البنتاغون ""نواصل مراقبة الوضع عن كثب وسبق أن كنا واضحين للغاية بأن الولايات المتحدة مستعدة لدعم الدفاع عن إسرائيل"".
وتصاعدت المخاوف منذ أسابيع من تصعيد عسكري إقليميا أكبر في ظل تواصل الحرب في قطاع غزة بين إسرائيل وحماس منذ عشرة أشهر، بعد توعد إيران وحزب الله بالرد على اغتيال رئيس المكتب السياسي لحماس إسماعيل هنية في 31 تموز/يوليو في طهران والمنسوب إلى إسرائيل، واغتيال فؤاد شكر في ضاحية بيروت الجنوبية في ضربة إسرائيلية.
ويأتي هذا التصعيد في يوم تتواصل فيه المفاوضات في القاهرة بوساطة أمريكية ومصرية وقطرية بين إسرائيل وحماس في محاولة للتوصل إلى هدنة في قطاع غزة.
وأكدت واشنطن الجمعة أن مدير وكالة الاستخبارات المركزية ""سي آي إيه"" وليام بيرنز وصل إلى القاهرة للمشاركة في المباحثات، متحدثة عن ""تحقيق تقدم"" في النقاشات التمهيدية التي تسبق المباحثات الموسعة.
وكان مصدر مصري قد أفاد في وقت سابق هذا الأسبوع، بأن المباحثات ""الموسعة"" ستعقد الأحد في القاهرة.
وأعلن قيادي في حركة حماس لوكالة الأنباء الفرنسية أن ""قيادة حماس بما فيها رئيس الحركة (يحيى) السنوار قررت أن المرجعية التي يتم الاستناد إليها هي خطة 2 تموز/يوليو التي وافقت عليها حماس""، في إشارة إلى المقترح الذي أعلنه جو بايدن في 31 أيار/مايو، وأعلنت حماس قبوله مطلع تموز/يوليو.
وينص المقترح على هدنة مدتها ستة أسابيع يرافقها انسحاب إسرائيلي من المناطق المأهولة في غزة وإطلاق سراح رهائن خطفوا في 7 تشرين الأول/أكتوبر خلال هجوم حماس غير المسبوق على إسرائيل الذي تسبب باندلاع الحرب، ثم مرحلة ثانية تنتهي بانسحاب إسرائيلي كامل من القطاع.
في المقابل، أكد مكتب نتانياهو هذا الأسبوع تمسكه بتحقيق ""كل أهداف الحرب"" قبل وقف النار، معتبرا أن ""هذا يتطلب تأمين الحدود الجنوبية"" للقطاع مع مصر، في إشارة إلى تمسك إسرائيل بإبقاء قوات في غزة، خصوصا عند الشريط الحدودي بين القطاع ومصر المعروف بـ""محور فيلادلفيا"".
وكان مكتب نتانياهو قد أكد الخميس التزامه بسيطرة إسرائيل على ممر فيلادلفيا ""لمنع حماس من أن تعيد تسلحها ما يسمح لها بأن ترتكب مجددا الفظائع التي ارتكبتها في 7 تشرين الأول/أكتوبر"".
وقال مصدر مصري مطلع على المفاوضات السبت إن جولة الأحد ""مفصلية لبلورة اتفاق سيعلن عنه إذا نجحت واشنطن في الضغط على نتانياهو"".
وتجري المحادثات بعد جولة مماثلة عقدت في العاصمة القطرية الأسبوع الماضي لم تحضرها حماس.
وتظاهر آلاف الإسرائيليين السبت في تل أبيب ومدن إسرائيلية أخرى، مطالبين بالتوصل إلى اتفاق لتأمين إطلاق الرهائن المتبقين.
وأسفر هجوم حماس في السابع من تشرين الأول/أكتوبر عن مقتل 1199 شخصا، معظمهم مدنيون، وفق تعداد لوكالة الأنباء الفرنسية يستند إلى أرقام إسرائيلية رسمية.
كما خُطف خلال الهجوم 251 شخصا، لا يزال 105 منهم محتجزين في غزة، بينهم 34 أعلن الجيش وفاتهم.
وأعلن الجيش الإسرائيلي السبت مقتل ثلاثة جنود احتياط في وسط القطاع، ليرتفع إلى 338 عدد قتلاه منذ دخوله قطاع غزة في 27 تشرين الأول/أكتوبر.
وتسبب القصف والعمليات البرية الإسرائيلية على قطاع غزة ردا على هجوم حماس بمقتل ما لا يقل عن 40334 شخصا، وفقا لوزارة الصحة التابعة لحماس.
","
                                        أعلن حزب الله اللبناني صباح الأحد عن شن قواته هجوما واسعا استخدمت فيه المسيرات وصواريخ الكاتيوشا على مواقع وثكنات في شمال إسرائيل، وقال إنه ""أنجز"" المرحلة الأولى في إطار رده على مقتل قائد عملياته في جنوب لبنان فؤاد شكر بغارة اسرائيلية في 30 تموز/يوليو. جاء ذلك بعيد إعلان الجيش الإسرائيلي شن ضربات في جنوب لبنان لمنع ""هجوم كبير"" من الحزب المدعوم من طهران.                ",https://www.france24.com/ar/%D8%A7%D9%84%D8%B4%D8%B1%D9%82-%D8%A7%D9%84%D8%A3%D9%88%D8%B3%D8%B7/20240825-%D8%AD%D8%B2%D8%A8-%D8%A7%D9%84%D9%84%D9%87-%D8%A5%D8%B3%D8%B1%D8%A7%D8%A6%D9%8A%D9%84-%D9%85%D9%82%D8%AA%D9%84-%D9%81%D8%A4%D8%A7%D8%AF-%D8%B4%D9%83%D8%B1-%D9%86%D8%B5%D8%B1-%D8%A7%D9%84%D9%84%D9%87-%D9%86%D8%AA%D8%A7%D9%86%D9%8A%D8%A7%D9%87%D9%88-%D9%84%D8%A8%D9%86%D8%A7%D9%86-%D9%87%D8%AC%D9%88%D9%85,25/08/2024 - 16:33,"

                                    الشرق الأوسط
                            "
12,France 24,الانتخابات الرئاسية الأمريكية: حملة هاريس تجمع 540 مليون دولار من التبرعات منذ بدايتها,"
بعد أيام قليلة من تتويجها في المؤتمر الوطني للحزب الديمقراطي مرشحة رسميا للحزب للانتخابات الرئاسية، كشفت حملة نائبة الرئيس الأمريكي كامالا هاريس أن مجموع التبرعات التي جمعتها، منذ بدايتها نهاية الشهر الماضي، بلغ 540 مليون دولار. ويعد هذا مبلغا قياسيا، يؤكد استمرار الأرقام الكبيرة التي حققتها الحملة على مدى الأسابيع الأربعة الأخيرة.
وقالت مديرة الحملة جين أومالي ديلون في بيان ""قبل خطاب نائبة الرئيس هاريس مساء الخميس مباشرة، تجاوزنا رسميا مبلغ 500 مليون دولار"".
وأكدت أن المجموع يبلغ حاليا 540 مليونا، لافتة إلى أنه ""رقم غير مسبوق في أي حملة في التاريخ""، من دون أن تحدد الفترة التي استندت إليها في مقارنتها.
وأضافت أومالي ديلون ""مباشرة بعد خطابها، شهدنا ساعة كانت الأفضل في مجال جمع التبرعات"" للحملة.
ويسلط البيان الضوء على أهمية صغار المانحين، مؤكدا أن ""ثلث"" التبرعات المسجلة خلال أسبوع المؤتمر الديمقراطي أتت من مساهمين جدد.
وتشمل هذه الأرقام تبرعات لهياكل مختلفة تعمل على جمع الأموال للحملة الوطنية.
وفي الـ 24 ساعة التي أعقبت إعلان انسحاب جو بايدن من السباق الرئاسي ودعمه لنائبته، جمع الديمقراطيون 81 مليون دولار، في إشارة إلى تغيير جذري وتحرك بعد ركود شهده الحزب في بداية تموز/يوليو، عقب الأداء الكارثي لبايدن خلال المناظرة الرئاسية ضد دونالد ترامب في نهاية حزيران/يونيو.
من جهتها، أعلنت حملة المرشح الجمهوري في مطلع آب/أغسطس توفر نحو 327 مليون دولار لديها، وذلك قبل ثلاثة أشهر من الانتخابات التي تتطلب مئات الملايين من الدولارات، خصوصا لتمويل بث إعلانات سياسية عبر التلفزيون.
تجري هاريس والمرشح لمنصب نائبها، حاكم مينيسوتا تيم والز، جولة بالحافلة في أنحاء ولاية جورجيا هذا الأسبوع، سعيا لاستمالة ناخبيها والفوز بأصواتهم في الانتخابات المقررة في الخامس من تشرين الثاني/ نوفمبر المقبل.
وستكون جولتهما بالحافلة في جنوب جورجيا المقررة الأربعاء هي المرة الأولى التي يزوران فيها الولاية معا في إطار الحملة الإنتخابية.
وقالت حملة هاريس إن الجولة ستنتهي بمؤتمر حاشد تعقده نائبة الرئيس في منطقة سافانا، بينما سيغادر والز الولاية قبل هذا التجمع.
ويأتي إعلان الزيارة بعد يومين من سعي ترامب إلى نزع فتيل خلاف مع حاكم جورجيا الجمهوري برايان كيمب، بعد انتقاده في تجمع حاشد في أتلانتا في وقت سابق من الشهر.
وعبر كيمب عن تأييده لترامب الخميس، في حين شكره الرئيس السابق في منشور عبر مواقع التواصل الاجتماعي. وتظهر استطلاعات الرأي تنافسا متقاربا بين هاريس وترامب، وأن جورجيا ستكون من بين سبع ولايات ستحسم نتيجة الانتخابات على الأرجح.
فرانس24/ أ ف ب/ رويترز","
                                        على وقع زخم متزايد ومعنويات سياسية مستمرة في الارتفاع، أعلنت حملة نائبة الرئيس الأمريكي، المرشحة الديمقراطية للانتخابات الرئاسية كامالا هاريس الأحد أن مجموع التبرعات التي تلقتها، منذ بدايتها في 21  يوليو، بلغ  540 مليون دولار. وتعيش حملة الديمقراطيين انتعاشة مستمرة منذ إعلان هاريس ترشحها عقب انسحاب الرئيس جو بايدن. ومن المقرر أن تزور هاريس هذا الأسبوع ولاية جورجيا الحاسمة للدفع بالزخم السياسي للحملة في هذه الولاية المتأرجحة، التي تعد أحد مفاتيح الفوز بالرئاسة.                ",https://www.france24.com/ar/%D8%A3%D9%85%D8%B1%D9%8A%D9%83%D8%A7/20240825-%D8%A7%D9%84%D8%A5%D9%86%D8%AA%D8%AE%D8%A7%D8%A8%D8%A7%D8%AA-%D8%A7%D9%84%D8%A3%D9%85%D8%B1%D9%8A%D9%83%D9%8A%D8%A9-%D8%AD%D9%85%D9%84%D8%A9-%D9%87%D8%A7%D8%B1%D9%8A%D9%8A%D8%B3-%D8%AA%D8%AC%D9%85%D8%B9-540-%D9%85%D9%84%D9%8A%D9%88%D9%86-%D8%AF%D9%88%D9%84%D8%A7%D8%B1-%D9%85%D9%86-%D8%A7%D9%84%D8%AA%D8%A8%D8%B1%D8%B9%D8%A7%D8%AA-%D9%85%D9%86%D8%B0-%D8%A8%D8%AF%D8%A7%D9%8A%D8%AA%D9%87%D8%A7,25/08/2024 - 23:33,"

                                    أمريكا
                            "
13,France 24,نصر الله: أردنا استهداف مواقع عسكرية قريبة من تل أبيب,,"
                                                 قال الأمين العام لجماعة حزب الله اللبنانية حسن نصر الله يوم الأحد في كلمة بثها التلفزيون أن حزب الله تمكن منتنفيذ هجومه كما هو مخطط له، وهو ما يتناقض مع تصريحات للجيش الإسرائيلي بأن نفذ ضربات استباقية أوقفت هجوما أوسع.وقال نصر الله، بعد نحو 12 ساعة من أقوى تبادل لإطلاق النار بين حزب الله وإسرائيل منذ اندلاع الأعمال القتالية بالتوازي معالحرب في غزة، إن الجماعة أحجمت عن استهداف المدنيين أو البنية التحتية العامة، بما في ذلك مطار بن غوريون في تل أبيب.                     ",https://www.france24.com/ar/%D9%81%D9%8A%D8%AF%D9%8A%D9%88/20240825-%D9%86%D8%B5%D8%B1%D8%A7%D9%84%D9%84%D9%87-%D8%A3%D8%B1%D8%AF%D9%86%D8%A7-%D8%A7%D8%B3%D8%AA%D9%87%D8%AF%D8%A7%D9%81-%D9%85%D9%88%D8%A7%D9%82%D8%B9-%D8%B9%D8%B3%D9%83%D8%B1%D9%8A%D8%A9-%D9%82%D8%B1%D9%8A%D8%A8%D8%A9-%D9%85%D9%86-%D8%AA%D9%84-%D8%A3%D8%A8%D9%8A%D8%A8,25/08/2024 - 19:45,"
                                    الأخبار المغاربية
                            "
14,France 24,المعمارية لينا الغطمة: هكذا تكون العمارة منسجمة مع البيئة,,"
                                                كيف تكون العمارة اليوم هي علم آثار المستقبل؟ ولماذا يجب ان تعتمد العمارة على المواد الطبيعية في البيئة المحيطة؟ وكيف يجب اعادة الإعمار بعد الحروب كما في غزة؟ هذه الاسئلة وغيرها يطرحها وسيم الأحمر على المهندسة المعمارية والأكاديمية لينا الغطمة                     ",https://www.france24.com/ar/%D8%A8%D8%B1%D8%A7%D9%85%D8%AC/%D9%85%D8%AD%D8%A7%D9%88%D8%B1/20240825-%D8%A7%D9%84%D9%85%D8%B9%D9%85%D8%A7%D8%B1%D9%8A%D8%A9-%D9%84%D9%8A%D9%86%D8%A7-%D8%A7%D9%84%D8%BA%D8%B7%D9%85%D8%A9-%D9%87%D9%83%D8%B0%D8%A7-%D8%AA%D9%83%D9%88%D9%86-%D8%A7%D9%84%D8%B9%D9%85%D8%A7%D8%B1%D8%A9-%D9%85%D9%86%D8%B3%D8%AC%D9%85%D8%A9-%D9%85%D8%B9-%D8%A7%D9%84%D8%A8%D9%8A%D8%A6%D8%A9,25/08/2024 - 10:33,"

                                    الشرق الأوسط
                            "
15,France 24,من ثمانية أيام إلى ثمانية أشهر... تأخر عودة رائدي فضاء إلى الأرض حتى العام المقبل,"
قالت وكالة الفضاء الأمريكية (الناسا) السبت إن رائدي الفضاء بوتش ويلمور وسوني وليامز سيمكثان لفترة أطول في محطة الفضاء الدولية التي وصلا إليها على متن مركبة بوينغ التي واجهت عديد المشاكل التقنية أثناء تحليقها.
وكان مقررا أن تستمر مهمة الرائدين ثمانية أيام، لكنهما سيبقيان في نهاية المطاف ثمانية أشهر في محطة الفضاء الدولية (آي إس إس). وسيستقلان بعدها مركبة تابعة لسبايس إكس المنافسة المملوكة لإيلون ماسك لتعود بهما إلى الأرض في شباط/ فبراير 2025.
وقال رئيس ناسا بيل نيلسون في مؤتمر صحافي عقب اجتماع للجنة اتخذت القرار السبت، ""قررت ناسا أن يعود بوتش وسوني مع فريق كرو-9 في شباط/ فبراير المقبل، وأن تعود (المركبة) ستارلاينر من دون طاقم"".
وعزا هذا القرار إلى محاذير أمنية، لكنه أكد أنه يعول على شركتي سبايس إكس وبوينغ لنقل رواد آخرين إلى الفضاء، مبديا ثقته ""مئة في المئة"" بأن بوينغ ستعمل مجددا على إقلاع المركبة ستارلاينر مع طاقم.
وقال المسؤول الكبير في ناسا ستيف ستيتش إن محاولة العودة مع وجود هذه الأعطال ""كانت تنطوي ببساطة على خطر كبير بالنسبة إلى الطاقم""، لافتا إلى أن ستارلاينر ستغادر محطة الفضاء الدولية لتعود إلى الأرض من دون طاقم ""بداية أيلول/سبتمبر"".
هذا، وأوضح المسؤول الآخر في وكالة الفضاء الأمريكية نورم نايت خلال المؤتمر الصحفي أن بوتش ويلمور وسوني وليامز اللذين سيضطران إلى البقاء في المدار أشهرا طويلة إضافية، ""يدعمان بالكامل قرار الوكالة وهما مستعدان لمواصلة مهمتهما في محطة الفضاء الدولية"".
ويشار إلى أنه منذ أسابيع، تجري فرق بوينغ وناسا اختبارات من أجل فهم أفضل للمشاكل التي واجهتها المركبة خلال التحليق، وخصوصا في ما يتعلق بأجهزة الدفع. ومبعث القلق الأكبر هو ألا تتمكن ستارلاينر من القيام بالدفع الضروري للخروج من المدار والبدء بالهبوط نحو الأرض.
فرانس24/ أ ف ب","
                                        أوردت وكالة الفضاء الأمريكية (ناسا) السبت أن رائدي فضاء نقلتهما بوينغ إلى محطة الفضاء الدولية بداية حزيران/يونيو الماضي، لن يتمكنا من العودة في مركبة هذه الشركة، بعدما واجهت مشاكل عدة خلال تحليقها، وسوف يعودا إلى الأرض بمركبة تابعة لشركة ""سبايس إكس"" المنافسة المملوكة لإيلون ماسك في فبراير/شباط المقبل.                ",https://www.france24.com/ar/%D8%A3%D9%85%D8%B1%D9%8A%D9%83%D8%A7/20240825-%D9%85%D9%86-%D8%AB%D9%85%D8%A7%D9%86%D9%8A%D8%A9-%D8%A3%D9%8A%D8%A7%D9%85-%D8%A5%D9%84%D9%89-%D8%AB%D9%85%D8%A7%D9%86%D9%8A%D8%A9-%D8%A3%D8%B4%D9%87%D8%B1-%D8%AA%D8%A3%D8%AE%D8%B1-%D8%B9%D9%88%D8%AF%D8%A9-%D8%B1%D8%A7%D8%A6%D8%AF%D9%8A-%D9%81%D8%B6%D8%A7%D8%A1-%D8%A5%D9%84%D9%89-%D8%A7%D9%84%D8%A3%D8%B1%D8%B6-%D8%AD%D8%AA%D9%89-%D8%A7%D9%84%D8%B9%D8%A7%D9%85-%D8%A7%D9%84%D9%85%D9%82%D8%A8%D9%84,25/08/2024 - 22:35,"

                                    أمريكا
                            "
