,source,title,content,description,url,published_at,tags
0,France 24,"ماكرون يستقبل بايدن بمراسم ""فخمة"" في زيارة ستركز على الحرب في غزة وأوكرانيا","
استضاف الرئيس الفرنسي إيمانويل ماكرون السبت نظيره الأمريكي جو بايدن في زيارة دولة يجريها الأخير إلى فرنسا، بعد إحياء ذكرى إنزال الحلفاء في النورماندي، لاستحضار مقارنات بين الحرب العالمية الثانية والنزاع بين روسيا وأوكرانيا.
وانطلقت الزيارة باستقبال رسمي لبايدن عند قوس النصر بباريس قرابة الساعة 10,30 ت غ. وشارك الرئيسان وزوجتيهما في مراسم فخمة شملت عرضا عسكريا نظم في جادة الشانزليزيه.
ويريد الرئيسان من هذه الزيارة إظهار عودة الدفء إلى العلاقة بين واشنطن وباريس لسابق عهدها بعد سلسلة من التباينات خلال الأعوام الماضية. في هذا السياق، أكد المتحدث باسم مجلس الأمن القومي في البيت الأبيض جون كيربي الجمعة أن الطرفين يريدان إظهار أنهما ""أقرب مما كنا عليه في أي وقت مضى"".
وسيدلي الرئيسان السبت بتصريحات للصحافيين.
وستكون المحطة الفرنسية الزيارة الخارجية الأطول للديمقراطي بايدن في خضم حملته للانتخابات الرئاسية في نوفمبر/تشرين الثاني، والتي سيواجه فيه الجمهوري دونالد ترامب.
وكان بايدن وصل باريس الأربعاء، وانتقل إلى منطقة النورماندي بشمال غرب البلاد للمشاركة اعتبارا من الخميس في مراسم إحياء الذكرى الثمانين لإنزال الحلفاء الذي مهّد للانتصار على ألمانيا النازية عام 1944. وبعد الزيارة الرسمية السبت، سيزور بايدن المقبرة الأمريكية الأحد، قبل أن يغادر عائدا إلى بلاده.
ويتوقع أن تثير الزيارة انتقادات إضافية لماكرون المتهم أصلا من خصومه باستغلال محطات دبلوماسية هذا الأسبوع لخوض حملة للانتخابات الأوروبية المقررة في فرنسا الأحد.
ولن تغيب عن قمة ماكرون وبايدن القضايا الدولية الكبرى حيث تتطابق مواقف باريس وواشنطن إلى حد كبير، على رغم بعض التباينات، ومنها على سبيل المثال بشأن الحرب في غزة. في المقابل، تبقى مواقف البلدين متطابقة بشأن الحرب التي اندلعت في أوكرانيا مع بدء الغزو الروسي في أواخر فبراير/شباط 2022، خصوصا لجهة تكثيف الدعم الغربي لكييف.
وأكد ماكرون الجمعة إلى جانب نظيره فولوديمير زيلينسكي أنه يريد ""وضع اللمسات الأخيرة على تحالف"" الدول المستعدة لإرسال مدربين عسكريين إلى أوكرانيا، مؤكدا البدء المرتقب لتدريب طيارين أوكرانيين على مقاتلات ميراج 5-2000 الفرنسية.
وفي حين لا يتوقع أن تحذو واشنطن حذو باريس بإرسال مدربين عسكريين، تبقى الولايات المتحدة الداعم الأبرز لكييف على صعيد التسليح والمعدات العسكرية. فخلال اجتماع عُقد بين زيلينسكي وبايدن في باريس، أعلن الأخير مساعدة جديدة بقيمة 225 مليون دولار لأوكرانيا، مؤكدا أن ""الولايات المتحدة ستكون معكم دائما"".
وقال بايدن: ""أنتم لم تستسلموا""، مقدما ""اعتذاراته"" عن أشهر المفاوضات بين الديمقراطيين والجمهوريين التي سبقت إقرار الكونغرس حزمة مساعدات لأوكرانيا بأكثر من 60 مليار دولار. وكان بايدن أكد الخميس أن واشنطن ""لن تتخلى"" عن أوكرانيا. وقال خلال إحياء ذكرى الإنزال: ""لن نتخلى عنها لأنه إذا فعلنا فسيتم إخضاع أوكرانيا ولن ينتهي الأمر عند هذا الحد""، مضيفا: ""الدول المجاورة لأوكرانيا ستكون مهددة، كل أوروبا ستكون مهددة"".
وشهدت الأشهر الماضية تحسنا في العلاقات بين فرنسا والولايات المتحدة، لا سيما بين بايدن وماكرون شخصيا، بعد التوترات التي شهدتها في أعقاب فسخ أستراليا من دون سابق انذار في سبتمبر/أيلول 2021، عقدا ضخما للحصول على غواصات تعمل بالطاقة التقليدية من فرنسا، والاستعاضة عنه بشراء غواصات تعمل بالدفع النووي في تعاون مع الولايات المتحدة وبريطانيا.
وأعقبت ذلك أزمة دبلوماسية بين باريس وواشنطن كانت من الأكثر حدة بين الطرفين منذ عقود، قبل أن تعود العلاقات بين الحليفين التاريخيين تدريجياً إلى مسارها الطبيعي.
وقال كيربي إن ""من الأمور التي يحترمها ويقدّرها (بايدن) لدى الرئيس ماكرون هي قدرته على أن يكون صريحا وصادقا بقدر ما هو عليه. هذا ما نريد أن نراه لدى حليف وصديق: القدرة على الدخول مباشرة في صلب الموضوع وقول ما يفكر به"".
وفي مسعى لطي صفحة التوترات، كان ماكرون أول رئيس أجنبي يجري زيارة دولة إلى البيت الأبيض بعد تولي بايدن رئاسة الولايات المتحدة، وذلك في ديسمبر/كانون الأول 2022.
ووعدت واشنطن بالإعلان خلال الزيارة التي يتخللها غداء عمل ومأدبة عشاء رسمية، عن اتفاقات في مجال الأمن البحري في منطقة آسيا والمحيط الهادئ، وتعزيز الحلف الأطلسي إضافة إلى بحث الملفات التجارية. كما تم الحديث عن تعاون محتمل في مكافحة التغير المناخي.
فرانس24/ أ ف ب","
                                        استقبل الرئيس الفرنسي إيمانويل ماكرون السبت نظيره الأمريكي جو بايدن في مراسم ""فخمة"" عند قوس النصر بباريس تشمل عرضا بجادة الشانزليزيه. ومن المنتظر أن يتحادث الرئيسان حول قضايا عدة أبرزها الحرب بين حماس وإسرائيل والحرب في أوكرانيا، وتعزيز الحلف الأطلسي إضافة إلى بحث الملفات التجارية.                ",https://www.france24.com/ar/%D9%81%D8%B1%D9%86%D8%B3%D8%A7/20240608-%D9%81%D8%B1%D9%86%D8%B3%D8%A7-%D8%A7%D9%84%D9%88%D9%84%D8%A7%D9%8A%D8%A7%D8%AA-%D8%A7%D9%84%D9%85%D8%AA%D8%AD%D8%AF%D8%A9-%D8%B2%D9%8A%D8%A7%D8%B1%D8%A9-%D8%A8%D8%A7%D9%8A%D8%AF%D9%86-%D9%85%D8%A7%D9%83%D8%B1%D9%88%D9%86-%D8%AD%D8%B1%D8%A8-%D8%BA%D8%B2%D8%A9-%D8%A3%D9%88%D9%83%D8%B1%D8%A7%D9%86%D9%8A%D8%A7-%D8%A7%D8%B3%D8%B1%D8%A7%D8%A6%D9%8A%D9%84-%D8%B1%D9%88%D8%B3%D9%8A%D8%A7-%D8%AF%D8%A8%D9%84%D9%88%D9%85%D8%A7%D8%B3%D9%8A%D8%A9,08/06/2024 - 08:18,"

                                    فرنسا
                            "
1,France 24,من هم الرهائن الأربعة الذين حررهم الجيش الإسرائيلي في قطاع غزة وكيف تمت العملية؟,"
أعلن الجيش الإسرائيلي السبت أنه تمكن من تحرير 4 رهائن كانوا محتجزين في مخيم النصيرات بوسط قطاع غزة، فيما أكد مكتب الإعلام الحكومي التابع لحماس سقوط أكثر من 210 قتلى فلسطينيين وإصابة مئات آخرين برصاص إسرائيلي.
وقال الجيش الإسرائيلي في بيان إن الرهائن ""حالتهم الصحية جيدة""، موضحا أنهم خطفوا من مهرجان نوفا الموسيقي خلال هجوم حماس على جنوب إسرائيل في السابع من تشرين الأول/أكتوبر.
هم كالتالي: نوعا أرغماني (26 عاما) وألموع مئير (22) وأندري كوزلوف (27) وشلومي زيف (41) حرروا خلال ""عملية خاصة صعبة خلال النهار في النصيرات""، حسب تعبير الجيش الإسرائيلي.
وكان هؤلاء من بين 251 رهينة خطفوا في هجوم حماس، ما زال 116 منهم محتجزين في غزة، من بينهم 41 يقول الجيش إنهم لقوا حتفهم.
وأظهر مقطع فيديو نشر على مواقع التواصل الاجتماعي نوعا أرغماني تجتمع بوالدها، وبدا إسرائيليون على الشاطئ في تل أبيب يهتفون فرحا وهم يتلقون النبأ.
وأشاد ""منتدى عائلات الرهائن والمفقودين"" الذي يضغط على الحكومة الإسرائيلية للتوصل إلى اتفاق من شأنه إطلاق سراح الرهائن، بعملية الإنقاذ ووصفها بأنها ""انتصار معجزة"".
واعتبر نتانياهو السبت أن القوات الإسرائيلية ""أثبتت أن إسرائيل لا تستسلم للإرهاب وتتحرك بصورة مبتكرة وبشجاعة لا تعرف حدودا لإعادة رهائننا"".
كما نشر مكتبه مقطع فيديو له وهو يتحدث مع الرهينة السابقة أرغماني، التي قالت إنها ""متحمسة للغاية"" للعودة إلى منزلها، مضيفة ""لم أتحدث العبرية منذ وقت طويل"". وحسب المتحدث باسم الجيش الإسرائيلي دانيال هاغاري كانت أرغماني محتجزة في شقة بينما كان الثلاثة الآخرون معا في شقة أخرى قريبة.
ويواجه رئيس الوزراء بنيامين نتانياهو احتجاجات منتظمة تطالبه بالتوصل إلى اتفاق لإعادة الرهائن. وتزايدت الضغوط بعد أن استعادت القوات الإسرائيلية جثث سبعة رهائن من قطاع غزة الشهر الماضي.
أشار المتحدث باسم الجيش الإسرائيلي دانيال هاغاري إلى أن الرهائن تم احتجازهم في مبنيين في مخيم النصيرات بارتفاع ثلاثة إلى أربعة طوابق، معتبرا أنه كان ""من المستحيل الوصول إليهم بدون المرور عبر المدنيين"".
وأضاف في تصريحات في مؤتمر صحافي عبر الإنترنت ""كانت هناك عائلات وحراس"" في المبنيين.  ولفت إلى أن استهداف شقة واحدة فقط كان أمرا محفوفا بالمخاطر، ولهذا السبب تم إجراء عمليتين متزامنتين.
وتابع هاغاري ""لقد فاجأناهم في المبنى الذي فيه نوعا"" وهو اسم الرهينة، لكن فريق الإنقاذ تعرض لإطلاق نار في الشقة الأخرى التي كان فيها الرجال الثلاثة، وأصيب هناك ضابط شرطة إسرائيلي توفي متأثرا بجروحه.
واعتبر هاغاري أن ""الرسالة هذا الصباح إلى حماس واضحة: نحن عازمون على إعادة جميع الرهائن"".
وجاءت العملية رغم الضغوط الدولية المتزايدة على إسرائيل بعد غارة دامية على مدرسة تديرها الأمم المتحدة في النصيرات، كان يحتمي فيها نازحون.
من جهته، أعلن المكتب الإعلامي الحكومي الذي تديره حماس في غزة إن ""عدد ضحايا مجزرة الاحتلال الإسرائيلي في مخيم النصيرات ارتفع إلى 210 شهداء وأكثر من 400 جريح وهؤلاء وصلوا إلى مستشفيين، مستشفى العودة في النصيرات ومستشفى شهداء الأقصى بدير البلح"".
واتهمت حركة حماس في بيان القوات الإسرائيلية بارتكاب ""مجزرة وحشية في النصيرات""، داعية ""المجتمع الدولي والأمم المتحدة إلى اتخاذ موقف حقيقي من هذه الجرائم الممتدة... والعمل على وقفها، وتقديم مرتكبيها إلى العدالة"".
من جهته، تعهد رئيس المكتب السياسي لحركة حماس إسماعيل هنية بمواصلة القتال. وقال هنية في بيان ""الشعب الفلسطيني في غزة لن يستسلم والمقاومة ستواصل الدفاع عن حقوقنا في وجه هذا العدو المجرم"".

فرانس24/ أ ف ب","
                                        أعلن الجيش الإسرائيلي السبت تحرير 4 رهائن من مواطنيه كانوا محتجزين في قطاع غزة منذ هجوم حماس في السابع من أكتوبر/تشرين الأول. وقالت الحركة إن العملية قتل فيها أكثر من 210 من الفلسطينيين وأصيب المئات. واتهمت القوات الإسرائيلية بارتكاب ""جريمة وحشية"". فمن هم هؤلاء الرهائن الذين تم تحريرهم وكيف تمت العملية؟                ",https://www.france24.com/ar/%D8%A7%D9%84%D8%B4%D8%B1%D9%82-%D8%A7%D9%84%D8%A3%D9%88%D8%B3%D8%B7/20240608-%D9%85%D9%86-%D9%87%D9%85-%D8%A7%D9%84%D8%B1%D9%87%D8%A7%D8%A6%D9%86-%D8%A7%D9%84%D9%85%D8%AD%D8%B1%D8%B1%D9%88%D9%86-%D9%81%D9%8A-%D9%82%D8%B7%D8%A7%D8%B9-%D8%BA%D8%B2%D8%A9-%D9%88%D9%83%D9%8A%D9%81-%D8%A7%D9%84%D8%B9%D9%85%D9%84%D9%8A%D8%A9-%D8%A7%D9%84%D8%AC%D9%8A%D8%B4-%D8%AD%D9%85%D8%A7%D8%B3-%D9%81%D9%84%D8%B3%D8%B7%D9%8A%D9%86,08/06/2024 - 21:20,"

                                    الشرق الأوسط
                            "
2,France 24,مقتل شخص ثامن في أعمال الشغب التي تشهدها كاليدونيا الجديدة,,,https://www.france24.com/ar/%D9%81%D8%B1%D9%86%D8%B3%D8%A7/20240608-%D9%83%D8%A7%D9%84%D9%8A%D8%AF%D9%88%D9%86%D9%8A%D8%A7-%D8%A7%D9%84%D8%AC%D8%AF%D9%8A%D8%AF%D8%A9-%D8%AD%D8%B5%D9%8A%D9%84%D8%A9-%D8%A7%D9%84%D9%82%D8%AA%D9%84%D9%89-%D8%A7%D9%84%D8%AB%D9%85%D8%A7%D9%86%D9%8A%D8%A9-%D8%A7%D9%86%D8%AF%D9%84%D8%A7%D8%B9-%D8%A3%D8%B9%D9%85%D8%A7%D9%84-%D8%A7%D9%84%D8%B4%D8%BA%D8%A8-%D8%B6%D8%AD%D9%8A%D8%A9-%D8%B1%D8%B5%D8%A7%D8%B5-%D8%A7%D9%84%D8%AF%D8%B1%D9%83,,
3,France 24,في انتظار ترشح الرئيس الجزائري.. تساؤلات حول مواقف أحزاب الموالاة والمعارضة,,"
                                                في النبض المغاربي، نتوقف في الجزائر، عشية استدعاء الهيئة الناخبة للانتخابات الرئاسيّة المقرّرة في السابع من سبتمبر القادم. حتى الآن أعلن خمسة مرشحين نيتهم خوض السباق إلى قصر المرادية. لكن الرئيس عبد المجيد تبون لم يعلن حتى الآن ترشحه لفترة ثانية. في انتظار قراره، أعلنت مجموعة من الأحزاب دعمها لملف ترشحه للانتخابات. حول الموضوع  كان معنا من العاصمة الجزائرية الأستاذ والباحث في علم الاجتماع السياسي الدكتور ناصر جابي.                     ",https://www.france24.com/ar/%D8%A8%D8%B1%D8%A7%D9%85%D8%AC/%D8%A7%D9%84%D9%86%D9%82%D8%A7%D8%B4-%D8%A7%D9%84%D9%85%D8%BA%D8%A7%D8%B1%D8%A8%D9%8A/20240607-%D9%81%D9%8A-%D8%A7%D9%86%D8%AA%D8%B8%D8%A7%D8%B1-%D8%AA%D8%B1%D8%B4%D8%AD-%D8%A7%D9%84%D8%B1%D8%A6%D9%8A%D8%B3-%D8%A7%D9%84%D8%AC%D8%B2%D8%A7%D8%A6%D8%B1%D9%8A-%D8%AA%D8%B3%D8%A7%D8%A4%D9%84%D8%A7%D8%AA-%D8%AD%D9%88%D9%84-%D9%85%D9%88%D8%A7%D9%82%D9%81-%D8%A3%D8%AD%D8%B2%D8%A7%D8%A8-%D8%A7%D9%84%D9%88%D8%A7%D9%84%D8%A7%D8%A9-%D9%88%D8%A7%D9%84%D9%85%D8%B9%D8%A7%D8%B1%D8%B6%D8%A9,08/06/2024 - 00:00,"

                                    الأخبار المغاربية
                            "
4,France 24,عباس يدعو لاجتماع طارئ لمجلس الأمن عقب قصف دام بالنصيرات في غزة ونتانياهو يناشد غانتس عدم الاستقالة,"
أهم الأحداث




فرانس24/ أ ف ب/ رويترز","
                                        أعلن الجيش الإسرائيلي السبت تحرير 4 رهائن كانوا محتجزين في غزة بعد ""عملية مركبة""، شارك فيها مئات الجنود، بمخيم النصيرات وسط القطاع، فيما أكد مكتب الإعلام الحكومي التابع لحماس سقوط أكثر من 210 قتلى فلسطينيين وإصابة مئات آخرين برصاص إسرائيلي في هذه العملية. ولاحقا، دعا الرئيس الفلسطيني محمود عباس لاجتماع طارئ لمجلس الأمن عقب ""المجزرة الدموية"" التي ارتكبتها إسرائيل بمخيم النصيرات. من جهته، أجل بيني غانتس إصدار بيان كان يتوقع أن يعلن فيه استقالته من حكومة نتانياهو الذي ناشده التخلي عن ذلك.                ",https://www.france24.com/ar/%D8%A7%D9%84%D8%B4%D8%B1%D9%82-%D8%A7%D9%84%D8%A3%D9%88%D8%B3%D8%B7/20240608-%D9%85%D8%A8%D8%A7%D8%B4%D8%B1-%D8%A7%D8%AE%D8%B1-%D8%A7%D8%AE%D8%A8%D8%A7%D8%B1-%D9%82%D8%B7%D8%A7%D8%B9-%D8%BA%D8%B2%D8%A9-%D8%AD%D9%85%D8%A7%D8%B3-%D9%83%D8%AA%D8%A7%D8%A6%D8%A8-%D8%A7%D9%84%D9%82%D8%B3%D8%A7%D9%85-%D8%AD%D8%B2%D8%A8-%D8%A7%D9%84%D9%84%D9%87-%D9%84%D8%A8%D9%86%D8%A7%D9%86-%D8%A7%D8%B3%D8%B1%D8%A7%D8%A6%D9%8A%D9%84-%D9%85%D8%B9%D8%A7%D8%B1%D9%83-%D8%AD%D8%B1%D8%A8-%D9%87%D8%AF%D9%86%D8%A9,08/06/2024 - 06:56,"

                                    الشرق الأوسط
                            "
5,France 24,الإيطاليون والسلوفاكيون  يدلون بأصواتهم في الانتخابات الأوروبية,"
توجه الناخبون في إيطاليا وسلوفاكيا السبت إلى صناديق الاقتراع للإدلاء بأصواتهم في اليوم ما قبل الأخير من انتخابات البرلمان الأوروبي.
وكانت الانتخابات الأوروبية التي تستمر أربعة أيام انطلقت الخميس في هولندا. وتُجري دول الاتحاد البالغ عددها 27، من بينها ألمانيا وفرنسا أكبر قوتين اقتصاديتين، الانتخابات الأحد.
وأصبحت إيطاليا أول دولة كبرى تصوت ضمن هذه الانتخابات لاختيار أعضاء البرلمان الأوروبي، في اقتراع يشكل اختبارا لمدى قوة موقع رئيسة الوزراء جورجيا ميلوني وهي من اليمين المتطرف، في الداخل وتأثيرها في المستقبل داخل التكتل.
وأحد المؤشرات الرئيسية لتشكيلة البرلمان الجديد سيخرج من إيطاليا، ثالث أكبر اقتصاد في الاتحاد الأوروبي يقوده ائتلاف بزعامة حزب رئيسة الوزراء جورجيا ميلوني، فراتيلي ديتاليا. وتشغل إيطاليا 76 من أصل 720 مقعدا في البرلمان الجديد.
وقالت ميلوني بعد الإدلاء بصوتها في روما إن الانتخابات الأوروبية ""ستحدد معالم السنوات الخمس المقبلة"". وكانت رئيسة الوزراء حاضرة بشدة في وسائل الإعلام المحلية قبيل الانتخابات، ولا سيما عبر تصوير نفسها حصنا ضد الهجرة غير الشرعية، القضية التي تجذب الكثير من الأصوات نحو اليمين المتطرف.
وصوت الناخبون في سلوفاكيا في اليوم نفسه مع إيطاليا. ولايزال البلد تحت وقع محاولة اغتيال استهدفت رئيس الوزراء روبرت فيكو في 15 مايو/أيار.
وقبل ساعات على بدء مرحلة الصمت الانتخابي، نشر فيكو مقطع فيديو على حسابه في فيس بوك قال فيه إن مهاجمه ""كان مجرد رسول للشر والكراهية السياسية التي طورتها المعارضة"".
وفي منشور على فيس بوك نشر فيكو صورة له وهو يدلي بصوته من سريره في المستشفى. وحض الناخبين على ""انتخاب أعضاء في البرلمان الأوروبي يؤيدون جهود السلام وليس استمرار الحرب"".
ويعارض حزبه الذي وظف الهجوم في حملته الانتخابية، إمدادات الأسلحة الأوروبية لأوكرانيا، ويقول إنه ""حزب السلام"" ويهاجم ""دعاة الحرب"" في عاصمة الاتحاد. وتشهد سلوفاكيا عادة نسبة مشاركة منخفضة في الانتخابات القارية. ففي 2019، بلغت نسبة الاقتراع 22 بالمئة فقط.
على المستوى العام، رجحت استطلاعات الرأي التي سبقت الانتخابات احتمال فوز الأحزاب اليمينية المتطرفة بنحو ربع مقاعد البرلمان الأوروبي المقبل البالغ عددها 720.
ففي هولندا حيث جرت الانتخابات الخميس، حل الحزب المناهض للهجرة بزعامة اليميني المتطرف خيرت فيلدرز في المرتبة الثانية، بحسب استطلاعات الرأي أمام مراكز الاقتراع. والحزب عضو في الائتلاف الجديد الحاكم.
وحقيقة أن أداء الأحزاب الهولندية المؤيدة لأوروبا كان أفضل من المتوقع، جاء بمثابة دعم للوسطيين الذين يأملون وقف صعود اليمين المتطرف.
ويُتوقع أن يكون ""حزب الشعب الأوروبي"" المحافظ بزعامة فون دير لاين و""التحالف التقدمي للاشتراكيين والديمقراطيين"" من يسار الوسط أكبر قوتين سياسيتين في البرلمان.

فرانس24/ أ ف ب","
                                        أدلى الناخبون في إيطاليا وسلوفاكيا السبت بأصواتهم في الانتخابات الأوروبية. وكانت هولندا قد استهلت الخميس هذا الاقتراع الذي يستمر أربعة أيام. على أن تُجري دول الاتحاد البالغ عددها 27، وعلى رأسها فرنسا وألمانيا أكبر قوتين اقتصاديتين، هذه الانتخابات الأحد.                ",https://www.france24.com/ar/%D8%A3%D9%88%D8%B1%D9%88%D8%A8%D8%A7/20240608-%D8%A7%D9%84%D8%B3%D9%84%D9%88%D9%81%D8%A7%D9%83%D9%8A%D9%88%D9%86-%D9%88%D8%A7%D9%84%D8%A5%D9%8A%D8%B7%D8%A7%D9%84%D9%8A%D9%88%D9%86-%D9%8A%D8%AA%D9%88%D8%AC%D9%87%D9%88%D9%86-%D8%A5%D9%84%D9%89-%D8%B5%D9%86%D8%A7%D8%AF%D9%8A%D9%82-%D8%A7%D9%84%D8%A7%D9%82%D8%AA%D8%B1%D8%A7%D8%B9-%D9%84%D9%84%D8%AA%D8%B5%D9%88%D9%8A%D8%AA-%D9%81%D9%8A-%D8%A7%D9%84%D8%A7%D9%86%D8%AA%D8%AE%D8%A7%D8%A8%D8%A7%D8%AA-%D8%A7%D9%84%D8%A3%D9%88%D8%B1%D9%88%D8%A8%D9%8A%D8%A9,08/06/2024 - 11:33,"

                                    أوروبا
                            "
