,source,title,content,description,url,published_at,tags
13,France 24,أبرزهم كامالا هاريس... من هم البدلاء المحتملون لخلافة بايدن في السباق الرئاسي؟,"
تطرح عدة تساؤلات حول هوية الشخص البديل الذي يمكن أن يحل مكان الرئيس الأمريكي جو بايدن، إثر قرار انسحابه من السباق نحو البيت الأبيض، إذ أصبحت التذكرة الرئاسية للحزب الديموقراطي الذي سيسارع إلى إيجاد مرشّح بديل متاحة.
في ما يلي نظرة على البدلاء المحتملين:
تبدو نائبة الرئيس كامالا هاريس الخيار الأكثر بديهية. فهاريس التي رافقت بايدن منذ أدائه اليمين الدستورية في كانون الثاني/يناير 2021، في وضعية جيدة لتكون حاملة لواء الحزب الديموقراطي.
هاريس البالغة 59 عاما هي ابنة لأب جامايكي وأم هندية، وكانت أول شخص أسود وأول امرأة تشغل منصب المدعي العام لولاية كاليفورنيا، كما كانت أول عضو في مجلس الشيوخ الأميركي من أصول جنوب آسيوية. وهي الآن أول امرأة وأول سوداء تتولى منصب نائب الرئيس.
خلال مسيرتها المهنية كمدعية عامة، اشتهرت هاريس بصرامتها، وهي سمة يمكن التعويل عليها في حملة من المتوقع أن تركز على الجريمة والهجرة.
لكن بعض الديموقراطيين التقدميين وجّهوا انتقادات لسجل عقوباتها الصارمة للمخالفين القصر، معتبرين أنها تؤثر بشكل غير متناسب على الأقليات.
إلى ذلك، لا تحظى هاريس بمعدلات تأييد مرتفعة، ما قد يدفع الديموقراطيين إلى البحث عن شخصية أخرى لترشيحها للرئاسة.
ما من قاعدة تنص على حلول المرشح لمنصب نائب الرئيس تلقائيا محل المرشح الرئاسي في حال انسحابه.
وهذا الديموقراطي البالغ 56 عاما هو رئيس سابق لبلدية سان فرانسيسكو وحاكم ولاية كاليفورنيا منذ خمسة أعوام، وقد جعلها ملاذا متاحا لعمليات الإجهاض.
دعم نيوسوم بايدن بثبات ورفض الحديث عن استبداله قبل انسحاب الزعيم الديموقراطي من السباق، لكنه لم يخف طموحاته الرئاسية.
في الأشهر الأخيرة، رفع وتيرة سفراته الدولية، وكثّف الترويج لسجلّه وقد استثمر ملايين الدولارات في لجنة للعمل السياسي، ما أثار تكهنات بأنه سيترشح في العام 2028. فلم لا في العام 2024؟
مرشحة ديموقراطية أخرى محتملة هي غريتشن ويتمر، حاكمة ميشيغان البالغة 52 عاما.
عدد كبير من سكان الولاية هم من الطبقة العاملة مع مجتمعات رئيسية للسود والعرب، وكلها مجموعات أساسية من الناخبين الذين يسعى بايدن لاستمالتهم.
ويتمر من أشد منتقدي ترامب، وقد استهدفت بمخطط للخطف أعدته مجموعة يمينية متطرفة.
ستكون ميشيغان واحدة من الولايات الحاسمة في الانتخابات الرئاسية المقررة في الخامس من تشرين الثاني/نوفمبر، وهي حجة قوية، وفقا لمؤيديها، لترشيحها للرئاسة.
يقود حاكم ولاية بنسلفانيا جوش شابيرو أكبر ولاية متأرجحة في سباق تشرين الثاني/نوفمبر.
شابيرو البالغ 51 عاما انتُخب في تشرين الثاني/نوفمبر 2022 بفوز مقنع حقّقه على منافس محافظ وتولى منصبه في أوائل العام 2023، وسبق أن انتُخب مرتين مدعيا عاما للولاية.
وأدان شابيرو رجال دين كاثوليك اعتدوا جنسيا على آلاف الأطفال وحاكم شركة بيرديو فارما المصنعة لمسكّن الألم الأفيوني القوي أوكسيكونتين.
شابيرو معروف بأسلوبه الخطابي الفاعل وهو وسطي، وهي صفات يمكن أن تحمله إلى الرئاسة.
من بين الأسماء الأخرى المتداولة حاكم إلينوي جاي بي بريتزكر وحاكم ميريلاند ويس مور وحاكم كنتاكي آندي بشير، لكن فرصهم حتى الآن تبدو محدودة.
كذلك يتم تداول اسمي السناتور إيمي كلوبوشار ووزير النقل بيت بوتيجيج، وهما واجها بايدن في الانتخابات التمهيدية للعام 2020.
","
                                        بعد قرار الرئيس الأمريكي جو بايدن الأحد انسحابه من السباق الرئاسي لولاية ثانية بالبيت الأبيض، تطفو إلى السطح عدة أسماء يحتمل خوضها المنافسة باسم الحزب الديمقراطي الذي شدد على أنه سيتبع عملية ""شفافة ومنظمة"" لاختيار مرشحه. وإذا كانت نائبة الرئيس كامالا هاريس الخيار الأكثر بديهية، فلا يستبعد أيضا إمكانية اختيار شخصيات أخرى تحظى بثقة بايدن والديمقراطيين، أغلبها يشغل منصب حاكم ولاية.                ",https://www.france24.com/ar/%D8%A3%D9%85%D8%B1%D9%8A%D9%83%D8%A7/20240721-%D8%A3%D8%A8%D8%B1%D8%B2%D9%87%D9%85-%D9%83%D8%A7%D9%85%D8%A7%D9%84%D8%A7-%D9%87%D8%A7%D8%B1%D9%8A%D8%B3-%D9%85%D9%86-%D9%87%D9%85-%D8%A7%D9%84%D8%A8%D8%AF%D9%84%D8%A7%D8%A1-%D8%A7%D9%84%D9%85%D8%AD%D8%AA%D9%85%D9%84%D9%88%D9%86-%D9%84%D8%AE%D9%84%D8%A7%D9%81%D8%A9-%D8%A8%D8%A7%D9%8A%D8%AF%D9%86-%D9%81%D9%8A-%D8%A7%D9%84%D8%B3%D8%A8%D8%A7%D9%82-%D8%A7%D9%84%D8%B1%D8%A6%D8%A7%D8%B3%D9%8A,21/07/2024 - 22:58,"

                                    أمريكا
                            "
