,source,author,title,content,description,url,image_url?,published_at,tags
26,France 24,No Author,"فرنسا: رئيس الوزراء يغازل اليمين المتطرف بعد تصريحات عن ""إغراق"" المهاجرين للبلاد","
لم يكن ينتظر رئيس الحكومة الفرنسية الجديد فرانسوا بايروا أن يفتح جبهة صراع سياسية جديدة مع الحزب الاشتراكي واليسار بشكل عام وقسم من حلفائه بعدما صرح بأن المهاجرين ""يغرقون"" فرنسا.
وقال بايرو مساء الإثنين عبر قناة ""إل إس آي"" إن ""التدفقات الأجنبية إيجابية بالنسبة إلى أي شعب، شرط ألا تتجاوز حدا معينا (...) فمنذ اللحظة التي تشعر فيها بأنك تغرق، وبأنك لم تعد تعرف بلدك أو أساليب الحياة فيه أو ثقافته، فإنك ترفض ذلك"".
وأثارت هذه التصريحات سخطا في صفوف معسكر اليسار وقسم من حلفائه. ما أدى بايرو إلى الدفاع عن نفسه وشرح موقفه أكثر. إذ قال بأن ""فرنسا لم تتجاوز هذه العتبة،  لكن ""نحن نقترب"" منها، مضيفا أن ""عددا من المدن والمناطق (لديها حاليا) هذا الشعور"".
وتعليقا على هذه التصريحات، اعتبر وزير الداخلية اليميني المتشدد برونو روتايو، وهو عضو في حزب الجمهوريون، أن ""رئيس الوزراء سوّغ السياسة التي أرغب في اتباعها"".
بدوره، اعتبر وزير العدل جيرالد دارمانان المنتمي إلى حزب النهضة الرئاسي، أن ""إقدام رجل وسطي معتدل متوازن بعد شهر ونصف  في ماتينيون (مقر رئاسة الوزراء) على التصريح بأن هناك نسبة من الأجانب لا يجب تجاوزها على التراب الوطني، يعد خطوة إلى الأمام"".
وأشاد نائب رئيس حزب الجبهة الوطنية سيباستيان شينو بهذا ""الانتصار في المعركة الإيديولوجية"". أما رئيسة كتلة الحزب في الجمعية الوطنية مارين لوبان، فقالت إنها تنتظر أن يتخذ فرانسوا بايرو ""إجراءات تبعا للاستنتاجات"" التي خلص إليها. لكن تصريحات رئيس الوزراء كان لها وقع الصدمة لدى الجناح اليساري في المعسكر الرئاسي.
وقالت رئيسة الجمعية الوطنية يائيل براون بيفيه: ""لم أكن لأدلي بهذه التصريحات أبدا وهي تزعجني. نحن نتحدث عن رجال ونساء، عن بلادنا فرنسا التي لطالما استضافت وبنت على هذا التقليد من خلال تاريخها وجغرافيتها وثقافتها"".أما الانتقادات من اليسار فكانت أشد.
وقالت رئيسة كتلة الخضر في الجمعية الوطنية سيريل شاتلين إنها ""صدمت بشدة"" من تصريحات بايرو ""المخزية""، معتبرة أنها تعكس ""فكرة خاطئة يروج لها اليمين المتطرف"".
ووصفت رئيسة كتلة حزب فرنسا الأبية ماتيلد بانو وجهة النظر بشأن الهجرة التي يتبناها روتايو وحلفاؤه بأنها ""عنصرية"".
وقال رئيس كتلة الاشتراكيين في الجمعية الوطنية بوريس فالو: ""نحن لا نستعير عبارات أو هوامات اليمين المتطرف""، معتبرا تصريحات بايرو ""شائنة"".
ولفت فالو إلى أن تصريحات بايرو من شأنها ""التأثير"" على قرار حزبه دعم رئيس الوزراء في تصويت مستقبلي لحجب الثقة عنه.
وقال بايرو ردا على سؤال حول تصريحاته خلال جلسة مساءلة في الجمعية الوطنية الثلاثاء، إنه متمسك باختياره للمصطلحات.
وأشار إلى إقليم مايوت الفرنسي في المحيط الهندي، والذي يواجه هجرة مكثفة غير نظامية من جزر القمر المجاورة.

وأضاف رئيس الوزراء: ""أي شخص يتابع الوضع في مايوت، وهي ليست الوحيدة في فرنسا، يمكنه أن يفهم أن الإغراق هو المصطلح الأكثر ملاءمة"".
وقال أمام النواب إن ""مجتمعا بأكمله في المقاطعة الفرنسية يواجه موجات من الهجرة غير الشرعية التي تصل في بعض الأحيان إلى 25% من السكان"".
وتابع: ""ليست الكلمات هي التي تثير الصدمة، بل الواقع هو الذي يثيرها"".
وبحسب المعهد الفرنسي للإحصاء، بلغ عدد الأجانب المقيمين في فرنسا عام 2023 نحو 5,6 ملايين شخص، أي 8,2 % من إجمالي السكان، مقارنة بـ6,5 % في العام 1975، وهي ""زيادة صغيرة"".
يواجه فرانسوا بايرو الذي عُيِّن في 13 كانون الأول/ديسمبر، جمعية وطنية منقسمة إلى ثلاث كتل لا تحظى أي منها بغالبية مطلقة: تحالف اليسار، والحزب الرئاسي والوسطيين، واليمين المتطرف.

فرانس24/أ ف ب","
                                        تعرّض رئيس الوزراء الفرنسي فرانسوا بايرو (رئيس حزب الحركة الديمقراطية) لانتقادات من اليسار وقسم من حلفائه بعدما صرح مساء الإثنين بوجود شعور متزايد بأن المهاجرين ""يغرقون"" فرنسا. هذه التصريحات لاقت قبولا لدى حزب التجمع الوطني اليميني المتطرف. لكن بايرو عاد ليؤكد بأن فرنسا لم تتجاوز هذه العتبة بعد لكن ""نحن نقترب"" منها، مضيفا أن ""عددا من المدن والمناطق (لديها حاليا) هذا الشعور"".                ",https://www.france24.com/ar/%D9%81%D8%B1%D9%86%D8%B3%D8%A7/20250128-%D9%81%D8%B1%D9%86%D8%B3%D8%A7-%D8%B1%D8%A6%D9%8A%D8%B3-%D8%A7%D9%84%D8%AD%D9%83%D9%88%D9%85%D8%A9-%D9%8A%D8%BA%D8%A7%D8%B2%D9%84-%D8%A7%D9%84%D9%8A%D9%85%D9%8A%D9%86-%D8%A7%D9%84%D9%85%D8%AA%D8%B7%D8%B1%D9%81-%D8%A8%D8%B9%D8%AF-%D8%AA%D8%B5%D8%B1%D9%8A%D8%AD%D8%A7%D8%AA-%D8%B9%D9%86-%D8%A5%D8%BA%D8%B1%D8%A7%D9%82-%D8%A7%D9%84%D9%85%D9%87%D8%A7%D8%AC%D8%B1%D9%8A%D9%86-%D9%84%D9%81%D8%B1%D9%86%D8%B3%D8%A7,https://s.france24.com/media/display/8458e900-b9e3-11ef-8050-005056a97e36/w:720/p:16x9/000_36QA2TX.jpg,No Published Date,فرنسا
27,France 24,No Author,متحف اللوفر في باريس يطالب بمساعدة حكومية عاجلة لترميمه وتجديد قاعاته الفنية,"

في رسالة وجهتها رئيسة اللوفر، المتحف الأكثر زيارة في العالم، لورانس دي كار إلى وزيرة الثقافة الفرنسية رشيدة داتي وكشفت عنها صحفية لو بارزيان اليومية الجمعة، طلب متحف اللوفر مساعدة عاجلة من الحكومة الفرنسية لترميم وتجديد قاعات العرض العريقة فيه وتعزيز حماية الأعمال الفنية التي يضمها، والتي من أبرزها لوحة الموناليزا لليوناردو دافنشي.
وحذرت دي كار، في رسالتها، من تدهور حالة المبنى الذي يعود تاريخه إلى ثمانية قرون مضت، مشيرة إلى مشاكل تتعلق بتسرب المياه ""وتقلبات مقلقة في درجات الحرارة تهدد سلامة الأعمال الفنية"".
بُني قصر اللوفر بباريس في أواخر القرن الثاني عشر، وظل مقر الإقامة الرسمي لملوك فرنسا لعدة قرون إلى أن تخلى عنه الملك لويس الرابع عشر واتجه إلى قصر فرساي. وفي عام 1793، تحول إلى متحف لعرض مجموعة من الأعمال الفنية الملكية.
في العام الماضي، استقبل اللوفر 8.7 مليون زائر دخلوا جميعا عبر المدخل الغربي ذي الشكل الهرمي الذي صممه المعماري يو مينغ باي، والذي صار مشكلة في حد ذاته، إذ تجعل سخونة الهواء بداخله مدخل اللوفر تحت الأرض شديد الحرارة خلال الصيف.
وذكرت دي كار في رسالتها أن زيارة اللوفر أصبحت ""مشقة جسدية""، إذ يصعب على الزوار الوصول إلى الأعمال الفنية لعدم كفاية اللافتات ونقص المناطق المخصصة للراحة، بالإضافة إلى عدم كفاية مرافق تناول الغذاء والمرافق والصحية.
صمم اللوفر لاستقبال أربعة ملايين زائر سنويا، إلا أنه شهد إقبالا غير مسبوق بزيارة 10.2 مليون زائر في 2018. لكن دي كار التي عُينت في 2021 وضعت حدا أقصى للزوار يبلغ 30 ألفا في اليوم تجنبا للازدحام.
ولم تتطرق رسالة دي كار إلى حجم التمويل، لكن قناة بي.إف. إم التلفزيونية ذكرت أن تكاليف التجديد قد تصل إلى 500 مليون يورو (520 مليون دولار)، وهو ما يشكل تحديا لحكومة الرئيس إيمانويل ماكرون التي تجد صعوبة في الحصول على موافقة البرلمان على ميزانيتها لعام 2025.
وأفادت لو باريزيان بأن المحادثات جارية بين مكتب ماكرون ووزارة الثقافة واللوفر. وأكد مصدر مطلع أن ""الرئيس يتابع هذه المسألة باهتمام منذ شهور"". ولم ترد وزارة الثقافة بعد على طلب للتعليق.
بعد انتخاب ماكرون لأول مرة في 2017، ألقى خطاب فوزه أمام متحف اللوفر، كما كان لحدائق التويلري المحيطة بالمتحف دور مهم خلال دورة الألعاب الأولمبية بباريس في 2024.
وإضافة إلى التجديد الشامل، تدرس إدارة المتحف بناء جناح جديد للوحة الموناليزا وإنشاء مدخل جديد بالجانب الشرقي لتخفيف الازدحام عند المدخل الهرمي.


فرانس24/ رويترز","
                                        طلبت إدارة متحف اللوفر في باريس ممثلة في رئيسته لورانس دي كار مساعدة حكومية عاجلة لترميم القصر الملكي الذي يعود تاريخه للقرن الثاني عشر الميلادي. وأرسلت دي كار رسالة لوزيرة الثقافة الفرنسية رشيدة داتي تحذر فيها من تدهور حالة المبنى الذي يستقبل أكثر من 9 ملايين زائر سنويا ويعمل فوق طاقته الاستيعابية المقدرة بأربعة ملايين زائر. ومن المتوقع أن تبلغ كلفة عمليات التجديد 500 مليون يورو وهو ما يزيد الأعباء المالية على الحكومة.                ",https://www.france24.com/ar/%D9%81%D8%B1%D9%86%D8%B3%D8%A7/20250124-%D9%85%D8%AA%D8%AD%D9%81-%D8%A7%D9%84%D9%84%D9%88%D9%81%D8%B1-%D9%81%D9%8A-%D8%A8%D8%A7%D8%B1%D9%8A%D8%B3-%D9%8A%D8%B7%D8%A7%D9%84%D8%A8-%D8%A8%D9%85%D8%B3%D8%A7%D8%B9%D8%AF%D8%A9-%D8%AD%D9%83%D9%88%D9%85%D9%8A%D8%A9-%D8%B9%D8%A7%D8%AC%D9%84%D8%A9-%D9%84%D8%AA%D8%B1%D9%85%D9%8A%D9%85%D9%87-%D9%88%D8%AA%D8%AC%D8%AF%D9%8A%D8%AF-%D9%82%D8%A7%D8%B9%D8%A7%D8%AA%D9%87-%D8%A7%D9%84%D9%81%D9%86%D9%8A%D8%A9,https://s.france24.com/media/display/0bcd188a-61ae-11eb-a4dd-005056a964fe/w:720/p:16x9/tourism-parigi_0.jpeg,No Published Date,فرنسا
